num,name,price,type,star,sold,from,img_src,url
354,ถั่วลิสง Longyan◕℗❍บิบิซานถั่วลิสงลองยานในเปลือกถั่วลิสงกระเทียมห้าเครื่องเทศปรุงสุกขนมหลากรสเมล็ดคั่วและถั่วยามว่าง,฿208,general,0.0,no sold,จังหวัดกรุงเทพมหานคร,https://cf.shopee.co.th/file/7ccee8e9dfc1aa5ca9763321762ec3b8_tn,https://shopee.co.th//ถั่วลิสง-Longyan◕℗❍บิบิซานถั่วลิสงลองยานในเปลือกถั่วลิสงกระเทียมห้าเครื่องเทศปรุงสุกขนมหลากรสเมล็ดคั่วและถั่วยามว่าง-i.433135412.9754489180
355,"seeds seed ✳เมล็ดกระเทียมสีแดงปีที่สี่ฤดูกาลของใบแข็ง, เมล็ดกระเทียม, กระเทียมหัวแดง, สามระเบียงติดต่อกันกระถางต้นไม้☝",฿116,general,0.0,no sold,จังหวัดลำพูน,https://cf.shopee.co.th/file/9069449e849b309dc0950cde49ba2b75_tn,https://shopee.co.th//seeds-seed-✳เมล็ดกระเทียมสีแดงปีที่สี่ฤดูกาลของใบแข็ง-เมล็ดกระเทียม-กระเทียมหัวแดง-สามระเบียงติดต่อกันกระถางต้นไม้☝-i.430430423.9054663372
356,✸№✹ถั่วลิสงเครื่องเทศซานตงถั่วลิสงหลากรสกระเทียมและนม 250 กรัมเมล็ดและถั่วคั่ว 1 กิโลกรัมขนมและไวน์ขายส่ง,฿88,general,0.0,no sold,จังหวัดกรุงเทพมหานคร,https://cf.shopee.co.th/file/409ce1a9272eb181b11651d997a93f2b_tn,https://shopee.co.th//✸№✹ถั่วลิสงเครื่องเทศซานตงถั่วลิสงหลากรสกระเทียมและนม-250-กรัมเมล็ดและถั่วคั่ว-1-กิโลกรัมขนมและไวน์ขายส่ง-i.425670953.8956194938
357,❖✙ถั่วลิสง Kalu Longyan 210g * 12 ซองขายส่งกระเทียมและถั่วลิสงหลากรสเมล็ดคั่วและถั่วซุปเปอร์มาร์เก็ตขนมร้านสะดวกซื้อ,฿386,general,0.0,no sold,จังหวัดกรุงเทพมหานคร,https://cf.shopee.co.th/file/7fff86e6033ae65a0759990c26a08862_tn,https://shopee.co.th//❖✙ถั่วลิสง-Kalu-Longyan-210g-*-12-ซองขายส่งกระเทียมและถั่วลิสงหลากรสเมล็ดคั่วและถั่วซุปเปอร์มาร์เก็ตขนมร้านสะดวกซื้อ-i.425664941.8856182915
358,₪☜▼สามารถอยู่ในเตาแขวนถั่วลิสง 158 กรัม * 6 ถุงรสกระเทียมเตาแขวนถั่วลิสงคั่วเมล็ดคั่วและถั่วขนมไหว้ตรุษจีน,฿263,general,0.0,no sold,จังหวัดกรุงเทพมหานคร,https://cf.shopee.co.th/file/79c81072631e6e9aa04157bf1f7cc3e6_tn,https://shopee.co.th//₪☜▼สามารถอยู่ในเตาแขวนถั่วลิสง-158-กรัม-*-6-ถุงรสกระเทียมเตาแขวนถั่วลิสงคั่วเมล็ดคั่วและถั่วขนมไหว้ตรุษจีน-i.423729694.8657132961
359,☍✹❉Ganyuan ถั่วเขียวรสกระเทียมเนื้อเผ็ดรสดั้งเดิมถั่วเขียวบรรจุภัณฑ์ขนาดเล็กขนมสำนักงานแบบสบาย ๆ เมล็ดคั่ว,฿177 - ฿579,general,0.0,no sold,จังหวัดกรุงเทพมหานคร,https://cf.shopee.co.th/file/f67794c949df5815762d2bbab7140aae_tn,https://shopee.co.th//☍✹❉Ganyuan-ถั่วเขียวรสกระเทียมเนื้อเผ็ดรสดั้งเดิมถั่วเขียวบรรจุภัณฑ์ขนาดเล็กขนมสำนักงานแบบสบาย-ๆ-เมล็ดคั่ว-i.424328407.8657130313
360,อาหารว่าง♞❇รสนมลาวเจียโข่ว / ถั่วลิสงรสกระเทียม 420gx4 ถุงถั่วลิสงต้มคาราเมลขนมเปลือกถั่วเมล็ดคั่ว และถั่ว 200g,฿207 - ฿481,general,0.0,no sold,จังหวัดกรุงเทพมหานคร,https://cf.shopee.co.th/file/3199b3cf0def2e822e6a21b4305c82f5_tn,https://shopee.co.th//อาหารว่าง♞❇รสนมลาวเจียโข่ว-ถั่วลิสงรสกระเทียม-420gx4-ถุงถั่วลิสงต้มคาราเมลขนมเปลือกถั่วเมล็ดคั่ว-และถั่ว-200g-i.433215998.8456261096
361,"►▫☁ถั่วลิสงของ Jinhaiyu, กระเทียมตุ๋น, ถั่วลิสงในเปลือก, ถั่วหลากรส, เมล็ดคั่วและถั่วของว่าง",฿453,general,0.0,no sold,จังหวัดกรุงเทพมหานคร,https://cf.shopee.co.th/file/1113a1eed011ee352498f4ee58868c18_tn,https://shopee.co.th//►▫☁ถั่วลิสงของ-Jinhaiyu-กระเทียมตุ๋น-ถั่วลิสงในเปลือก-ถั่วหลากรส-เมล็ดคั่วและถั่วของว่าง-i.423711234.4489421958
362,▩∈☾[ซื้อ 100 ซองได้ ซอง] รสกระเทียมถั่วลันเตาอเมริกัน ขนมถั่วห่อเล็กถั่วพักผ่อนและเมล็ดคั่ว,฿235,general,0.0,no sold,จังหวัดกรุงเทพมหานคร,https://cf.shopee.co.th/file/6b88158b5c87148de09a242838fe9977_tn,https://shopee.co.th//▩∈☾-ซื้อ-100-ซองได้-ซอง-รสกระเทียมถั่วลันเตาอเมริกัน-ขนมถั่วห่อเล็กถั่วพักผ่อนและเมล็ดคั่ว-i.429597926.8352841763
363,富生2908พื้นที่หลั่งสีเขียว อุดมไปด้วย ความภาคภูมิใจของสมบัติต่อต้านคนรวย6 11ไม่มีครับ ไม่เฉยๆกระเทียมเมล็ด,"฿1,296 - ฿3,118",general,0.0,no sold,จังหวัดกรุงเทพมหานคร,https://cf.shopee.co.th/file/716532950aaf04b08025f5642f957de5_tn,https://shopee.co.th//富生2908พื้นที่หลั่งสีเขียว-อุดมไปด้วย-ความภาคภูมิใจของสมบัติต่อต้านคนรวย6-11ไม่มีครับ-ไม่เฉยๆกระเทียมเมล็ด-i.366468994.9808425631
364,盆栽Free home deliveryใหม่กระเทียมรากต้นกล้าตอนนี้ขุดกระเทียมเมล็ดต้นกล้าระเบียงกระถางปลูกผักสี่ฤดูกาลสีเขียวปราศจากมลภาวะ,"฿1,441 - ฿1,567",general,0.0,no sold,จังหวัดตรัง,https://cf.shopee.co.th/file/53abc95f90fc074404d5c2fb96cd6b13_tn,https://shopee.co.th//盆栽Free-home-deliveryใหม่กระเทียมรากต้นกล้าตอนนี้ขุดกระเทียมเมล็ดต้นกล้าระเบียงกระถางปลูกผักสี่ฤดูกาลสีเขียวปราศจากมลภาวะ-i.300493344.3779873519
365,เมล็ดพันธุ์ผักสี่ฤดูหอมหัวใหญ่ผักชีต้นหอมปรุงรสผักชีต้นหอมกระเทียมยี่หร่ายี่หร่าสะระแหน่เมล็ดพืชสวนกระถาง,฿67 - ฿119,general,0.0,no sold,จังหวัดสมุทรสาคร,https://cf.shopee.co.th/file/c2cb85e824842631d1264b7ad050c6c2_tn,https://shopee.co.th//เมล็ดพันธุ์ผักสี่ฤดูหอมหัวใหญ่ผักชีต้นหอมปรุงรสผักชีต้นหอมกระเทียมยี่หร่ายี่หร่าสะระแหน่เมล็ดพืชสวนกระถาง-i.426352417.5287941480
366,🔥พร้อมส่ง🔥✽♦✉ซานตงอบกรอบเนยกระเทียมหลายรสถั่วลิสงปรุงสุก 250 กรัมเมล็ดคั่ว 1 กก. และขนมถั่วสำหรับไวน์และขนมขายส่ง,฿466,general,0.0,1.0,จังหวัดนครสวรรค์,https://cf.shopee.co.th/file/10e0a420b3359d52b9170d3a1d40599b_tn,https://shopee.co.th//🔥พร้อมส่ง🔥✽♦✉ซานตงอบกรอบเนยกระเทียมหลายรสถั่วลิสงปรุงสุก-250-กรัมเมล็ดคั่ว-1-กก.-และขนมถั่วสำหรับไวน์และขนมขายส่ง-i.321669119.6469599290
367,🔥เมล็ดดอกไม้🔥เมล็ด🔥 แพคเกจเมล็ดพันธุ์ผักพริกไทยสีเขียวหัวไชเท้ากระเทียมกะหล่ำปลีกะหล่ำปลีผลไม้ศักดิ์สิทธิ์ฟักทองฟักทอ,฿160 - ฿285,general,0.0,no sold,จังหวัดกรุงเทพมหานคร,https://cf.shopee.co.th/file/22d7ee47cc030e56c2cbf176a362a11b_tn,https://shopee.co.th//🔥เมล็ดดอกไม้🔥เมล็ด🔥-แพคเกจเมล็ดพันธุ์ผักพริกไทยสีเขียวหัวไชเท้ากระเทียมกะหล่ำปลีกะหล่ำปลีผลไม้ศักดิ์สิทธิ์ฟักทองฟักทอ-i.358528628.9042273827
368,ถ้วยแป้งถังโม่บดถั่วลิสงไม้เซรามิกกระเทียมปูนเมล็ดหนาเวลาบดและวิจัยเครื่องผง,฿387 - ฿595,general,0.0,no sold,จังหวัดยะลา,https://cf.shopee.co.th/file/b6af84e98fe5d42ea573f6813e18a086_tn,https://shopee.co.th//ถ้วยแป้งถังโม่บดถั่วลิสงไม้เซรามิกกระเทียมปูนเมล็ดหนาเวลาบดและวิจัยเครื่องผง-i.346104994.8445588552
369,富生2908พื้นที่หลั่งสีเขียว อุดมไปด้วย ความภาคภูมิใจของสมบัติต่อต้านคนรวย6 11ไม่มีครับ ไม่เฉยๆกระเทียมเมล็ด Arv8,"฿1,323 - ฿3,127",general,0.0,no sold,จังหวัดกรุงเทพมหานคร,https://cf.shopee.co.th/file/716532950aaf04b08025f5642f957de5_tn,https://shopee.co.th//富生2908พื้นที่หลั่งสีเขียว-อุดมไปด้วย-ความภาคภูมิใจของสมบัติต่อต้านคนรวย6-11ไม่มีครับ-ไม่เฉยๆกระเทียมเมล็ด-Arv8-i.344042124.5565631781
370,ถั่วลิสง Longyan﹍☬◄2 กก. ถั่วลิสงใหม่บ้านไร่ Longyan ต้มเมล็ดวอลนัทอบแห้งธรรมชาติรสดั้งเดิมกระเทียมเค็มกรอบขนมถั่วแดงสุท,฿288,general,0.0,no sold,จังหวัดกรุงเทพมหานคร,https://cf.shopee.co.th/file/36a3c144c002c80e7b699c222fcbaa96_tn,https://shopee.co.th//ถั่วลิสง-Longyan﹍☬◄2-กก.-ถั่วลิสงใหม่บ้านไร่-Longyan-ต้มเมล็ดวอลนัทอบแห้งธรรมชาติรสดั้งเดิมกระเทียมเค็มกรอบขนมถั่วแดงสุท-i.433124514.10303694043
371,เมล็ดทำสวนที่บ้านเมล็ดพันธุ์ผัก❆♟เมล็ดพันธุ์เพสโต้หัวแดงต้นกล้ากระเทียมใบแข็งตลอดทั้งปีกระเทียมหัวแดงสามตอไม้กระถางปลูก,฿73,general,0.0,no sold,จังหวัดกรุงเทพมหานคร,https://cf.shopee.co.th/file/1eb392fab23ba056cfa4397b4dedd524_tn,https://shopee.co.th//เมล็ดทำสวนที่บ้านเมล็ดพันธุ์ผัก❆♟เมล็ดพันธุ์เพสโต้หัวแดงต้นกล้ากระเทียมใบแข็งตลอดทั้งปีกระเทียมหัวแดงสามตอไม้กระถางปลูก-i.414077380.8248656772
372,ตอนนี้ขุดกระเทียมรากต้นกล้ารากสีม่วงท้องถิ่นเมล็ดกระเทียมเมล็ดผักเมล็ดต้นกล้าระเบียงกระถางสี่ฤดูกาลผักสีเขียว,"฿340 - ฿1,038",general,0.0,no sold,จังหวัดกรุงเทพมหานคร,https://cf.shopee.co.th/file/9f83d42d06311acec9bf583bbf2386ea_tn,https://shopee.co.th//ตอนนี้ขุดกระเทียมรากต้นกล้ารากสีม่วงท้องถิ่นเมล็ดกระเทียมเมล็ดผักเมล็ดต้นกล้าระเบียงกระถางสี่ฤดูกาลผักสีเขียว-i.369451906.6980006126
373,✢◊❁เมล็ดพันธุ์ กระเทียมต้น 200 เมล็ด American Flag's Leek เมล็ดพันธุ์แท้100%นำเข้าจากต่างประเทศ ปลูกผัก สวนครัว เพาะง่าย,฿93 - ฿173,general,0.0,no sold,จังหวัดกาญจนบุรี,https://cf.shopee.co.th/file/866597943d5277c26c9231109fc725a0_tn,https://shopee.co.th//✢◊❁เมล็ดพันธุ์-กระเทียมต้น-200-เมล็ด-American-Flag's-Leek-เมล็ดพันธุ์แท้100-นำเข้าจากต่างประเทศ-ปลูกผัก-สวนครัว-เพาะง่าย-i.432134643.9152881120
374,ลมฝนกล้วยไม้ปลูกลูกหนักกลีบดอกกล้วยไม้ต้นกล้วยไม้กระเทียมกระถางปลูกสี่ฤดูกาลดอกไม้ระเบียงเมล็ดง่าย,฿260 - ฿389,general,0.0,no sold,จังหวัดกรุงเทพมหานคร,https://cf.shopee.co.th/file/d3e76b72538d5e43f79806d62abfd4fc_tn,https://shopee.co.th//ลมฝนกล้วยไม้ปลูกลูกหนักกลีบดอกกล้วยไม้ต้นกล้วยไม้กระเทียมกระถางปลูกสี่ฤดูกาลดอกไม้ระเบียงเมล็ดง่าย-i.377296210.9720988877
375,✸รสนมลาวเจียโข่ว / ถั่วลิสงรสกระเทียม 420gx4 ถุงถั่วลิสงต้มคาราเมลขนมเปลือกถั่วเมล็ดคั่ว และถั่ว 200g,฿139 - ฿354,general,0.0,no sold,จังหวัดขอนแก่น,https://cf.shopee.co.th/file/3199b3cf0def2e822e6a21b4305c82f5_tn,https://shopee.co.th//✸รสนมลาวเจียโข่ว-ถั่วลิสงรสกระเทียม-420gx4-ถุงถั่วลิสงต้มคาราเมลขนมเปลือกถั่วเมล็ดคั่ว-และถั่ว-200g-i.439087472.8655229192
376,ลมฝนกล้วยไม้ปลูกลูกหนักกลีบดอกกล้วยไม้ต้นกล้วยไม้กระเทียมกระถางปลูกสี่ฤดูกาลดอกไม้ระเบียงเมล็ดง่าย,฿311 - ฿348,general,0.0,no sold,จังหวัดสมุทรปราการ,https://cf.shopee.co.th/file/9738de42e8fcaf3ca855ce03b215e9eb_tn,https://shopee.co.th//ลมฝนกล้วยไม้ปลูกลูกหนักกลีบดอกกล้วยไม้ต้นกล้วยไม้กระเทียมกระถางปลูกสี่ฤดูกาลดอกไม้ระเบียงเมล็ดง่าย-i.302503833.8425266006
377,เม็ดมะม่วงหิมพานต์อบ ✅เคลือบมะพร้าว ✅เมล็ดมะม่วงหิมพานต์ 180 กรัม⚡️ เม็ดมะม่วงอบ/เม็ดมะม่วง/กระเทียม/เม็ดมะม่วงหิมพานต์⚡,฿262,general,0.0,no sold,จังหวัดฉะเชิงเทรา,https://cf.shopee.co.th/file/a0b1bac30fbc73e280c664b3e0587f60_tn,https://shopee.co.th//เม็ดมะม่วงหิมพานต์อบ-✅เคลือบมะพร้าว-✅เมล็ดมะม่วงหิมพานต์-180-กรัม⚡️-เม็ดมะม่วงอบ-เม็ดมะม่วง-กระเทียม-เม็ดมะม่วงหิมพานต์⚡-i.419379359.10602825599
378,ถั่วลิสง Longyan✺✾Baiyou Longyan Peanuts ถั่วลิสงแห้งเค็มกระเทียมถั่วลิสงหอมนมและถั่วลิสงปอกเปลือกเมล็ดคั่วและถั่ว ของว่,฿177,general,0.0,no sold,จังหวัดกรุงเทพมหานคร,https://cf.shopee.co.th/file/95572001b52e6b4d01126bb8332f7d4b_tn,https://shopee.co.th//ถั่วลิสง-Longyan✺✾Baiyou-Longyan-Peanuts-ถั่วลิสงแห้งเค็มกระเทียมถั่วลิสงหอมนมและถั่วลิสงปอกเปลือกเมล็ดคั่วและถั่ว-ของว่-i.433135412.5488775080
379,เมล็ดกระเทียมใบใหญ่ สี่ฤดูกาลหว่านการตัดการเก็บเกี่ยวหลายครั้งง่ายต่อการปลูกผักที่มีคุณภาพสูงผักสีเขียวระเบียงกระถางผัก,฿187 - ฿520,general,0.0,no sold,จังหวัดสมุทรปราการ,https://cf.shopee.co.th/file/37d40cc7da14a8ac4110561347a354f5_tn,https://shopee.co.th//เมล็ดกระเทียมใบใหญ่-สี่ฤดูกาลหว่านการตัดการเก็บเกี่ยวหลายครั้งง่ายต่อการปลูกผักที่มีคุณภาพสูงผักสีเขียวระเบียงกระถางผัก-i.395147293.9140939602
380,"ดอกไม้ในเมล็ดเย็นหลายสีดอกไม้ป่าลูกกระเทียมหินเมล็ดแมนดาลาดอกไม้ชนิดลูกชาดดอกไม้ปลูกลูกกระถางดอกไม้พืช เมล็ดพันธุ์,เมล็ด",฿163 - ฿389,general,0.0,no sold,จังหวัดกรุงเทพมหานคร,https://cf.shopee.co.th/file/db40fcbd073120134af24701401ada12_tn,https://shopee.co.th//ดอกไม้ในเมล็ดเย็นหลายสีดอกไม้ป่าลูกกระเทียมหินเมล็ดแมนดาลาดอกไม้ชนิดลูกชาดดอกไม้ปลูกลูกกระถางดอกไม้พืช-เมล็ดพันธุ์-เมล็ด-i.377296210.9620988960
381,🔥เครื่องสับกระเทียม🔥เครื่องบดอาหาร🔥 โรงสีที่ใช้ในครัวเรือนบดขนาดเล็กเมล็ดข้าวผสมเม็ดความเจ็บปวดพิเศษเครื่องยาเสพติดยา,฿239 - ฿309,general,0.0,no sold,จังหวัดสมุทรปราการ,https://cf.shopee.co.th/file/25193fbe651968b2cb832318e0e4eeda_tn,https://shopee.co.th//🔥เครื่องสับกระเทียม🔥เครื่องบดอาหาร🔥-โรงสีที่ใช้ในครัวเรือนบดขนาดเล็กเมล็ดข้าวผสมเม็ดความเจ็บปวดพิเศษเครื่องยาเสพติดยา-i.294048058.9345864319
382,"3,500 เมล็ด กระเทียมต้น",฿260,general,0.0,1.0,จังหวัดกรุงเทพมหานคร,https://cf.shopee.co.th/file/215bb2663fbb439596506b4e5d89ea06_tn,https://shopee.co.th//3-500-เมล็ด-กระเทียมต้น-i.236180415.6328793709
383,🔥เมล็ดดอกไม้🔥เมล็ด🔥 Leek Seedling ต้นกล้าเมล็ดพันธุ์ผักสี่ฤดูกาลปลูกสวนปลูกผักต้นกล้ากระเทียมรากที่บ้านสวน,฿102 - ฿160,general,0.0,no sold,จังหวัดกรุงเทพมหานคร,https://cf.shopee.co.th/file/4c5f39c2100475175b42a83ed397eb8c_tn,https://shopee.co.th//🔥เมล็ดดอกไม้🔥เมล็ด🔥-Leek-Seedling-ต้นกล้าเมล็ดพันธุ์ผักสี่ฤดูกาลปลูกสวนปลูกผักต้นกล้ากระเทียมรากที่บ้านสวน-i.358522585.6785824861
384,พร้อมส่ง⊙> กล่องเก็บเมล็ดพืชในครัวหัวหอมขิงกระเทียมสี่ช่องพร้อมฝาปิดกล่องเก็บตู้เย็นกล่องถนอมอาหารที่ปิดสนิท <,฿267 - ฿351,general,0.0,no sold,จังหวัดนนทบุรี,https://cf.shopee.co.th/file/607e7e0e89cee66920e5a6b24d482088_tn,https://shopee.co.th//พร้อมส่ง⊙-กล่องเก็บเมล็ดพืชในครัวหัวหอมขิงกระเทียมสี่ช่องพร้อมฝาปิดกล่องเก็บตู้เย็นกล่องถนอมอาหารที่ปิดสนิท--i.420668636.9441315745
385,เม็ดมะม่วงหิมพานต์อบ ✅เคลือบงาดำ งาขาว งาม่อน ✅เมล็ดมะม่วงหิมพานต์ 180 กรัม⚡️ เม็ดมะม่วงอบ/เม็ดมะม่วง/กระเทียม/เม็ดมะม่ว,฿262,general,0.0,no sold,จังหวัดฉะเชิงเทรา,https://cf.shopee.co.th/file/339ee1807c6e7cf94216712777daa53b_tn,https://shopee.co.th//เม็ดมะม่วงหิมพานต์อบ-✅เคลือบงาดำ-งาขาว-งาม่อน-✅เมล็ดมะม่วงหิมพานต์-180-กรัม⚡️-เม็ดมะม่วงอบ-เม็ดมะม่วง-กระเทียม-เม็ดมะม่ว-i.419378147.8553089608
