num,name,price,type,star,sold,from,img_src,url
1,เมล็ดพันธุ์ผักสลัด ซองละ 10 บาท เมล็ดผัก เมล็ดสลัดพันธุ์แท้,฿7 - ฿10,ร้านแนะนำ,4.7452,43900.0,จังหวัดสกลนคร,https://cf.shopee.co.th/file/18c03f9589c4cc4754e726097450acb2_tn,https://shopee.co.th//เมล็ดพันธุ์ผักสลัด-ซองละ-10-บาท-เมล็ดผัก-เมล็ดสลัดพันธุ์แท้-i.3514198.5053286414
2,เมล็ดพันธุ์ กระเทียมต้น 200 เมล็ด American Flag's Leek เมล็ดพันธุ์แท้100%นำเข้าจากต่างประเทศ ปลูกผัก สวนครัว เพาะง่าย,฿10 - ฿50,ร้านแนะนำ,4.825,926.0,จังหวัดน่าน,https://cf.shopee.co.th/file/2521d5f678fd290ae3464d398d0e5bc5_tn,https://shopee.co.th//เมล็ดพันธุ์-กระเทียมต้น-200-เมล็ด-American-Flag's-Leek-เมล็ดพันธุ์แท้100-นำเข้าจากต่างประเทศ-ปลูกผัก-สวนครัว-เพาะง่าย-i.269793953.4156956399
3,เมล็ดแท้ 100% | ตอบลู (Myrtillocactus geometrizans | Blue Candle) 10s | เพาะแล้ว ทดสอบแล้ว งอกจริง‼️,฿24,general,4.7493,2200.0,จังหวัดนนทบุรี,https://cf.shopee.co.th/file/f2034104ec2c44740a363993ac83a2c8_tn,https://shopee.co.th//เมล็ดแท้-100-ตอบลู-(Myrtillocactus-geometrizans-Blue-Candle)-10s-เพาะแล้ว-ทดสอบแล้ว-งอกจริง‼️-i.45558233.1730232090
4,เม็ดมะม่วงหิมพานต์อบ,฿120,general,0.0,no sold,จังหวัดเชียงราย,https://cf.shopee.co.th/file/2a10c9736831c27cc3d77532103fb6fd_tn,https://shopee.co.th//เม็ดมะม่วงหิมพานต์อบ-i.4405880.5461544620
5,ชุดเพาะเมล็ดกระบองเพชร เเอสโตร,฿80,general,0.0,1.0,จังหวัดกรุงเทพมหานคร,https://cf.shopee.co.th/file/6a9fc07ccf0979bb1944822fc3a6168c_tn,https://shopee.co.th//ชุดเพาะเมล็ดกระบองเพชร-เเอสโตร-i.77091766.7220597235
6,เมล็ดพันธุ์ กระเทียมต้น 200 เมล็ด American Flag's Leek เมล็ดพันธุ์แท้100%นำเข้าจากต่างประเทศ ปลูกผัก สวนครัว เพาะง่าย,฿10 - ฿50,ร้านแนะนำ,4.825,926.0,จังหวัดน่าน,https://cf.shopee.co.th/file/2521d5f678fd290ae3464d398d0e5bc5_tn,https://shopee.co.th//เมล็ดพันธุ์-กระเทียมต้น-200-เมล็ด-American-Flag's-Leek-เมล็ดพันธุ์แท้100-นำเข้าจากต่างประเทศ-ปลูกผัก-สวนครัว-เพาะง่าย-i.269793953.4156956399
7,เมล็ดพันธุ์ กระเทียมกินต้น(ไม่ใช่ต้นหอมญี่ปุ่น) 30เมล็ด,฿9,general,4.9167,280.0,จังหวัดเชียงใหม่,https://cf.shopee.co.th/file/c000a32abd1d226f1c3297fdf9bb9e55_tn,https://shopee.co.th//เมล็ดพันธุ์-กระเทียมกินต้น(ไม่ใช่ต้นหอมญี่ปุ่น)-30เมล็ด-i.210307388.5643891695
8,300+ เมล็ด กระเทียมต้น,฿50,general,5.0,5.0,จังหวัดกรุงเทพมหานคร,https://cf.shopee.co.th/file/c5b5d11b7db99cceb9ae5977e3c469ad_tn,https://shopee.co.th//300-เมล็ด-กระเทียมต้น-i.127001513.2073079536
9,30 เมล็ด กระเทียมป่า (ส่วนที่ทานได้คือ ดอก และใบ รสชาติอร่อยมากที่สุด),฿50,general,0.0,3.0,จังหวัดกรุงเทพมหานคร,https://cf.shopee.co.th/file/7738d22b365dab3e7e1ed60bb713d852_tn,https://shopee.co.th//30-เมล็ด-กระเทียมป่า-(ส่วนที่ทานได้คือ-ดอก-และใบ-รสชาติอร่อยมากที่สุด)-i.44973213.4886322855
10,"ใบเล็ก ๆ กระเทียมเมล็ด SEDA เมล็ด, ตัด, มีเก็บเกี่ยวปลูกระเบียง, ผัก, ผัก, ผักเมล็ดสีเขียว",฿75 - ฿123,general,0.0,no sold,จังหวัดปราจีนบุรี,https://cf.shopee.co.th/file/9109199a80ccbd4bd478740760d0ca1c_tn,https://shopee.co.th//ใบเล็ก-ๆ-กระเทียมเมล็ด-SEDA-เมล็ด-ตัด-มีเก็บเกี่ยวปลูกระเบียง-ผัก-ผัก-ผักเมล็ดสีเขียว-i.409788279.11104549373
11,30 เมล็ด กระเทียมป่า,฿50,general,4.7778,28.0,จังหวัดกรุงเทพมหานคร,https://cf.shopee.co.th/file/51d83ac80b946179a5a4d0a245d5ce1b_tn,https://shopee.co.th//30-เมล็ด-กระเทียมป่า-i.127001513.7542763270
12,☘️เมล็ดพันธุ์ กระเทียมต้น🎯ถูกที่สุด 9 บ.📌50 เมล็ด🎈🌱งอกง่าย 🌱โตไว☘️ต้นสูงใหญ่🌱ทานอร่อย,฿9,ร้านแนะนำ,4.25,7.0,จังหวัดขอนแก่น,https://cf.shopee.co.th/file/6f9e5762efea7b267d68ab205befc3c9_tn,https://shopee.co.th//☘️เมล็ดพันธุ์-กระเทียมต้น🎯ถูกที่สุด-9-บ.📌50-เมล็ด🎈🌱งอกง่าย-🌱โตไว☘️ต้นสูงใหญ่🌱ทานอร่อย-i.339918126.5382868293
13,🧄🌱เมล็ดกระเทียมรากสีม่วง (ถุง500เม็ด)🧄🌱,฿35,general,0.0,no sold,จังหวัดกรุงเทพมหานคร,https://cf.shopee.co.th/file/d1b6ee37986273f711be7b92687e4233_tn,https://shopee.co.th//🧄🌱เมล็ดกระเทียมรากสีม่วง-(ถุง500เม็ด)🧄🌱-i.220881138.8637706603
14,50 เมล็ด กระเทียมเถา ดอกสีชมพูอมม่วง ดอกหอม เป็นไม้เลื้อยชอบแดด มีบริการเก็บเงินปลายทาง,฿50,ร้านแนะนำ,5.0,9.0,จังหวัดเชียงราย,https://cf.shopee.co.th/file/0ec1ec075207338288b2d5245b0fbd19_tn,https://shopee.co.th//50-เมล็ด-กระเทียมเถา-ดอกสีชมพูอมม่วง-ดอกหอม-เป็นไม้เลื้อยชอบแดด-มีบริการเก็บเงินปลายทาง-i.99931460.8830131337
15,นัทชี่ส์ รสกระเทียม เมล็ดมะม่วงหิมพานต์อบกรอบ ปรุงรส 100 กรัม / Nutchies Wild Garlic Flavour 100g,฿129,general,5.0,45.0,จังหวัดฉะเชิงเทรา,https://cf.shopee.co.th/file/8585287aca5af84f52a84bc9de8ae3a6_tn,https://shopee.co.th//นัทชี่ส์-รสกระเทียม-เมล็ดมะม่วงหิมพานต์อบกรอบ-ปรุงรส-100-กรัม-Nutchies-Wild-Garlic-Flavour-100g-i.165727834.2589383543
16,กระเทียมต้น - American Flag Leek 200 เมล็ด คุณภาพดี ของแท้ 100%,฿60,general,5.0,3.0,จังหวัดพะเยา,https://cf.shopee.co.th/file/58f968d8b8fe724fa42661ab74fb05cc_tn,https://shopee.co.th//กระเทียมต้น-American-Flag-Leek-200-เมล็ด-คุณภาพดี-ของแท้-100--i.57143541.6523091420
17,"(คุ้มสุดๆ) เมล็ดผัก 4 อย่าง รวม 3,250 !!! เมล็ด (กะเพรา กุยช่าย ต้นกระเทียม ต้นหอม)",฿95,general,5.0,16.0,จังหวัดนครราชสีมา,https://cf.shopee.co.th/file/7d85b59b5d1baac15f12f9090b48bcea_tn,https://shopee.co.th//(คุ้มสุดๆ)-เมล็ดผัก-4-อย่าง-รวม-3-250-!!!-เมล็ด-(กะเพรา-กุยช่าย-ต้นกระเทียม-ต้นหอม)-i.272016187.4757538507
18,สมุนไพรไล่แมลง สารสกัดเมล็ดสะเดา/พริกกระเทียม20มล.,฿33 - ฿89,general,4.7241,67.0,จังหวัดสมุทรปราการ,https://cf.shopee.co.th/file/90a3af7fe8d5d5650b21aae4be7ae77e_tn,https://shopee.co.th//สมุนไพรไล่แมลง-สารสกัดเมล็ดสะเดา-พริกกระเทียม20มล.-i.4165009.2367384436
19,◊✒☂กระเทียมหัวแดงกระเทียมหัวแดงสามารถปลูกได้ 3 อย่างต่อเนื่องตลอดทั้งปีต้นกล้ากระเทียมเมล็ดกระเทียมต้นกล้ากระเทียมใบแข็ง,฿104 - ฿162,general,0.0,no sold,จังหวัดกรุงเทพมหานคร,https://cf.shopee.co.th/file/1d39eca5ec2342fdda8d4faf2466dec2_tn,https://shopee.co.th//◊✒☂กระเทียมหัวแดงกระเทียมหัวแดงสามารถปลูกได้-3-อย่างต่อเนื่องตลอดทั้งปีต้นกล้ากระเทียมเมล็ดกระเทียมต้นกล้ากระเทียมใบแข็ง-i.429081117.11702434897
20,300+ เมล็ด กระเทียมต้น,฿50,general,5.0,9.0,จังหวัดกรุงเทพมหานคร,https://cf.shopee.co.th/file/f050fb8f052442d344c8ad381e6b5b36_tn,https://shopee.co.th//300-เมล็ด-กระเทียมต้น-i.44973213.1154604971
21,seed กระเทียมมณฑลซานตง Jinxiang กระเทียมกระเทียมสดกระเทียมแห้งหัวกระเทียมขายส่งกระเทียมแห้งเมล็ดกระเทียมขายส่ง,฿106 - ฿147,general,0.0,no sold,จังหวัดภูเก็ต,https://cf.shopee.co.th/file/1180b954dd296d4f82559e601f39ebda_tn,https://shopee.co.th//seed-กระเทียมมณฑลซานตง-Jinxiang-กระเทียมกระเทียมสดกระเทียมแห้งหัวกระเทียมขายส่งกระเทียมแห้งเมล็ดกระเทียมขายส่ง-i.295434259.8719872563
22,seed มณฑลซานตง Jinxiang กระเทียมสีม่วงสดกระเทียมแห้งเมล็ดกระเทียมหัวกระเทียมที่เลือกขายส่งกระเทียมแห้ง,฿104,general,0.0,no sold,จังหวัดขอนแก่น,https://cf.shopee.co.th/file/fbb5815d18dc0af04711950098cd4bf2_tn,https://shopee.co.th//seed-มณฑลซานตง-Jinxiang-กระเทียมสีม่วงสดกระเทียมแห้งเมล็ดกระเทียมหัวกระเทียมที่เลือกขายส่งกระเทียมแห้ง-i.306178546.5480467013
23,30 เมล็ด กระเทียมป่า,฿50,general,0.0,2.0,จังหวัดกรุงเทพมหานคร,https://cf.shopee.co.th/file/51d83ac80b946179a5a4d0a245d5ce1b_tn,https://shopee.co.th//30-เมล็ด-กระเทียมป่า-i.23264852.7772291185
24,ซูซิ่วชานตงสีแดงผิวเมล็ดกระเทียมสีม่วงผิวขายส่งสามารถออกจากกระเทียมมอสผักเมล็ด,฿262 - ฿573,general,0.0,no sold,จังหวัดกรุงเทพมหานคร,https://cf.shopee.co.th/file/b273477870fa6293c727fa76cb1b6089_tn,https://shopee.co.th//ซูซิ่วชานตงสีแดงผิวเมล็ดกระเทียมสีม่วงผิวขายส่งสามารถออกจากกระเทียมมอสผักเมล็ด-i.377295420.9621019658
25,🧄🌱เมล็ดกระเทียมรากสีม่วง (ถุง500เม็ด)🌱🧄,฿35,general,0.0,no sold,จังหวัดกรุงเทพมหานคร,https://cf.shopee.co.th/file/04cfaae83c6122f0a670ac604f9d3b31_tn,https://shopee.co.th//🧄🌱เมล็ดกระเทียมรากสีม่วง-(ถุง500เม็ด)🌱🧄-i.234879113.2938781418
26,30 เมล็ด กระเทียมป่า,฿50,general,0.0,no sold,จังหวัดกรุงเทพมหานคร,https://cf.shopee.co.th/file/51d83ac80b946179a5a4d0a245d5ce1b_tn,https://shopee.co.th//30-เมล็ด-กระเทียมป่า-i.110142264.9144374361
27,300 เมล็ด  กระเทียมต้น,฿50,general,0.0,no sold,จังหวัดประจวบคีรีขันธ์,https://cf.shopee.co.th/file/215bb2663fbb439596506b4e5d89ea06_tn,https://shopee.co.th//300-เมล็ด-กระเทียมต้น-i.63047952.1874465812
28,300 เมล็ด กระเทียมต้น,฿45,general,5.0,4.0,จังหวัดกรุงเทพมหานคร,https://cf.shopee.co.th/file/f050fb8f052442d344c8ad381e6b5b36_tn,https://shopee.co.th//300-เมล็ด-กระเทียมต้น-i.110142264.4132966379
29,นัทชี่ส์ รสกระเทียม เมล็ดมะม่วงหิมพานต์อบกรอบปรุงรส 100 กรัม / Nutchies Wild Garlic Flavour 100g,฿129,general,4.9091,45.0,จังหวัดฉะเชิงเทรา,https://cf.shopee.co.th/file/8585287aca5af84f52a84bc9de8ae3a6_tn,https://shopee.co.th//นัทชี่ส์-รสกระเทียม-เมล็ดมะม่วงหิมพานต์อบกรอบปรุงรส-100-กรัม-Nutchies-Wild-Garlic-Flavour-100g-i.34553282.1546911674
30,❒สินค้าใหม่ถั่วลิสงหลากรสพร้อมเปลือกกระเทียมหอมกลิ่นวอลนัทหลากรสถั่วลิสงเม็ดเล็กพร้อมขนมไวน์ถั่วเมล็ดคั่วและถั่วขายส่ง,฿187 - ฿392,general,0.0,no sold,จังหวัดกรุงเทพมหานคร,https://cf.shopee.co.th/file/1efd26316dd61c4e5531c99b889db61a_tn,https://shopee.co.th//❒สินค้าใหม่ถั่วลิสงหลากรสพร้อมเปลือกกระเทียมหอมกลิ่นวอลนัทหลากรสถั่วลิสงเม็ดเล็กพร้อมขนมไวน์ถั่วเมล็ดคั่วและถั่วขายส่ง-i.425518752.6489193468
31,✴กระเทียมรากสีม่วงได้รับการต่ออายุ wida leek seedlings สีแดงรากเมล็ดฤดูกาล sunwell กระถางกระถางผักต้นกล้า✿,฿171,general,0.0,no sold,จังหวัดลำพูน,https://cf.shopee.co.th/file/79c7d792bb8b2fcdc0b79c528a6ae096_tn,https://shopee.co.th//✴กระเทียมรากสีม่วงได้รับการต่ออายุ-wida-leek-seedlings-สีแดงรากเมล็ดฤดูกาล-sunwell-กระถางกระถางผักต้นกล้า✿-i.378421653.10503648326
32,รากสีม่วงต้นกระเทียมรากตอนนี้ขุดใหม่สีม่วงรากสีแดงกระเทียมเมล็ดกว้างใบเล็กกระถางผักต้นกล้าระเบียงปลูกผักสี่ฤดูกาล rXKZ,฿454 - ฿988,general,0.0,no sold,จังหวัดสมุทรสาคร,https://cf.shopee.co.th/file/86a023c7569c0f7727cc145dc4b9155a_tn,https://shopee.co.th//รากสีม่วงต้นกระเทียมรากตอนนี้ขุดใหม่สีม่วงรากสีแดงกระเทียมเมล็ดกว้างใบเล็กกระถางผักต้นกล้าระเบียงปลูกผักสี่ฤดูกาล-rXKZ-i.425190085.4188785125
33,300+ เมล็ด กระเทียมต้น,฿50,general,0.0,no sold,จังหวัดกรุงเทพมหานคร,https://cf.shopee.co.th/file/f050fb8f052442d344c8ad381e6b5b36_tn,https://shopee.co.th//300-เมล็ด-กระเทียมต้น-i.309848708.8317893787
34,เมล็ดเพสโต้หัวแดงตลอดทั้งปีต้นกล้ากระเทียมใบแข็งกระเทียมหัวแดงสามแฉกสามารถปลูกในกระถางระเบียงได้,฿115,general,0.0,no sold,จังหวัดปทุมธานี,https://cf.shopee.co.th/file/0b9b8f086b945944cf0ef648170eb958_tn,https://shopee.co.th//เมล็ดเพสโต้หัวแดงตลอดทั้งปีต้นกล้ากระเทียมใบแข็งกระเทียมหัวแดงสามแฉกสามารถปลูกในกระถางระเบียงได้-i.347956293.8645270795
35,300 เมล็ด กระเทียมต้น,฿50,general,0.0,no sold,จังหวัดกรุงเทพมหานคร,https://cf.shopee.co.th/file/215bb2663fbb439596506b4e5d89ea06_tn,https://shopee.co.th//300-เมล็ด-กระเทียมต้น-i.236180415.3328890703
36,กระเทียมกระเทียมกระเทียมแห้ง 5 จินเมล็ดกระเทียมสดเมล็ดสีม่วงกระเทียมเดี่ยวมัลติกลองสีขาวผิวขาว祘 10 จิน,฿389 - ฿568,general,0.0,no sold,จังหวัดชัยภูมิ,https://cf.shopee.co.th/file/90cf61f6f3cf675447f877d293c0cfdd_tn,https://shopee.co.th//กระเทียมกระเทียมกระเทียมแห้ง-5-จินเมล็ดกระเทียมสดเมล็ดสีม่วงกระเทียมเดี่ยวมัลติกลองสีขาวผิวขาว祘-10-จิน-i.409397506.7283839844
37,"♖เมล็ดสีเขียวขนาดเล็กกระเทียมเสือภูเขา, กระเทียม, เมล็ดหัวหอมขนาดเล็ก, สี่ฤดูกาล, เย็น, ระเบียงที่ดี, ลาน, การเพาะปลูก,",฿194,general,0.0,no sold,จังหวัดระยอง,https://cf.shopee.co.th/file/e61e01c84669bc3b390be5686b86316b_tn,https://shopee.co.th//♖เมล็ดสีเขียวขนาดเล็กกระเทียมเสือภูเขา-กระเทียม-เมล็ดหัวหอมขนาดเล็ก-สี่ฤดูกาล-เย็น-ระเบียงที่ดี-ลาน-การเพาะปลูก--i.379905632.11203276180
38,♝✕☄ในประเทศ Shi Tianbu 33% Pendimethalin เมล็ดไม่ปลูกหญ้าสวนขิงกระเทียมสารกำจัดวัชพืชชนิดปิด 200g,฿120 - ฿240,general,0.0,no sold,จังหวัดสมุทรสาคร,https://cf.shopee.co.th/file/79d157f7314b5af3aa29b3c190f6ada7_tn,https://shopee.co.th//♝✕☄ในประเทศ-Shi-Tianbu-33-Pendimethalin-เมล็ดไม่ปลูกหญ้าสวนขิงกระเทียมสารกำจัดวัชพืชชนิดปิด-200g-i.414119756.7488720705
39,❆กระเทียมราก Seedling Purgen Leek ในร่มกระถางผักเมล็ดครอบครัวระเบียงกระถางกว้างใบใบ Leeks✍,฿186,general,0.0,no sold,จังหวัดอ่างทอง,https://cf.shopee.co.th/file/76792819d2799dcc8e885384393ee63b_tn,https://shopee.co.th//❆กระเทียมราก-Seedling-Purgen-Leek-ในร่มกระถางผักเมล็ดครอบครัวระเบียงกระถางกว้างใบใบ-Leeks✍-i.378408843.8254363123
40,﹍✚ในประเทศ Shi Tianbu 33% Pendimethalin เมล็ดไม่ปลูกหญ้าสวนขิงกระเทียมสารกำจัดวัชพืชชนิดปิด 200g,฿119 - ฿240,general,0.0,no sold,จังหวัดสมุทรสาคร,https://cf.shopee.co.th/file/00a679c0d705882723fa10630b7dd19f_tn,https://shopee.co.th//﹍✚ในประเทศ-Shi-Tianbu-33-Pendimethalin-เมล็ดไม่ปลูกหญ้าสวนขิงกระเทียมสารกำจัดวัชพืชชนิดปิด-200g-i.414110956.11003546442
41,300+ เมล็ด กระเทียมต้น,฿50,general,0.0,no sold,จังหวัดศรีสะเกษ,https://cf.shopee.co.th/file/f050fb8f052442d344c8ad381e6b5b36_tn,https://shopee.co.th//300-เมล็ด-กระเทียมต้น-i.375147548.9114053750
42,ใหม่ Leek ราก 50 กระเทียมเนื้อเนื้อต้นกล้าผักเมล็ดที่อยู่อาศัยหม้อพืชในระเบียง,฿231,general,0.0,no sold,จังหวัดชัยภูมิ,https://cf.shopee.co.th/file/5461a8e1b6ae1e1c0250dc214bf472af_tn,https://shopee.co.th//ใหม่-Leek-ราก-50-กระเทียมเนื้อเนื้อต้นกล้าผักเมล็ดที่อยู่อาศัยหม้อพืชในระเบียง-i.409397506.9336242023
43,เมล็ดกระบองเพชร เมล็ดแคคตัส เมล็ด Lophophora diffusa 10 เมล็ด,฿100,ร้านแนะนำ,4.881,256.0,จังหวัดกรุงเทพมหานคร,https://cf.shopee.co.th/file/176ba46d518f24113c365f5f579964ad_tn,https://shopee.co.th//เมล็ดกระบองเพชร-เมล็ดแคคตัส-เมล็ด-Lophophora-diffusa-10-เมล็ด-i.27960705.6702358909
44,Long thorns หนามยาม กระบองเพชร แคคตัส พืชอวบน้ำถังทอง ขนาด cactus  Echinocactus grusonii เอคิโนแคคตัส กรูซอนอิอาย,฿99 - ฿209,general,5.0,63.0,จังหวัดนนทบุรี,https://cf.shopee.co.th/file/500b815ebb06554dacabeb3ae2ef4f98_tn,https://shopee.co.th//Long-thorns-หนามยาม-กระบองเพชร-แคคตัส-พืชอวบน้ำถังทอง-ขนาด-cactus-Echinocactus-grusonii-เอคิโนแคคตัส-กรูซอนอิอาย-i.397549204.8442284184
45,เมล็ดผักสลัด เมล็ดสลัด 10 บาท เมล็ดคุณภาพ อัตราการงอกสูง,฿7 - ฿9,general,4.9231,236.0,จังหวัดกรุงเทพมหานคร,https://cf.shopee.co.th/file/22f7fcb6b808b91865b0ebafaa8a232c_tn,https://shopee.co.th//เมล็ดผักสลัด-เมล็ดสลัด-10-บาท-เมล็ดคุณภาพ-อัตราการงอกสูง-i.296440370.9312747673
46,เมล็ดต้นอ่อนทานตะวัน สำหรับเพาะต้นอ่อน ค่าจัดส่ง 25฿,฿79 - ฿129,ร้านแนะนำ,4.727,2600.0,จังหวัดกรุงเทพมหานคร,https://cf.shopee.co.th/file/1989d1a5b2b2fbd1d81b7c157accf4d5_tn,https://shopee.co.th//เมล็ดต้นอ่อนทานตะวัน-สำหรับเพาะต้นอ่อน-ค่าจัดส่ง-25฿-i.29481324.2331899040
