num,name,price,type,star,sold,from,img_src,url
190,🔥เครื่องสับกระเทียม🔥เครื่องบดอาหาร🔥 เครื่องหั่นไฟฟ้าที่ใช้ในครัวเรือนยาจีนเมล็ดข้าวผสมเครื่องผงพลังงานอัลตร้าไฟที่ดีส,฿253 - ฿403,general,0.0,no sold,จังหวัดกรุงเทพมหานคร,https://cf.shopee.co.th/file/7cc03e4e5eb5c939f73ac746444615d0_tn,https://shopee.co.th//🔥เครื่องสับกระเทียม🔥เครื่องบดอาหาร🔥-เครื่องหั่นไฟฟ้าที่ใช้ในครัวเรือนยาจีนเมล็ดข้าวผสมเครื่องผงพลังงานอัลตร้าไฟที่ดีส-i.358522585.8245866304
191,◑❂✁[ราคาพิเศษ 2 kg] ถั่วลิสงอบแห้ง Longyan แท้เมล็ดถั่วลิสงอบแห้งรสกระเทียมวอลนัทและถั่วลิสง 218g / 1500g,฿158 - ฿302,general,0.0,no sold,จังหวัดกรุงเทพมหานคร,https://cf.shopee.co.th/file/831815735d7f1e7d879f31ac6498d374_tn,https://shopee.co.th//◑❂✁-ราคาพิเศษ-2-kg-ถั่วลิสงอบแห้ง-Longyan-แท้เมล็ดถั่วลิสงอบแห้งรสกระเทียมวอลนัทและถั่วลิสง-218g-1500g-i.429740533.6888172599
192,"seeds seed ✱สายย่อยดอกไม้สายพันธุ์, ใต้, สี่ฤดูกาล, Manda, หินเมล็ดมุก, กระเทียม, สวนกระถางดอกไม้, รากฟันเทียมสีเขียว, พ",฿158 - ฿265,general,0.0,no sold,จังหวัดกรุงเทพมหานคร,https://cf.shopee.co.th/file/204592844ccf9e1c7773bc417cc0558b_tn,https://shopee.co.th//seeds-seed-✱สายย่อยดอกไม้สายพันธุ์-ใต้-สี่ฤดูกาล-Manda-หินเมล็ดมุก-กระเทียม-สวนกระถางดอกไม้-รากฟันเทียมสีเขียว-พ-i.430411965.8254640907
193,ชุดปลูกผักเด็กมะเขือเทศแตงกวากระเทียมผักชีเมล็ดเมล็ดพันธุ์ต้นกล้าระเบียงพิเศษสี่ฤดูกาลกระถาง,"฿823 - ฿1,011",general,0.0,no sold,จังหวัดกรุงเทพมหานคร,https://cf.shopee.co.th/file/479f9b72cafca386b20a8455eeff7ab1_tn,https://shopee.co.th//ชุดปลูกผักเด็กมะเขือเทศแตงกวากระเทียมผักชีเมล็ดเมล็ดพันธุ์ต้นกล้าระเบียงพิเศษสี่ฤดูกาลกระถาง-i.345800190.9824780068
194,ดอกไม้ประดิษฐ์✪ใบไม้ปลอม✪ จำลองผักจำลองข้าวโพดจี้ตกแต่งปลอมพริกไทยเสียบไม้เสียบกระเทียมลายกระเทียมเมล็ดข้าวผสมอาหารฟาร์ม,฿141 - ฿151,general,0.0,no sold,จังหวัดสมุทรปราการ,no image,https://shopee.co.th//ดอกไม้ประดิษฐ์✪ใบไม้ปลอม✪-จำลองผักจำลองข้าวโพดจี้ตกแต่งปลอมพริกไทยเสียบไม้เสียบกระเทียมลายกระเทียมเมล็ดข้าวผสมอาหารฟาร์ม-i.375477850.8742524846
195,Shou Wo เมล็ดต้นหอมตอนนี้ขุดต้นหอมหัวปลูกรากผักรากสีม่วงสีแดงขุดรากต้นกล้ากระเทียมสีเหลืองฤดูใบไม้ผลิและฤดูใบไม้ร่วงทนต่,"฿214 - ฿1,066",general,0.0,no sold,จังหวัดกรุงเทพมหานคร,no image,https://shopee.co.th//Shou-Wo-เมล็ดต้นหอมตอนนี้ขุดต้นหอมหัวปลูกรากผักรากสีม่วงสีแดงขุดรากต้นกล้ากระเทียมสีเหลืองฤดูใบไม้ผลิและฤดูใบไม้ร่วงทนต่-i.369548529.6079000023
196,ปลูก■ลมฝนกล้วยไม้ปลูกลูกหนักกลีบดอกกล้วยไม้ต้นกล้วยไม้กระเทียมกระถางปลูกสี่ฤดูกาลดอกไม้ระเบียงเมล็ดง่าย 11.11 PEk2,฿147 - ฿198,general,0.0,no sold,จังหวัดกำแพงเพชร,no image,https://shopee.co.th//ปลูก■ลมฝนกล้วยไม้ปลูกลูกหนักกลีบดอกกล้วยไม้ต้นกล้วยไม้กระเทียมกระถางปลูกสี่ฤดูกาลดอกไม้ระเบียงเมล็ดง่าย-11.11-PEk2-i.294118660.5560633754
197,✷ฤดูใบไม้ร่วงและฤดูหนาวสีขาวรากและกระเทียมเมล็ดพันธุ์ผักสี่ฤดูกาลสายพันธุ์เมล็ดระเบียงในร่มกลางแจ้งกระถางสวนปลูกสวน❄,฿200 - ฿354,general,0.0,no sold,จังหวัดปราจีนบุรี,no image,https://shopee.co.th//✷ฤดูใบไม้ร่วงและฤดูหนาวสีขาวรากและกระเทียมเมล็ดพันธุ์ผักสี่ฤดูกาลสายพันธุ์เมล็ดระเบียงในร่มกลางแจ้งกระถางสวนปลูกสวน❄-i.379898239.8453821873
198,"สี่ Seasam Leek Seeds เป็นเวลาหลายปี, รากสีขาว, รากสีแดง, กระเทียม, เมล็ดสีเหลือง, สวนผักขนาดเล็ก, ระเบียง, เมล็ดพันธุ์ผ",฿112 - ฿245,general,0.0,no sold,จังหวัดปราจีนบุรี,no image,https://shopee.co.th//สี่-Seasam-Leek-Seeds-เป็นเวลาหลายปี-รากสีขาว-รากสีแดง-กระเทียม-เมล็ดสีเหลือง-สวนผักขนาดเล็ก-ระเบียง-เมล็ดพันธุ์ผ-i.409788279.9256262298
199,✿❅[ราคาพิเศษ 2 kg] ถั่วลิสงอบแห้ง Longyan แท้เมล็ดถั่วลิสงอบแห้งรสกระเทียมวอลนัทและถั่วลิสง 218g / 1500g,฿148 - ฿263,general,0.0,no sold,จังหวัดกรุงเทพมหานคร,https://cf.shopee.co.th/file/831815735d7f1e7d879f31ac6498d374_tn,https://shopee.co.th//✿❅-ราคาพิเศษ-2-kg-ถั่วลิสงอบแห้ง-Longyan-แท้เมล็ดถั่วลิสงอบแห้งรสกระเทียมวอลนัทและถั่วลิสง-218g-1500g-i.427420673.10901544482
200,สี่ฤดูกาลหว่านเมล็ดผักระเบียงเพิงเมล็ดผักแตงกวาผักกาดหอมมะเขือเทศสตรอเบอร์รี่กระเทียมกระถางเมล็ดพืช,฿179 - ฿279,general,0.0,no sold,จังหวัดหนองคาย,https://cf.shopee.co.th/file/a45bfe33c3d8ca3aeaafd5c720c34452_tn,https://shopee.co.th//สี่ฤดูกาลหว่านเมล็ดผักระเบียงเพิงเมล็ดผักแตงกวาผักกาดหอมมะเขือเทศสตรอเบอร์รี่กระเทียมกระถางเมล็ดพืช-i.332872236.7989329393
201,seed seeds ♡สี่ฤดูกาลกระเทียมเมล็ดสีขาวรากกระเทียมเมล็ดระเบียงกระถางเมล็ดพันธุ์ผักสวนฟาร์มสวนวิจิตรใบ Purgen Leek เมล็ด☉,฿127 - ฿197,general,0.0,no sold,จังหวัดสมุทรสงคราม,https://cf.shopee.co.th/file/81c636ca45780205eb68e195d0f1833f_tn,https://shopee.co.th//seed-seeds-♡สี่ฤดูกาลกระเทียมเมล็ดสีขาวรากกระเทียมเมล็ดระเบียงกระถางเมล็ดพันธุ์ผักสวนฟาร์มสวนวิจิตรใบ-Purgen-Leek-เมล็ด☉-i.430417611.7688815309
202,seeds seed ♀เมล็ดกระเทียมสี่ฤดูกาลสามารถออกอากาศบนใบขนาดใหญ่กระเทียมเมล็ดพันธุ์ผักระเบียงระเบียงกระถางในร่มและกลางแจ้งสว,฿120 - ฿407,general,0.0,no sold,จังหวัดลำพูน,https://cf.shopee.co.th/file/e0059236d9cee10b6fee7a4d487bd794_tn,https://shopee.co.th//seeds-seed-♀เมล็ดกระเทียมสี่ฤดูกาลสามารถออกอากาศบนใบขนาดใหญ่กระเทียมเมล็ดพันธุ์ผักระเบียงระเบียงกระถางในร่มและกลางแจ้งสว-i.430421035.6988815974
203,"seed seeds ❆เมล็ดกระเทียมสีแดงหัวกระเทียมสีแดงหนึ่งปี, สี่ฤดูกาล, ใบยาก, เมล็ดกระเทียม, สาม, ระเบียงปลูกอย่างต่อเนื่องกร",฿116,general,0.0,no sold,จังหวัดลำพูน,https://cf.shopee.co.th/file/9069449e849b309dc0950cde49ba2b75_tn,https://shopee.co.th//seed-seeds-❆เมล็ดกระเทียมสีแดงหัวกระเทียมสีแดงหนึ่งปี-สี่ฤดูกาล-ใบยาก-เมล็ดกระเทียม-สาม-ระเบียงปลูกอย่างต่อเนื่องกร-i.430430423.11903791366
204,seeds seed ◎ฤดูใบไม้ร่วงและฤดูหนาวสีขาวรากและกระเทียมเมล็ดพันธุ์ผักสี่ฤดูกาลสายพันธุ์เมล็ดระเบียงในร่มกลางแจ้งกระถางสวนป,฿167 - ฿316,general,0.0,no sold,จังหวัดสระบุรี,https://cf.shopee.co.th/file/6f00bdf8e55186b74e9ab8a9faf7276b_tn,https://shopee.co.th//seeds-seed-◎ฤดูใบไม้ร่วงและฤดูหนาวสีขาวรากและกระเทียมเมล็ดพันธุ์ผักสี่ฤดูกาลสายพันธุ์เมล็ดระเบียงในร่มกลางแจ้งกระถางสวนป-i.430415521.8554651210
205,seeds seed ♡หลังคาสีม่วงใบกว้างเมล็ดกระเทียมสี่ฤดูกาลระเบียงกระถางสวนผลผลิตสูงชิงชันเมล็ดพันธุ์ผักเมล็ดพันธุ์ผัก♗,฿120 - ฿138,general,0.0,no sold,จังหวัดสุราษฎร์ธานี,https://cf.shopee.co.th/file/9302892e948fb0380344fa26741f3e7d_tn,https://shopee.co.th//seeds-seed-♡หลังคาสีม่วงใบกว้างเมล็ดกระเทียมสี่ฤดูกาลระเบียงกระถางสวนผลผลิตสูงชิงชันเมล็ดพันธุ์ผักเมล็ดพันธุ์ผัก♗-i.430418288.6888805054
206,seed seeds ✹กระเทียมรากสีม่วงรากเมล็ดเมล็ดเมล็ดเมล็ดพันธุ์เมล็ดพืชเมล็ดพืชพืชในร่มระเบียงผัก☚,฿142 - ฿279,general,0.0,no sold,จังหวัดลำพูน,https://cf.shopee.co.th/file/1591048d21f7c819a68dbdbfa25be07e_tn,https://shopee.co.th//seed-seeds-✹กระเทียมรากสีม่วงรากเมล็ดเมล็ดเมล็ดเมล็ดพันธุ์เมล็ดพืชเมล็ดพืชพืชในร่มระเบียงผัก☚-i.430430423.7688816645
207,seed seeds ✥สี่ฤดูกาลง่ายเมล็ดพันธุ์ผักกระเทียมเมล็ดกว้างกระเทียมเมล็ดระเบียงในร่มกระถางในร่มกลางแจ้งสวนเรพซีด☸,฿155 - ฿205,general,0.0,no sold,จังหวัดกรุงเทพมหานคร,https://cf.shopee.co.th/file/192af220bfeb18bbd277f5a28a1562a9_tn,https://shopee.co.th//seed-seeds-✥สี่ฤดูกาลง่ายเมล็ดพันธุ์ผักกระเทียมเมล็ดกว้างกระเทียมเมล็ดระเบียงในร่มกระถางในร่มกลางแจ้งสวนเรพซีด☸-i.430411965.4288817100
208,seeds seed ◈ตอนนี้ขุดใบปลิวรากสีแดง leek roots เมล็ดสีม่วงสี่ฤดูกาลผักกระถางบัลลาสต์กระเทียมรากรากสีม่วงรากกว้าง♪,฿129 - ฿327,general,0.0,no sold,จังหวัดประจวบคีรีขันธ์,https://cf.shopee.co.th/file/bc285e229ac9ec8e21f6498c57045a19_tn,https://shopee.co.th//seeds-seed-◈ตอนนี้ขุดใบปลิวรากสีแดง-leek-roots-เมล็ดสีม่วงสี่ฤดูกาลผักกระถางบัลลาสต์กระเทียมรากรากสีม่วงรากกว้าง♪-i.430416395.8954652889
209,seed seeds ☀บิ๊ก Lee กระเทียมเมล็ดใบกว้างเก้าเมล็ดพันธุ์ผักฤดูใบไม้ผลิและฤดูใบไม้ร่วงออกอากาศหลายตัดสูง Yang ระเบียงสวนก,฿141,general,0.0,no sold,จังหวัดสระบุรี,https://cf.shopee.co.th/file/a2cdc5ecf6b5c93c2b9174521e5a8d80_tn,https://shopee.co.th//seed-seeds-☀บิ๊ก-Lee-กระเทียมเมล็ดใบกว้างเก้าเมล็ดพันธุ์ผักฤดูใบไม้ผลิและฤดูใบไม้ร่วงออกอากาศหลายตัดสูง-Yang-ระเบียงสวนก-i.430412775.3048397582
210,เมล็ดพันธุ์seedเมล็ดพืชกะหล่ำปลีต้นหอมผักผักกาดหอมชนิดตัวอ่อน茼蒿พริกผักชีฝรั่งเมล็ดโฟร์ซีซั่กระเทียม娃娃菜,฿96 - ฿122,general,0.0,no sold,จังหวัดกรุงเทพมหานคร,https://cf.shopee.co.th/file/923e52cda53a2cfd2f62bcd400a0ab50_tn,https://shopee.co.th//เมล็ดพันธุ์seedเมล็ดพืชกะหล่ำปลีต้นหอมผักผักกาดหอมชนิดตัวอ่อน茼蒿พริกผักชีฝรั่งเมล็ดโฟร์ซีซั่กระเทียม娃娃菜-i.431511203.10205019912
211,"seed seeds ♙เมล็ดสีเขียวขนาดเล็กกระเทียมเสือภูเขา, กระเทียม, เมล็ดหัวหอมขนาดเล็ก, สี่ฤดูกาล, เย็น, ระเบียงที่ดี, ลาน, กา",฿161,general,0.0,no sold,จังหวัดนครพนม,https://cf.shopee.co.th/file/e61e01c84669bc3b390be5686b86316b_tn,https://shopee.co.th//seed-seeds-♙เมล็ดสีเขียวขนาดเล็กกระเทียมเสือภูเขา-กระเทียม-เมล็ดหัวหอมขนาดเล็ก-สี่ฤดูกาล-เย็น-ระเบียงที่ดี-ลาน-กา-i.430419637.6788815713
212,seed seeds ♞กระเทียมรากต้นกล้าผัดสีแดงรากบิ๊กใบสีม่วงรากสี่ฤดูกาลใบปลิวบางใบรากหอมผักต้นกล้าเมล็ดเมล็ดกระเทียมเมล็ด✱,฿167 - ฿399,general,0.0,no sold,จังหวัดประจวบคีรีขันธ์,https://cf.shopee.co.th/file/aeaeb30d7feb7093af291c00c6e90793_tn,https://shopee.co.th//seed-seeds-♞กระเทียมรากต้นกล้าผัดสีแดงรากบิ๊กใบสีม่วงรากสี่ฤดูกาลใบปลิวบางใบรากหอมผักต้นกล้าเมล็ดเมล็ดกระเทียมเมล็ด✱-i.430416395.4388817482
213,seed seeds ❂The Farmhouse เมล็ดเมล็ดเมล็ด Seedling ป่าหัวหอม Bai เสือภูเขากระเทียม茭茭สดระเบียงป่ากระถางเมล็ด Seeding◈,฿133,general,0.0,no sold,จังหวัดอุบลราชธานี,https://cf.shopee.co.th/file/9427e0b52ab82af5c1f43efedebc1800_tn,https://shopee.co.th//seed-seeds-❂The-Farmhouse-เมล็ดเมล็ดเมล็ด-Seedling-ป่าหัวหอม-Bai-เสือภูเขากระเทียม茭茭สดระเบียงป่ากระถางเมล็ด-Seeding◈-i.430424800.10503791128
214,เม็ดมะม่วง เม็ดมะม่วงอบ เกรด A พร้อมทาน 500g.,฿220,general,5.0,6.0,จังหวัดสงขลา,https://cf.shopee.co.th/file/6b808634ebee9fd4ab414661bffaa36b_tn,https://shopee.co.th//เม็ดมะม่วง-เม็ดมะม่วงอบ-เกรด-A-พร้อมทาน-500g.-i.74664478.3919743841
215,เมล็ด​พันธุ์​ กวางตุ้ง​ฮ่องเต้​สีม่วง​ 100​ เมล็ด,฿9 - ฿23,general,4.8092,774.0,จังหวัดเชียงใหม่,https://cf.shopee.co.th/file/4fe0f911ea44e68360a0832f812b0ec9_tn,https://shopee.co.th//เมล็ด​พันธุ์​-กวางตุ้ง​ฮ่องเต้​สีม่วง​-100​-เมล็ด-i.210307388.7635487818
216,เมล็ด​พันธุ์​ คะน้ายอดไต้หวัน​(เบบี้คะน้า)​ 500-800 เมล็ด,฿8,general,4.8806,1700.0,จังหวัดเชียงใหม่,https://cf.shopee.co.th/file/55937f45429c65f96f68f6dcbaf1cb50_tn,https://shopee.co.th//เมล็ด​พันธุ์​-คะน้ายอดไต้หวัน​(เบบี้คะน้า)​-500-800-เมล็ด-i.210307388.5135464185
217,เมล็ดพันธุ์ ดอกครีพปิ้ง เดซี่ เดซี่เลื้อย Creeping Daisy 150 เมล็ด  เมล็ดพันธุ์แท้ นำเข้าจากต่างประเทศ ปลูกผัก สวนครัว,฿10 - ฿50,ร้านแนะนำ,4.8599,2600.0,จังหวัดน่าน,https://cf.shopee.co.th/file/50a3b1a7ec67be2ed92222b881d8d561_tn,https://shopee.co.th//เมล็ดพันธุ์-ดอกครีพปิ้ง-เดซี่-เดซี่เลื้อย-Creeping-Daisy-150-เมล็ด-เมล็ดพันธุ์แท้-นำเข้าจากต่างประเทศ-ปลูกผัก-สวนครัว-i.269793953.3173835159
218,เมล็ดพันธุ์ ดอกไม้ป่า คละพันธ์ุ 300 เมล็ด Mixed Wildflower  เมล็ดพันธุ์แท้ นำเข้าจากต่างประเทศ ปลูกผักสวนครัว ถูกดี,฿10 - ฿50,ร้านแนะนำ,4.8176,1800.0,จังหวัดน่าน,https://cf.shopee.co.th/file/82d179d70ebfc62c926f8d07f511863f_tn,https://shopee.co.th//เมล็ดพันธุ์-ดอกไม้ป่า-คละพันธ์ุ-300-เมล็ด-Mixed-Wildflower-เมล็ดพันธุ์แท้-นำเข้าจากต่างประเทศ-ปลูกผักสวนครัว-ถูกดี-i.269793953.6854481438
219,เมล็ดพันธุ์ พุ่มไม้เพลิง 100 เมล็ด Kochia Trichophylla เมล็ดพันธุ์แท้ นำเข้าจากต่างประเทศ ปลูกผัก สวนครัว ถูกดี เพาะง่าย,฿10 - ฿50,ร้านแนะนำ,4.7961,1200.0,จังหวัดน่าน,https://cf.shopee.co.th/file/562d6b5e8c66db85b82c2f7031a0213f_tn,https://shopee.co.th//เมล็ดพันธุ์-พุ่มไม้เพลิง-100-เมล็ด-Kochia-Trichophylla-เมล็ดพันธุ์แท้-นำเข้าจากต่างประเทศ-ปลูกผัก-สวนครัว-ถูกดี-เพาะง่าย-i.269793953.5454387125
220,เมล็ดพันธุ์ ผักสลัด รูบี้เรด 1000 เมล็ด Ruby Red Lettuce Seed เมล็ดพันธุ์แท้100% นำเข้าจากต่างประเทศ ปลูกผัก สวนครัว ถูก,฿10 - ฿50,ร้านแนะนำ,4.8707,2300.0,จังหวัดน่าน,https://cf.shopee.co.th/file/797922bac70101493a56142889bfd84b_tn,https://shopee.co.th//เมล็ดพันธุ์-ผักสลัด-รูบี้เรด-1000-เมล็ด-Ruby-Red-Lettuce-Seed-เมล็ดพันธุ์แท้100-นำเข้าจากต่างประเทศ-ปลูกผัก-สวนครัว-ถูก-i.269793953.5744795494
221,เมล็ดพันธุ์ หน่อไม้ฝรั่ง เมรี่วอชิงตัน 60 เมล็ด Mary Washington Asparagus Seed เมล็ดพันธุ์แท้นำเข้าจากต่างประเทศ ปลูกผัก,฿10 - ฿50,ร้านแนะนำ,4.7966,1900.0,จังหวัดน่าน,https://cf.shopee.co.th/file/357f3e50d7a07bc60810e0cd051bc95b_tn,https://shopee.co.th//เมล็ดพันธุ์-หน่อไม้ฝรั่ง-เมรี่วอชิงตัน-60-เมล็ด-Mary-Washington-Asparagus-Seed-เมล็ดพันธุ์แท้นำเข้าจากต่างประเทศ-ปลูกผัก-i.269793953.7644571426
222,เม็ดมะม่วงคลุกเกลือ 1 ถุง,฿42,general,0.0,no sold,จังหวัดนครราชสีมา,https://cf.shopee.co.th/file/bafea22e3c790bf285e543795f958d69_tn,https://shopee.co.th//เม็ดมะม่วงคลุกเกลือ-1-ถุง-i.298259798.5647482306
223,เมล็ดพันธุ์ เบบี้แครอท  100  เมล็ด,฿9,general,4.8807,979.0,จังหวัดเชียงใหม่,https://cf.shopee.co.th/file/b3415e7d0a4b08b617bfd1ca04113215_tn,https://shopee.co.th//เมล็ดพันธุ์-เบบี้แครอท-100-เมล็ด-i.210307388.6941917011
