num,product_id,name,price,rating,review,img_src,url,rank
1,B08V5M2HB5,"Plush Cute Hugging Gorilla Round Donut Washable Dog Bed for Small and Medium Dogs, Cats and Other Animals with Removable Cushion",19.99,no rating,no review,https://m.media-amazon.com/images/I/41p1wiaxzbS._AC_UL320_.jpg,https://www.amazon.com//gp/slredirect/picassoRedirect.html/ref=pa_sp_atf_aps_sr_pg1_1?ie=UTF8&adId=A04773201U68ZI3646ISE&url=%2FHugging-Gorilla-Washable-Animals-Removable%2Fdp%2FB08V5M2HB5%2Fref%3Dsr_1_1_sspa%3Fdchild%3D1%26keywords%3Dcat%26qid%3D1626254940%26sr%3D8-1-spons%26psc%3D1&qualifier=1626254940&id=4392077501378517&widgetName=sp_atf,not be a best
2,B08DHZ3344,"ZAMATE Pet Feeder, 2.5L Smart Pet Feeder for Cats and Dogs, Cat and Dog Food Dispenser (Automatic Pet Feeder)",59.99,4.3,95,https://m.media-amazon.com/images/I/512Bv8JzQ+L._AC_UL320_.jpg,https://www.amazon.com//gp/slredirect/picassoRedirect.html/ref=pa_sp_atf_aps_sr_pg1_1?ie=UTF8&adId=A0742501GZQECSM1NDFS&url=%2FZAMATE-Automatic-Enabled-Dispenser-Programmable%2Fdp%2FB08DHZ3344%2Fref%3Dsr_1_2_sspa%3Fdchild%3D1%26keywords%3Dcat%26qid%3D1626254940%26sr%3D8-2-spons%26psc%3D1&qualifier=1626254940&id=4392077501378517&widgetName=sp_atf,not be a best
3,B093GQLCFP,"JMOSTRG Roller Dog Hair Remover, Cat Hair Remover, Pet Hair Remover, Furniture Clothing Couch Cleaner (Black)",12.99,2.5,6,https://m.media-amazon.com/images/I/616ZDMwh3IS._AC_UL320_.jpg,https://www.amazon.com//gp/slredirect/picassoRedirect.html/ref=pa_sp_atf_aps_sr_pg1_1?ie=UTF8&adId=A08782101QIS9RX4Y29X5&url=%2FJMOSTRG-Remover-Furniture-Clothing-Cleaner%2Fdp%2FB093GQLCFP%2Fref%3Dsr_1_3_sspa%3Fdchild%3D1%26keywords%3Dcat%26qid%3D1626254940%26sr%3D8-3-spons%26psc%3D1&qualifier=1626254940&id=4392077501378517&widgetName=sp_atf,not be a best
4,B093GMZGKL,CatSizor Cat Nail Grinder Trimmer – Professional Quiet 2-Speed Rechargeable Electric Pet Grooming & Smoothing Tool Kit – Painless Paw Clipper,29.95,3.8,13,https://m.media-amazon.com/images/I/810io-7uNdS._AC_UL320_.jpg,https://www.amazon.com//gp/slredirect/picassoRedirect.html/ref=pa_sp_atf_aps_sr_pg1_1?ie=UTF8&adId=A10449282E8LS1KD2MVUJ&url=%2FCatSizor-Cat-Nail-Grinder-Trimmer%2Fdp%2FB093GMZGKL%2Fref%3Dsr_1_4_sspa%3Fdchild%3D1%26keywords%3Dcat%26qid%3D1626254940%26sr%3D8-4-spons%26psc%3D1&qualifier=1626254940&id=4392077501378517&widgetName=sp_atf,not be a best
5,B004QBDO0M,"Advantage II Flea Prevention and Treatment for Large Cats, Over 9 Pounds",out of stock,4.6,"43,429",https://m.media-amazon.com/images/I/81sZ2VgFF1L._AC_UL320_.jpg,https://www.amazon.com//Flea-Prevention-Cats-Over-Advantage/dp/B004QBDO0M/ref=sr_1_5?dchild=1&keywords=cat&qid=1626254940&sr=8-5,Best Seller
6,B000FEF10A,"PetSafe ScoopFree Cat Litter Crystal Tray Refills for ScoopFree Self-Cleaning Cat Litter Boxes - 3-Pack - Non-Clumping, Less Mess, Odor Control - Available in Original Blue, Lavender, or Sensitive",53.95,4.7,"17,538",https://m.media-amazon.com/images/I/817KqJIZwPS._AC_UL320_.jpg,https://www.amazon.com//PetSafe-ScoopFree-Self-Cleaning-Refills-Non-Clumping/dp/B000FEF10A/ref=sr_1_6?dchild=1&keywords=cat&qid=1626254940&rdc=1&sr=8-6,not be a best
7,B0009X29WK,"Dr. Elsey's Ultra Premium Clumping Cat Litter, 40 Lb / 18.14 Kg (Pack May Vary)",18.99,4.4,"35,815",https://m.media-amazon.com/images/I/71W5ZIq1anS._AC_UL320_.jpg,https://www.amazon.com//Dr-Elseys-Premium-Clumping-Litter/dp/B0009X29WK/ref=sr_1_7?dchild=1&keywords=cat&qid=1626254940&sr=8-7,Best Seller
8,B082LQ4QQK,Cats,2.99,3.3,934,https://m.media-amazon.com/images/I/71O6EzN+USL._AC_UL320_.jpg,https://www.amazon.com//Cats-Dermot-Mulroney/dp/B082LQ4QQK/ref=sr_1_8?dchild=1&keywords=cat&qid=1626254940&sr=8-8,not be a best
9,B0002J1F76,Frontline Plus Flea and Tick Treatment for Cats,out of stock,4.3,"13,330",https://m.media-amazon.com/images/I/81EWdCF8RWS._AC_UL320_.jpg,https://www.amazon.com//Frontline-Kittens-pounds-Treatment-Doses/dp/B0002J1F76/ref=sr_1_9?dchild=1&keywords=cat&qid=1626254940&sr=8-9,not be a best
10,B07BN6BX22,"Mibote 30 Pcs Cat Toys Kitten Toys Assorted, Cat Tunnel Catnip Fish Feather Teaser Wand Fish Fluffy Mouse Mice Balls and Bells Toys for Cat Puppy Kitty with Storage Bag",out of stock,4.7,"17,322",https://m.media-amazon.com/images/I/81Vm5+ZtnlL._AC_UL320_.jpg,https://www.amazon.com//MIBOTE-Assorted-Interactive-Feather-Crinkle/dp/B07BN6BX22/ref=sr_1_10?dchild=1&keywords=cat&qid=1626254940&sr=8-10,Best Seller
11,B082YLMPZB,Cats (2019),14.25,3.5,"12,441",https://m.media-amazon.com/images/I/91qknEZWe6L._AC_UL320_.jpg,https://www.amazon.com//Cats-James-Corden/dp/B082YLMPZB/ref=sr_1_11?dchild=1&keywords=cat&qid=1626254940&sr=8-11,not be a best
12,B0876ZGYP4,"rabbitgoo Cat Tree Cat Tower 61"" for Indoor Cats, Multi-Level Cat Condo with Hammock & Scratching Posts for Kittens, Tall Cat Climbing Stand with Plush Perch & Toys for Play Rest",87.98,4.5,"5,965",https://m.media-amazon.com/images/I/718Zm1j8r1S._AC_UL320_.jpg,https://www.amazon.com//rabbitgoo-Multi-Level-Scratching-Furniture-Climbing/dp/B0876ZGYP4/ref=sr_1_12?dchild=1&keywords=cat&qid=1626254940&sr=8-12,not be a best
13,B01BMBPOJ2,Iams Proactive Health Adult Indoor Weight & Hairball Control Dry Cat Food,out of stock,4.8,"19,753",https://m.media-amazon.com/images/I/81P0jFADZmL._AC_UL320_.jpg,https://www.amazon.com//Iams-Proactive-Health-Hairball-Chicken/dp/B01BMBPOJ2/ref=sr_1_13?dchild=1&keywords=cat&qid=1626254940&sr=8-13,Best Seller
14,B07MH7WTSN,"Cat Window Perch, Cat Hammock Window Seat, Space Saving Window Mounted Cat Bed for Large Cats Premium Set",19.99,4.6,"9,449",https://m.media-amazon.com/images/I/81sq7e-WSNL._AC_UL320_.jpg,https://www.amazon.com//Window-Hammock-Saving-Mounted-Premium/dp/B07MH7WTSN/ref=sr_1_14?dchild=1&keywords=cat&qid=1626254940&sr=8-14,Best Seller
15,B07ZK3NSJQ,Fresh Step Advanced Clumping Cat Litter,23.99,4.7,"34,081",https://m.media-amazon.com/images/I/71vRDg066EL._AC_UL320_.jpg,https://www.amazon.com//Fresh-Step-Advanced-Extreme-Clumping/dp/B07ZK3NSJQ/ref=sr_1_15?dchild=1&keywords=cat&qid=1626254940&sr=8-15,not be a best
16,B01J5GE3MA,"PetSafe ScoopFree Premium Crystal Non-Clumping Cat Litter - Fresh, Low-Tracking Odor Control - 2-Pack Refills, 4.5 lb per Pack (9 lb Total) - Original Blue, Lavender or Non-Scented",out of stock,4.5,"19,813",https://m.media-amazon.com/images/I/810pqc7A7WL._AC_UL320_.jpg,https://www.amazon.com//PetSafe-ScoopFree-Premium-Clumping-Crystal/dp/B01J5GE3MA/ref=sr_1_16?dchild=1&keywords=cat&qid=1626254940&rdc=1&sr=8-16,not be a best
17,B092ZXR3LN,"Dogs and Cat Round Pet Brush, Soft Silicone Pet Brushes for Dogs, Which Helps To Soothe Massage, Dog bath brush,Pet bath brush, Dog beauty brush cat massage comb, Suitable for small and medium dogs",7.99,no rating,($7.99/Count),https://m.media-amazon.com/images/I/51+wHBX-NFS._AC_UL320_.jpg,https://www.amazon.com//gp/slredirect/picassoRedirect.html/ref=pa_sp_mtf_aps_sr_pg1_1?ie=UTF8&adId=A09471731BWL5N8P8DSSJ&url=%2FSilicone-Brushes-Massage-massage-Suitable%2Fdp%2FB092ZXR3LN%2Fref%3Dsr_1_17_sspa%3Fdchild%3D1%26keywords%3Dcat%26qid%3D1626254940%26sr%3D8-17-spons%26psc%3D1&qualifier=1626254940&id=4392077501378517&widgetName=sp_mtf,not be a best
18,B09377QBBZ,"Dog and Cat Bath Brush, Dog and Cat Bath Comfortable Massage Soft Silicone Pet Brush, Dog and Cat Grooming Brushes, Soft Silicone Pet Brush, Suitable for Massage, Combing and Bathing (Pink)",7.99,5.0,1,https://m.media-amazon.com/images/I/515b4cEaMYS._AC_UL320_.jpg,https://www.amazon.com//gp/slredirect/picassoRedirect.html/ref=pa_sp_mtf_aps_sr_pg1_1?ie=UTF8&adId=A09874802SYGOR3OVHZF7&url=%2FSilicone-Brushes-Massage%25EF%25BC%258CSoap-Dispenser-Grooming-Blue%2Fdp%2FB09377QBBZ%2Fref%3Dsr_1_18_sspa%3Fdchild%3D1%26keywords%3Dcat%26qid%3D1626254940%26sr%3D8-18-spons%26psc%3D1&qualifier=1626254940&id=4392077501378517&widgetName=sp_mtf,not be a best
19,B091THMLB8,"Poils bebe Cat Scratching Post, 30.3’’ Tall Bradypot Scratcher Cat Furniture with Spring Ball for Indoor Cats and Kittens Handmade Cat Tower Wrapped by Natural Sisal Ropes (Grey)",29.99,5.0,4,https://m.media-amazon.com/images/I/71eq5rDndlS._AC_UL320_.jpg,https://www.amazon.com//gp/slredirect/picassoRedirect.html/ref=pa_sp_mtf_aps_sr_pg1_1?ie=UTF8&adId=A0922625L321LE7O4K0O&url=%2FPoils-bebe-Scratching-Scratcher-Furniture%2Fdp%2FB091THMLB8%2Fref%3Dsr_1_19_sspa%3Fdchild%3D1%26keywords%3Dcat%26qid%3D1626254940%26sr%3D8-19-spons%26psc%3D1&qualifier=1626254940&id=4392077501378517&widgetName=sp_mtf,not be a best
20,B07SGJLDD8,Cats,3.6,4.5,"3,610",https://m.media-amazon.com/images/I/6154+Tf3KgL._AC_UL320_.jpg,https://www.amazon.com//Cats-Elaine-Paige/dp/B07SGJLDD8/ref=sr_1_20?dchild=1&keywords=cat&qid=1626254940&sr=8-20,not be a best
21,B0002J1F7G,Frontline Plus Flea and Tick Treatment for Cats,out of stock,4.4,"7,725",https://m.media-amazon.com/images/I/81YuXzZNc3S._AC_UL320_.jpg,https://www.amazon.com//Frontline-Kittens-pounds-Treatment-Doses/dp/B0002J1F7G/ref=sr_1_21?dchild=1&keywords=cat&qid=1626254940&sr=8-21,not be a best
22,B083S3ZXDF,"Potaroma Electric Flopping Fish 10.5"", Moving Cat Kicker Fish Toy, Realistic Floppy Fish Dog Toy, Wiggle Fish Catnip Toys, Motion Kitten Toy, Plush Interactive Cat Toys, Fun Toy for Cat Exercise",9.99,4.1,"17,969",https://m.media-amazon.com/images/I/71IxSLfzftL._AC_UL320_.jpg,https://www.amazon.com//Potaroma-Electric-Flopping-Realistic-Interactive/dp/B083S3ZXDF/ref=sr_1_22?dchild=1&keywords=cat&qid=1626254940&sr=8-22,Best Seller
23,B07GL45JHQ,Amazon Basics Cat Condo Tree Tower with Hammock Bed and Scratching Post,23.94,4.7,"30,270",https://m.media-amazon.com/images/I/91uOGK5bQ5L._AC_UL320_.jpg,https://www.amazon.com//AmazonBasics-ZJS-16066-6-1-Cat-Hammock-Grey/dp/B07GL45JHQ/ref=sr_1_23?dchild=1&keywords=cat&qid=1626254940&sr=8-23,Best Seller
24,B004NDP8B6,"Umbra 299212-158 Zoola Cat Ring Holder, Chrome",10.99,4.8,"6,807",https://m.media-amazon.com/images/I/71asac8vf8L._AC_UL320_.jpg,https://www.amazon.com//Umbra-Zoola-Ring-Holder-Chrome/dp/B004NDP8B6/ref=sr_1_24?dchild=1&keywords=cat&qid=1626254940&sr=8-24,not be a best
25,B01H3OA7KI,Purina Cat Chow Naturals Indoor with Real Chicken & Turkey Hairball & Weight Control Adult Dry Cat Food,out of stock,4.8,"9,513",https://m.media-amazon.com/images/I/91zSQxGHZNL._AC_UL320_.jpg,https://www.amazon.com//Purina-Cat-Chow-Naturals-Vitamins/dp/B01H3OA7KI/ref=sr_1_25?dchild=1&keywords=cat&qid=1626254940&sr=8-25,not be a best
26,B06WLH71PS,"Rachael Ray Nutrish Super Premium Dry Cat Food, SuperFood Blends (Packaging May Vary)",out of stock,4.7,"13,744",https://m.media-amazon.com/images/I/81JlFDZ9KDL._AC_UL320_.jpg,https://www.amazon.com//Rachael-Ray-Nutrish-Complete-Chicken/dp/B06WLH71PS/ref=sr_1_26?dchild=1&keywords=cat&qid=1626254940&sr=8-26,not be a best
27,B07DLXF7XL,"Veken Pet Fountain, 84oz/2.5L Automatic Cat Water Fountain Dog Water Dispenser with 3 Replacement Filters & 1 Silicone Mat for Cats, Dogs, Multiple Pets",out of stock,4.4,"43,604",https://m.media-amazon.com/images/I/61KQhzEnZBL._AC_UL320_.jpg,https://www.amazon.com//Veken-Fountain-Automatic-Dispenser-Replacement/dp/B07DLXF7XL/ref=sr_1_27?dchild=1&keywords=cat&qid=1626254940&sr=8-27,Best Seller
28,B08T7493WJ,"Potaroma 3 Silvervine Catnip Balls, Edible Kitty Toys for Cats Lick, Safe Healthy Kitten Chew Toys, Teeth Cleaning Dental Cat Toy, Cat Wall Treats",out of stock,3.9,675,https://m.media-amazon.com/images/I/61MFSSVIb2L._AC_UL320_.jpg,https://www.amazon.com//Potaroma-Silvervine-Catnip-Healthy-Cleaning/dp/B08T7493WJ/ref=sr_1_28?dchild=1&keywords=cat&qid=1626254940&sr=8-28,not be a best
29,B095HXJ162,Cats (2019) (4K UHD),14.25,3.5,"12,441",https://m.media-amazon.com/images/I/91JPbybpPiL._AC_UL320_.jpg,https://www.amazon.com//Cats-4K-UHD-James-Corden/dp/B095HXJ162/ref=sr_1_29?dchild=1&keywords=cat&qid=1626254940&sr=8-29,not be a best
30,B08QTLT2F4,Purina Tidy Cats Clumping Cat Litter,21.49,4.6,"14,426",https://m.media-amazon.com/images/I/81tvBoUHTmL._AC_UL320_.jpg,https://www.amazon.com//Tidy-Cats-Clumping-Performance-Recyclable/dp/B08QTLT2F4/ref=sr_1_30?dchild=1&keywords=cat&qid=1626254940&sr=8-30,not be a best
31,B016PXH9R2,"PetSafe ScoopFree Automatic Self Cleaning Hooded Cat Litter Box - Ultra, Top-Entry - Purple or Taupe - Covered 2nd Generation - Includes Disposable Tray with Premium Blue Crystal Litter and Hood",139.95,4.2,"13,797",https://m.media-amazon.com/images/I/51PwasvkuBL._AC_UL320_.jpg,https://www.amazon.com//PetSafe-ScoopFree-Self-Cleaning-Automatic-Disposable/dp/B016PXH9R2/ref=sr_1_31?dchild=1&keywords=cat&qid=1626254940&sr=8-31,not be a best
32,B08NP9DQ7Q,"XYQ Hand Made Rattan Round Bed with Soft Cushion for Cats or Small Dogs, Wicker Basket Pet House",89.99,4.0,9,https://m.media-amazon.com/images/I/61yagbnHeUL._AC_UL320_.jpg,https://www.amazon.com//gp/slredirect/picassoRedirect.html/ref=pa_sp_mtf_aps_sr_pg1_1?ie=UTF8&adId=A02435783314PVYDU5WZX&url=%2FXYQ-cat-Woven-nest-Cream%2Fdp%2FB08NP9DQ7Q%2Fref%3Dsr_1_32_sspa%3Fdchild%3D1%26keywords%3Dcat%26qid%3D1626254940%26sr%3D8-32-spons%26psc%3D1&qualifier=1626254940&id=4392077501378517&widgetName=sp_mtf,not be a best
33,B095SJTK6J,Cat comb-beauty hair removal massage comb-soft hair removal-clear tangles and easy to clean-suitable for cats shell soft hair removal brush(blue),7.99,no rating,($7.99/Count),https://m.media-amazon.com/images/I/31kJia5mwTL._AC_UL320_.jpg,https://www.amazon.com//gp/slredirect/picassoRedirect.html/ref=pa_sp_mtf_aps_sr_pg1_1?ie=UTF8&adId=A08122461EUL6G7BHHXHA&url=%2Fcomb-beauty-removal-comb-soft-removal-clear-clean-suitable%2Fdp%2FB095SJTK6J%2Fref%3Dsr_1_33_sspa%3Fdchild%3D1%26keywords%3Dcat%26qid%3D1626254940%26sr%3D8-33-spons%26psc%3D1&qualifier=1626254940&id=4392077501378517&widgetName=sp_mtf,not be a best
34,B08TWGD1BV,"Pet Finger Toothbrush for Dogs & Cats Professional Dog Toothbrush & Cat Toothbrush Combo Set of 10, Dental Hygiene for Pets",5.99,5.0,1,https://m.media-amazon.com/images/I/613V3ObZmXS._AC_UL320_.jpg,https://www.amazon.com//gp/slredirect/picassoRedirect.html/ref=pa_sp_mtf_aps_sr_pg1_1?ie=UTF8&adId=A10068172NT5679IXAF4L&url=%2FFinger-Toothbrush-Professional-Dental-Hygiene%2Fdp%2FB08TWGD1BV%2Fref%3Dsr_1_34_sspa%3Fdchild%3D1%26keywords%3Dcat%26qid%3D1626254940%26sr%3D8-34-spons%26psc%3D1&qualifier=1626254940&id=4392077501378517&widgetName=sp_mtf,not be a best
35,B005OCXRRW,"Purina Friskies Gravy Wet Cat Food Variety Pack, Shreds Beef, Chicken and Turkey & Cheese Dinner - (24) 5.5 oz. Cans (50000579198)",out of stock,4.8,"9,121",https://m.media-amazon.com/images/I/81RU4-AV03L._AC_UL320_.jpg,https://www.amazon.com//Purina-Friskies-Variety-Shreds-Chicken/dp/B005OCXRRW/ref=sr_1_35?dchild=1&keywords=cat&qid=1626254940&sr=8-35,not be a best
36,B08GWZ26PL,"itPlus Cat Grooming Brush, Self Cleaning Slicker Brushes for Dogs Cats Pet Grooming Brush Tool Gently Removes Loose Undercoat, Mats Tangled Hair Slicker Brush for Pet Massage-Self Cleaning",13.99,4.4,"1,820",https://m.media-amazon.com/images/I/71fyIoWUkRL._AC_UL320_.jpg,https://www.amazon.com//itPlus-Grooming-Cleaning-Undercoat-Massage-Self/dp/B08GWZ26PL/ref=sr_1_36?dchild=1&keywords=cat&qid=1626254940&sr=8-36,Amazon's 
37,B07F45GGPT,"MeoHui Interactive Cat Feather Toys, 2PCS Retractable Cat Wand Toy and 9PCS Teaser Refills Worm Bird Feathers, Cat Toys for Indoor Cats Kitten Play Chase Exercise, 2PCS Extra String with Clasp Added",out of stock,4.6,"13,187",https://m.media-amazon.com/images/I/615cgFb2h7L._AC_UL320_.jpg,https://www.amazon.com//Feather-Retractable-Assorted-Interactive-Exerciser/dp/B07F45GGPT/ref=sr_1_37?dchild=1&keywords=cat&qid=1626254940&sr=8-37,Best Seller
38,B07NPPNVK8,ARM & HAMMER Cloud Control Platinum Clumping Cat Litter 37LB,28.99,4.6,"4,198",https://m.media-amazon.com/images/I/81NVqjSArAL._AC_UL320_.jpg,https://www.amazon.com//Arm-Hammer-Control-Platinum-Clumping/dp/B07NPPNVK8/ref=sr_1_38?dchild=1&keywords=cat&qid=1626254940&sr=8-38,not be a best
39,B06ZZPNV5F,Caterpillar Men's Threshold Waterproof Steel Toe Industrial Boot,94.0,4.6,"4,963",https://m.media-amazon.com/images/I/815kS+p72BL._AC_UL320_.jpg,https://www.amazon.com//Caterpillar-Threshold-Waterproof-Steel-Industrial/dp/B06ZZPNV5F/ref=sr_1_39?dchild=1&keywords=cat&qid=1626254940&sr=8-39,not be a best
40,B07RVPN6SC,"YVE LIFE Cat Laser Toy Automatic,Interactive Toy for Kitten/Dogs - USB Charging,Placing High,5 Random Pattern,Automatic On/Off and Silent (P01)",25.0,4.4,"10,495",https://m.media-amazon.com/images/I/517sBtMv+ZL._AC_UL320_.jpg,https://www.amazon.com//Yvelife-Laser-Automatic-Interactive-Kitten/dp/B07RVPN6SC/ref=sr_1_40?dchild=1&keywords=cat&qid=1626254940&sr=8-40,not be a best
41,B07FZVML3X,UPSKY Cat Toy Roller 3-Level Turntable Cat Toy Balls with Six Colorful Balls Interactive Kitten Fun Mental Physical Exercise Puzzle Toys.,9.99,4.4,"26,905",https://m.media-amazon.com/images/I/71fsVZabBBL._AC_UL320_.jpg,https://www.amazon.com//UPSKY-Colorful-Interactive-Physical-Exercise/dp/B07FZVML3X/ref=sr_1_41?dchild=1&keywords=cat&qid=1626254940&sr=8-41,Best Seller
42,B07H357CGW,"Bonve Pet Fountain, 2.5L/84oz Automatic Cat Water Fountain Dog Water Dispenser with Intelligent Pump and LED Indicator for Water Shortage Alert, with 3 Replacement Filters, 1 Silicone Mat",out of stock,4.4,898,https://m.media-amazon.com/images/I/610Nldoe7hS._AC_UL320_.jpg,https://www.amazon.com//Vifycim-Magnifying-Makeup-Mirror-Lights/dp/B07H357CGW/ref=sr_1_42?dchild=1&keywords=cat&qid=1626254940&sr=8-42,not be a best
43,B0991LPZ71,Cats: Adult Coloring Book,5.0,no rating,no review,https://m.media-amazon.com/images/I/61CPQ-3aMuS._AC_UL320_.jpg,https://www.amazon.com//Cats-Adult-Coloring-Taylor-Ruble/dp/B0991LPZ71/ref=sr_1_43?dchild=1&keywords=cat&qid=1626254940&sr=8-43,not be a best
44,B000F4W02M,Nutramax Laboratories Cosequin Tablet for Cats,out of stock,4.7,"8,880",https://m.media-amazon.com/images/I/711BtR2r6yL._AC_UL320_.jpg,https://www.amazon.com//Nutramax-Cosequin-Capsules-80-Count/dp/B000F4W02M/ref=sr_1_44?dchild=1&keywords=cat&qid=1626254940&sr=8-44,Best Seller
45,B005OB3E30,Purina Fancy Feast Gravy Lovers Poultry & Beef Feast Collection Wet Cat Food Variety Packs,out of stock,4.7,"21,091",https://m.media-amazon.com/images/I/91G9cTAJJgL._AC_UL320_.jpg,https://www.amazon.com//Purina-Fancy-Feast-Poultry-Collection/dp/B005OB3E30/ref=sr_1_45?dchild=1&keywords=cat&qid=1626254940&sr=8-45,not be a best
46,B075QK5SP2,Sheba Perfect Portions Paté Wet Cat Food Tray Variety Packs,out of stock,4.7,"21,152",https://m.media-amazon.com/images/I/813UUzjuo8S._AC_UL320_.jpg,https://www.amazon.com//Sheba-Wet-Food-Signature-Whitefish/dp/B075QK5SP2/ref=sr_1_46?dchild=1&keywords=cat&qid=1626254940&sr=8-46,Best Seller
47,B0777NRJ2N,Purina Friskies Stuf'd & Sauc'd Gravy Wet Cat Food,out of stock,4.7,"15,264",https://m.media-amazon.com/images/I/817GlG6l++S._AC_UL320_.jpg,https://www.amazon.com//Purina-Friskies-Seafood-Chicken-Variety/dp/B0777NRJ2N/ref=sr_1_47?dchild=1&keywords=cat&qid=1626254940&sr=8-47,not be a best
48,B07J2TPH8V,Purina Tidy Cats LightWeight 4-in-1 Strength Clumping Cat Litter,out of stock,4.6,"3,304",https://m.media-amazon.com/images/I/71tRqUw4jFL._AC_UL320_.jpg,https://www.amazon.com//Purina-Tidy-Cats-LightWeight-Strength/dp/B07J2TPH8V/ref=sr_1_48?dchild=1&keywords=cat&qid=1626254940&sr=8-48,not be a best
49,B07C5VV4PD,Amazon.com eGift Card,1.0,4.8,"740,827",https://m.media-amazon.com/images/I/51YrhfHCY5L._AC_UL320_.jpg,https://www.amazon.com//Amazon-eGift-Card-Birthday-Greetings/dp/B07C5VV4PD/ref=sr_1_49?dchild=1&keywords=cat&qid=1626254940&sr=8-49,not be a best
50,B07CV237PW,"Kitty City Raised Cat Food Bowl Collection, Stress Free Pet Feeder and Waterer",7.99,4.6,"15,554",https://m.media-amazon.com/images/I/613WMASMbhL._AC_UL320_.jpg,https://www.amazon.com//Kitty-City-Raised-packs-ounces/dp/B07CV237PW/ref=sr_1_50?dchild=1&keywords=cat&qid=1626254940&sr=8-50,not be a best
51,B002UT92EY,Blue Buffalo Cat Food,out of stock,4.8,"9,429",https://m.media-amazon.com/images/I/81QZzKkviSL._AC_UL320_.jpg,https://www.amazon.com//Blue-Buffalo-Wilderness-Protein-Natural/dp/B002UT92EY/ref=sr_1_51?dchild=1&keywords=cat&qid=1626254940&sr=8-51,not be a best
52,B01FYC9CK2,Danny and Daddy - Season 1,out of stock,no rating,no review,https://m.media-amazon.com/images/I/41DUKtNB3aL._AC_UL320_.jpg,https://www.amazon.com//Cat/dp/B01FYFO2MC/ref=sr_1_52?dchild=1&keywords=cat&qid=1626254940&sr=8-52,not be a best
53,B000WFKTWM,Purina ONE Indoor Advantage Adult Cat Food,out of stock,4.8,"13,123",https://m.media-amazon.com/images/I/81kLbjwWfvS._AC_UL320_.jpg,https://www.amazon.com//Purina-Indoor-Advantage-Adult-Food/dp/B000WFKTWM/ref=sr_1_53?dchild=1&keywords=cat&qid=1626254940&sr=8-53,not be a best
54,B0844VQH5K,"PAWMONA 37"" 3 Story Cat Tree Condo Barrel Tower - Natural Sisal-Covered Scratch Cat Tree Barrel with Top High Edge Removable Snuggle Bed - Machine Washable - Made in Georgia",out of stock,4.8,544,https://m.media-amazon.com/images/I/71nDm+A8myL._AC_UL320_.jpg,https://www.amazon.com//Pawmona-Natural-Sisal-Covered-Scratch-Washable/dp/B0844VQH5K/ref=sr_1_54?dchild=1&keywords=cat&qid=1626254940&sr=8-54,not be a best
55,B00ZQYGSU6,"Hill's Science Diet Dry Cat Food, Adult, Urinary & Hairball Control, Chicken Recipe",out of stock,4.7,"6,587",https://m.media-amazon.com/images/I/813yT5P3MTL._AC_UL320_.jpg,https://www.amazon.com//Science-Diet-Urinary-Hairball-Control/dp/B00ZQYGSU6/ref=sr_1_55?dchild=1&keywords=cat&qid=1626254940&sr=8-55,not be a best
56,B07JZ31KX9,"Henkelion Cat Carriers Dog Carrier Pet Carrier for Small Medium Cats Dogs Puppies of 15 Lbs, TSA Airline Approved Small Dog Carrier Soft Sided, Collapsible Puppy Carrier - Black Grey Pink Purple Blue",23.99,4.7,"21,241",https://m.media-amazon.com/images/I/813v3252ylL._AC_UL320_.jpg,https://www.amazon.com//Henkelion-Carrier-Approved-Carriers-Collapsible/dp/B07JZ31KX9/ref=sr_1_56?dchild=1&keywords=cat&qid=1626254940&sr=8-56,Best Seller
57,B07SMPC3MD,"Comsmart Cat Water Fountain, 81oz/2.4L LED Pet Fountain Stainless Steel Automatic Drinking Water Dispenser for Cats, Dogs, Other Pets",26.99,4.5,"7,735",https://m.media-amazon.com/images/I/51piJZz4wIL._AC_UL320_.jpg,https://www.amazon.com//Comsmart-Fountain-Stainless-Automatic-Dispenser/dp/B07SMPC3MD/ref=sr_1_57?dchild=1&keywords=cat&qid=1626254940&sr=8-57,not be a best
58,B00BCJTYRI,Cat (Animal),9.99,5.0,7,https://m.media-amazon.com/images/I/41kMTUbgJXL._AC_UL320_.jpg,https://www.amazon.com//Cat-Animal-Kay-Rogers-ebook/dp/B00BCJTYRI/ref=sr_1_58?dchild=1&keywords=cat&qid=1626254940&sr=8-58,not be a best
59,B07C2FZKLB,"KITTYROO Cat Hoodie, The Original AS SEEN ON TV Kitty Carrying Sweatshirt, with Super Soft Kangaroo Pet Pouch",32.99,4.1,689,https://m.media-amazon.com/images/I/71VCbEn2gsL._AC_UL320_.jpg,https://www.amazon.com//gp/slredirect/picassoRedirect.html/ref=pa_sp_btf_aps_sr_pg1_1?ie=UTF8&adId=A104818026YLIHR39MK4T&url=%2FKITTYROO-Original-Carrying-Sweatshirt-Kangaroo%2Fdp%2FB07C2FZKLB%2Fref%3Dsr_1_59_sspa%3Fdchild%3D1%26keywords%3Dcat%26qid%3D1626254940%26sr%3D8-59-spons%26psc%3D1&qualifier=1626254940&id=4392077501378517&widgetName=sp_btf,not be a best
60,B007Y31JT2,Thundershirt ThunderShirt for Cats,39.95,4.0,"1,670",https://m.media-amazon.com/images/I/81x7vxyWKzL._AC_UL320_.jpg,https://www.amazon.com//gp/slredirect/picassoRedirect.html/ref=pa_sp_btf_aps_sr_pg1_1?ie=UTF8&adId=A07288101UUOE4G284H46&url=%2FThundershirt-T02-HGL-ThunderShirt-For-Cats%2Fdp%2FB007Y31JT2%2Fref%3Dsr_1_60_sspa%3Fdchild%3D1%26keywords%3Dcat%26qid%3D1626254940%26sr%3D8-60-spons%26psc%3D1&qualifier=1626254940&id=4392077501378517&widgetName=sp_btf,not be a best
