num,product_id,name,price,rating,review,img_src,url,rank
69,B08TCHM4N7,"StarKist Solid White Tuna in Water 5 oz Can Vertical Pack of, 4 Count, (Pack of 4)",out of stock,4.6,250.0,https://m.media-amazon.com/images/I/81duetBWA4L._AC_UL320_.jpg,https://www.amazon.com//StarKist-Solid-White-Water-Vertical/dp/B08TCHM4N7/ref=sr_1_59?dchild=1&keywords=fish&qid=1629801544&sr=8-59,not be a best
70,B006UCUAL6,"Zatarain's Wonder Fish Fri Seafood Breading, 10 oz (Pack of 12)",out of stock,4.3,26.0,https://m.media-amazon.com/images/I/81UuzjKglaL._AC_UL320_.jpg,https://www.amazon.com//Zatarains-Fish-Wonderful-Seafood-Breading/dp/B006UCUAL6/ref=sr_1_60?dchild=1&keywords=fish&qid=1629801544&sr=8-60,not be a best
71,B07V3G3VJX,"McCormick Street Taco Baja Fish Seasoning Mix, 0.75 oz (Pack of 12)",19.56,4.8,42.0,https://m.media-amazon.com/images/I/91KYMqkm7AL._AC_UL320_.jpg,https://www.amazon.com//McCormick-Street-Taco-Baja-Seasoning/dp/B07V3G3VJX/ref=sr_1_61?dchild=1&keywords=fish&qid=1629801544&sr=8-61,not be a best
72,B00IWD4NGY,"Manischewitz Premium Gold Gefilte Fish with Carrots 24oz (2 Pack), Kosher for Passover",13.99,4.4,45.0,https://m.media-amazon.com/images/I/91HDMH6LeYL._AC_UL320_.jpg,https://www.amazon.com//Manischewitz-Premium-Gefilte-Carrots-24-ounce/dp/B00IWD4NGY/ref=sr_1_62?dchild=1&keywords=fish&qid=1629801544&sr=8-62,not be a best
73,B009HXF91G,Louisiana Fish Fry Gallon Seasoned Crispy Fish Fry Seafood Breading Mix - 5.75 lbs.,out of stock,4.8,584.0,https://m.media-amazon.com/images/I/9158lCapSLL._AC_UL320_.jpg,https://www.amazon.com//Louisiana-Gallon-Seasoned-Crispy-Breading/dp/B009HXF91G/ref=sr_1_63?dchild=1&keywords=fish&qid=1629801544&sr=8-63,not be a best
74,B0012LCUXQ,"Romanoff, Caviar Black Lumpfish, 2 oz",13.63,4.2,878.0,https://m.media-amazon.com/images/I/71LPWTTWyiL._AC_UL320_.jpg,https://www.amazon.com//Romanoff-Caviar-Black-Lumpfish-Ounce/dp/B0012LCUXQ/ref=sr_1_64?dchild=1&keywords=fish&qid=1629801544&sr=8-64,not be a best
75,B07GCBMNRQ,Fish Batter Mix Weisenberger Mills - A Ky Proud Product 5.5 Ounce Pack of 3,out of stock,4.5,100.0,https://m.media-amazon.com/images/I/614Z8sUEyDL._AC_UL320_.jpg,https://www.amazon.com//Fish-Batter-Mix-Weisenberger-Mills/dp/B07GCBMNRQ/ref=sr_1_65?dchild=1&keywords=fish&qid=1629801544&sr=8-65,not be a best
76,B00CQTB5WA,"House-Autry Seafood Breader, 2-lb Bag (Pack of 2)",out of stock,4.8,211.0,https://m.media-amazon.com/images/I/914aMXFq-dL._AC_UL320_.jpg,https://www.amazon.com//House-Autry-Seafood-Breader-2-lb-Pack/dp/B00CQTB5WA/ref=sr_1_66?dchild=1&keywords=fish&qid=1629801544&sr=8-66,not be a best
77,B009XPKYOK,Andy's Seasoning Yellow Fish Breading 10oz(Pack of 3),18.99,4.9,122.0,https://m.media-amazon.com/images/I/91kdmtdL4RL._AC_UL320_.jpg,https://www.amazon.com//Andys-Seasoning-Yellow-Fish-Breading/dp/B009XPKYOK/ref=sr_1_67?dchild=1&keywords=fish&qid=1629801544&sr=8-67,not be a best
78,B011LPWAHS,"Andys Golden Fish Batter, 10 Ounces (Pack of 2)",11.95,4.6,49.0,https://m.media-amazon.com/images/I/41x1p16kAZL._AC_UL320_.jpg,https://www.amazon.com//Andys-Golden-Fish-Batter-Ounces/dp/B011LPWAHS/ref=sr_1_68?dchild=1&keywords=fish&qid=1629801544&sr=8-68,not be a best
79,B004H4R27E,"Shore Lunch Fish Breading / Batter Mix, Original Recipe, 3.5-pounds",23.06,4.7,158.0,https://m.media-amazon.com/images/I/81Rz5BAPCsS._AC_UL320_.jpg,https://www.amazon.com//Shore-Lunch-Breading-Original-3-5-pounds/dp/B004H4R27E/ref=sr_1_69?dchild=1&keywords=fish&qid=1629801544&sr=8-69,not be a best
80,B07TY5JGTK,Taro Fish Snack Original Flavour weight 25 g (Pack of 6 pieces),out of stock,4.8,18.0,https://m.media-amazon.com/images/I/81q7NYXPhpL._AC_UL320_.jpg,https://www.amazon.com//Taro-Original-Flavour-weight-pieces/dp/B07TY5JGTK/ref=sr_1_70?dchild=1&keywords=fish&qid=1629801544&sr=8-70,not be a best
81,B003SBW3X0,StarKist Albacore White Tuna in Water - 2.6 oz Pouch (Pack of 24),out of stock,4.8,1456.0,https://m.media-amazon.com/images/I/81T-5HjEhKL._AC_UL320_.jpg,https://www.amazon.com//StarKist-White-Albacore-Pouch-Water/dp/B003SBW3X0/ref=sr_1_71?dchild=1&keywords=fish&qid=1629801544&sr=8-71,not be a best
82,B0978XQ5VC,"Louisiana Fish Fry, Cajun Gumbo Base, 5 oz (Pack of 24)",49.94,4.9,159.0,https://m.media-amazon.com/images/I/81A08-eU27L._AC_UL320_.jpg,https://www.amazon.com//Louisiana-Fish-Fry-Cajun-Gumbo/dp/B0978XQ5VC/ref=sr_1_72?dchild=1&keywords=fish&qid=1629801544&sr=8-72,not be a best
83,B001SB1A0O,"Zatarain's Fish Fry Lemon Pepper, 12-ounces (Pack of12)",out of stock,3.7,10.0,https://m.media-amazon.com/images/I/81w7DgvVyIL._AC_UL320_.jpg,https://www.amazon.com//Zatarains-Fish-Lemon-Pepper-12-ounces/dp/B001SB1A0O/ref=sr_1_73?dchild=1&keywords=fish&qid=1629801544&sr=8-73,not be a best
84,B085TS1D14,"Andy's Seasoning Fish Breading - 3 PACK (1 ea Red, 1 ea Yellow, 1 ea Cajun)",17.45,4.9,65.0,https://m.media-amazon.com/images/I/51EDvUJO53L._AC_UL320_.jpg,https://www.amazon.com//Andys-Seasoning-Fish-Breading-Yellow/dp/B085TS1D14/ref=sr_1_74?dchild=1&keywords=fish&qid=1629801544&sr=8-74,not be a best
85,B007RN5OCM,"Manischewitz Sweet Gefilte Fish in Jelled Broth 24oz (2 Pack), Packed with Protein, No Added MSG, Kosher for Passover",out of stock,4.4,15.0,https://m.media-amazon.com/images/I/81LT6iXqErL._AC_UL320_.jpg,https://www.amazon.com//Manischewitz-Fish-Gefilte-Sweet/dp/B007RN5OCM/ref=sr_1_75?dchild=1&keywords=fish&qid=1629801544&sr=8-75,not be a best
86,B076CQZXXL,Kirkland Albacore Solid White Tuna in Water - 8 Cans (Total Net Weight 3.5lbs),out of stock,4.7,1312.0,https://m.media-amazon.com/images/I/51DLUwmGajL._AC_UL320_.jpg,https://www.amazon.com//Kirkland-Albacore-Solid-White-Water/dp/B076CQZXXL/ref=sr_1_76?dchild=1&keywords=fish&qid=1629801544&sr=8-76,not be a best
87,B07HRL6FXG,AMYSPORTS Duo Lock Snap Fishing Swivels Stainless Barrel Swivels Fishing Lure Snap Swivels Ball Bearing Swivels Fishing Tackle for Saltwater Fishing Freshwater Fishing,11.99,4.5,461.0,https://m.media-amazon.com/images/I/61tTqX2LxTL._AC_UL320_.jpg,https://www.amazon.com//gp/slredirect/picassoRedirect.html/ref=pa_sp_mtf_aps_sr_pg2_1?ie=UTF8&adId=A04755123IYC9Z0SJMM1A&url=%2FAMYSPORTS-Fishing-Stainless-Saltwater-Freshwater%2Fdp%2FB07HRL6FXG%2Fref%3Dsr_1_77_sspa%3Fdchild%3D1%26keywords%3Dfish%26qid%3D1629801544%26sr%3D8-77-spons%26psc%3D1&qualifier=1629801544&id=664274613182315&widgetName=sp_mtf,not be a best
88,B091TKH4SP,"TAISHAN Aquarium Clean Light，3W Mini UV Sanitizer Submersible Light with Timer,Aquarium Water Clean Green Clear Waterproof Clean Lamp for Pond,Swimming Pool,Indoor",18.98,4.3,22.0,https://m.media-amazon.com/images/I/61vJu7pOTrS._AC_UL320_.jpg,https://www.amazon.com//gp/slredirect/picassoRedirect.html/ref=pa_sp_mtf_aps_sr_pg2_1?ie=UTF8&adId=A10378402PE2ZZ058O6GX&url=%2FTAISHAN-Aquarium-Sanitizer-Submersible-Waterproof%2Fdp%2FB091TKH4SP%2Fref%3Dsr_1_78_sspa%3Fdchild%3D1%26keywords%3Dfish%26qid%3D1629801544%26sr%3D8-78-spons%26psc%3D1&qualifier=1629801544&id=664274613182315&widgetName=sp_mtf,not be a best
89,B08CGQ44VV,"hygger LCD Control Automatic Pond Fish Feeder, Capacity 5.5L, DC 12V",112.99,4.1,47.0,https://m.media-amazon.com/images/I/61OUFSmD5YL._AC_UL320_.jpg,https://www.amazon.com//gp/slredirect/picassoRedirect.html/ref=pa_sp_mtf_aps_sr_pg2_1?ie=UTF8&adId=A0214609Q098VL4XVLFW&url=%2Fhygger-Control-Automatic-Feeder-Capacity%2Fdp%2FB08CGQ44VV%2Fref%3Dsr_1_79_sspa%3Fdchild%3D1%26keywords%3Dfish%26qid%3D1629801544%26sr%3D8-79-spons%26psc%3D1%26smid%3DA6VY9Y65RVWTY&qualifier=1629801544&id=664274613182315&widgetName=sp_mtf,not be a best
90,B094VDYJKY,"Andy Roo's Salt-Free Grilled Fish Creole Seasoning, 16 Ounce Bulk Shaker (No MSG, All Natural Spices)",out of stock,4.0,1.0,https://m.media-amazon.com/images/I/81wwK+3TOhS._AC_UL320_.jpg,https://www.amazon.com//Andy-Roos-Salt-Free-Grilled-Seasoning/dp/B094VDYJKY/ref=sr_1_80?dchild=1&keywords=fish&qid=1629801544&sr=8-80,not be a best
91,B08HDQLTF8,"Louisiana Fish Fry Company New Orleans Style Fish Fry with Lemon - Family Size, 22 Ounces (Packaging May Vary) - SET OF 4",out of stock,no rating,no review,https://m.media-amazon.com/images/I/51Bx49fHahL._AC_UL320_.jpg,https://www.amazon.com//Louisiana-Company-Orleans-Style-Lemon/dp/B08HDQLTF8/ref=sr_1_81?dchild=1&keywords=fish&qid=1629801544&sr=8-81,not be a best
92,B083R2BRTC,"Wild Planet Albacore Wild Tuna, Sea Salt, Wildly Delicious - Pole & Line Caught, 5 Ounce(Pack of 4)",out of stock,4.8,5114.0,https://m.media-amazon.com/images/I/718oe3XKUaL._AC_UL320_.jpg,https://www.amazon.com//Wild-Planet-Albacore-Wildly-Delicious/dp/B083R2BRTC/ref=sr_1_82?dchild=1&keywords=fish&qid=1629801544&sr=8-82,not be a best
93,B0978XG6ZL,"Louisiana Fish Fry, Beer Batter Mix, 8.5 oz (Pack of 4)",out of stock,4.7,1165.0,https://m.media-amazon.com/images/I/81AlCrAuqEL._AC_UL320_.jpg,https://www.amazon.com//Louisiana-Fish-Fry-Beer-Batter/dp/B0978XG6ZL/ref=sr_1_83?dchild=1&keywords=fish&qid=1629801544&sr=8-83,not be a best
94,B08R6CM1LH,"Safe Catch Canned Mackerel Fish in Pure Olive Oil, Mercury Tested, Wild Caught North Atlantic Mackerel Fillets Skinless & Boneless, 4oz Cans (Pack of 6)",21.93,4.5,93.0,https://m.media-amazon.com/images/I/71BWXGXwJyL._AC_UL320_.jpg,https://www.amazon.com//Safe-Catch-Mackerel-Atlantic-Skinless/dp/B08R6CM1LH/ref=sr_1_84?dchild=1&keywords=fish&qid=1629801544&sr=8-84,not be a best
95,B07D6DKG5H,Rufus Teague - Fish Rub - Premium BBQ Rub - 6.8oz Bottles - 2 Pack,out of stock,4.8,23.0,https://m.media-amazon.com/images/I/613WoTWkY5S._AC_UL320_.jpg,https://www.amazon.com//Rufus-Teague-FISH-RUB-Gluten-Free/dp/B07D6DKG5H/ref=sr_1_85?dchild=1&keywords=fish&qid=1629801544&sr=8-85,not be a best
96,B09BBTCKFH,"Dinosaur Bar-B-Que Big Action Spice Rub - Hot Spicy Rub for Meat and Fish, BBQ Rubs For Smoking, Perfect for Ribs and Briskets, Blend of Sweet, Spicy, & Savory. Dinosaur voted America's best barbecue",out of stock,no rating,no review,https://m.media-amazon.com/images/I/51cSHmx6ofL._AC_UL320_.jpg,https://www.amazon.com//Dinosaur-Bar-B-Que-Big-Action-Spice/dp/B09BBTCKFH/ref=sr_1_86?dchild=1&keywords=fish&qid=1629801544&sr=8-86,not be a best
97,B0745V681P,"Shore Lunch Fish Breading Batter Mix, Cajun Style, Pack of 3",13.36,4.8,157.0,https://m.media-amazon.com/images/I/81QpCzF7gBS._AC_UL320_.jpg,https://www.amazon.com//Shore-Lunch-Breading-Batter-Cajun/dp/B0745V681P/ref=sr_1_87?dchild=1&keywords=fish&qid=1629801544&sr=8-87,not be a best
98,B07NQ1VJ52,BREADING FISH FRY LEMON P,19.99,3.6,8.0,https://m.media-amazon.com/images/I/81wKPwG5TZL._AC_UL320_.jpg,https://www.amazon.com//Zatarains-Orleans-Seafood-Breading-Pepper/dp/B07NQ1VJ52/ref=sr_1_88?dchild=1&keywords=fish&qid=1629801544&sr=8-88,not be a best
99,B00GPMHCF8,"Chicken of the Sea Chunk White Albacore Tuna in Water, 5 Ounce (Pack of 24)",out of stock,4.6,50.0,https://m.media-amazon.com/images/I/81NbOPMFcOL._AC_UL320_.jpg,https://www.amazon.com//Chicken-Sea-White-Water-Chunk/dp/B00GPMHCF8/ref=sr_1_89?dchild=1&keywords=fish&qid=1629801544&sr=8-89,not be a best
100,B007VWOLSC,Zatarain's Seasoned FISH-FRI Crispy Southern Style 12 Oz (Pack of 3),14.9,4.6,9.0,https://m.media-amazon.com/images/I/21oB52-R+XL._AC_UL320_.jpg,https://www.amazon.com//Zatarains-Seasoned-FISH-FRI-Crispy-Southern/dp/B007VWOLSC/ref=sr_1_90?dchild=1&keywords=fish&qid=1629801544&sr=8-90,not be a best
101,B01CO55TJ0,Fish Fry Seasoning by Florida Seafood Seasonings - 2 Pack x 10 oz - Key Lime Flavored Fish Batter Seasoning,out of stock,4.7,62.0,https://m.media-amazon.com/images/I/91Is80Y6vNL._AC_UL320_.jpg,https://www.amazon.com//Fish-Seasoning-Florida-Seafood-Seasonings/dp/B01CO55TJ0/ref=sr_1_91?dchild=1&keywords=fish&qid=1629801544&sr=8-91,not be a best
102,B00275SD3W,"Olde Thompson Fish & Seafood Blend, 5.5-Ounce Grinders (Pack of 2)",20.7,4.7,118.0,https://m.media-amazon.com/images/I/71HBZFnLS-L._AC_UL320_.jpg,https://www.amazon.com//Olde-Thompson-Seafood-5-5-Ounce-Grinders/dp/B00275SD3W/ref=sr_1_92?dchild=1&keywords=fish&qid=1629801544&sr=8-92,not be a best
103,B097Q92S2C,Great Lakes Fish Fry & BBQ Rub | Gourmet Seasoning | Artisanal Spice Blend | 6 oz (170g) | All Natural | Non GMO | Small Batch | No MSG or Artificial Ingredients | Bougie BBQ | Gustus Vitae | #804,out of stock,4.2,22.0,https://m.media-amazon.com/images/I/71bSuvQWsjS._AC_UL320_.jpg,https://www.amazon.com//Seasoning-Artificial-Ingredients-Gustus-Vitae/dp/B097Q92S2C/ref=sr_1_93?dchild=1&keywords=fish&qid=1629801544&sr=8-93,not be a best
104,B07BJD5GGF,"GOLDEN DIPT, BREADING, FISH FRY, Pack of 8, Size 10 OZ - No Artificial Ingredients",out of stock,4.6,23.0,https://m.media-amazon.com/images/I/71zRtrPZjhS._AC_UL320_.jpg,https://www.amazon.com//GOLDEN-DIPT-BREADING-FISH-Pack/dp/B07BJD5GGF/ref=sr_1_94?dchild=1&keywords=fish&qid=1629801544&sr=8-94,not be a best
105,B00B3H4PSW,"Slap Ya Mama Louisiana Style Cajun Fish Fry, MSG Free and Kosher, 12 Ounce Box, Pack of 2",out of stock,4.5,117.0,https://m.media-amazon.com/images/I/8176+RL6hXL._AC_UL320_.jpg,https://www.amazon.com//Slap-Mama-Cajun-Fish-Pack/dp/B00B3H4PSW/ref=sr_1_95?dchild=1&keywords=fish&qid=1629801544&sr=8-95,not be a best
106,B00GVMDN96,"Manischewitz Gefilte Fish in Liquid Broth, Kosher for Passover, 24-ounce (Pack of 2)",out of stock,3.9,216.0,https://m.media-amazon.com/images/I/813osMiV7vL._AC_UL320_.jpg,https://www.amazon.com//Manischewitz-Gefilte-Liquid-Passover-24-ounce/dp/B00GVMDN96/ref=sr_1_96?dchild=1&keywords=fish&qid=1629801544&sr=8-96,not be a best
107,B08VNM3QGD,"Louisiana Fish Fry Seafood Bundle - 1 each of Shrimp & Oyster Fry and New Orleans Style Fish Fry With Lemon (Pack of Two 10 Ounce Bags, Seasons 6-8 Pounds Total)",13.66,no rating,no review,https://m.media-amazon.com/images/I/711V2kuyTSL._AC_UL320_.jpg,https://www.amazon.com//Louisiana-Fish-Fry-Seafood-Bundle/dp/B08VNM3QGD/ref=sr_1_97?dchild=1&keywords=fish&qid=1629801544&sr=8-97,not be a best
108,B01KYUGCMK,"King Oscar Skinless and Boneless Mediterranean Style Mackerel Fillets, 4.05 Ounce, Pack of 12",out of stock,4.7,662.0,https://m.media-amazon.com/images/I/71hB1o++mCL._AC_UL320_.jpg,https://www.amazon.com//King-Oscar-Skinless-Boneless-Mediterranean/dp/B01KYUGCMK/ref=sr_1_98?dchild=1&keywords=fish&qid=1629801544&sr=8-98,Best Seller
109,B01KOPMA0I,Blue Harbor Fish Co. Wild Albacore Solid White Tuna in Water No Salt Added - 4.6 oz Can (Pack of 12),out of stock,4.7,570.0,https://m.media-amazon.com/images/I/61VmQ3FcmkL._AC_UL320_.jpg,https://www.amazon.com//Blue-Harbor-Albacore-Water-Added/dp/B01KOPMA0I/ref=sr_1_99?dchild=1&keywords=fish&qid=1629801544&sr=8-99,not be a best
110,B07V7QWW3F,McCormick Street Taco Baja Fish 0.75 oz Seasoning Mix,out of stock,3.9,2.0,https://m.media-amazon.com/images/I/91KYMqkm7AL._AC_UL320_.jpg,https://www.amazon.com//McCormick-Baja-Fish-Street-Taco/dp/B07V7QWW3F/ref=sr_1_100?dchild=1&keywords=fish&qid=1629801544&sr=8-100,not be a best
111,B07NQTHV7D,"Wild Caught Rockfish Jerky - Fiery Cajun - Neptune 2.2oz | Organic, Gluten-Free & Paleo | 25g Protein & 560mg Omega 3s | Sustainably Sourced from Small US Fisheries",out of stock,4.1,170.0,https://m.media-amazon.com/images/I/81gf3xqlmYL._AC_UL320_.jpg,https://www.amazon.com//Wild-Caught-White-Fish-Jerky/dp/B07NQTHV7D/ref=sr_1_101?dchild=1&keywords=fish&qid=1629801544&sr=8-101,not be a best
112,B00MK5E2Q6,Beach Cliff Bite Size Herring Fish Steaks in Louisiana Hot Sauce (4 Pack) 3.75 oz Cans,15.94,4.2,64.0,https://m.media-amazon.com/images/I/91fIVXVIxiL._AC_UL320_.jpg,https://www.amazon.com//Beach-Cliff-Herring-Steaks-Louisiana/dp/B00MK5E2Q6/ref=sr_1_102?dchild=1&keywords=fish&qid=1629801544&sr=8-102,not be a best
113,B06VYDPG2V,Ruth Ann's Muskego Ave Chicken/Fish Seasoning By Penzeys Spices 4.4 oz 3/4 cup bag,out of stock,4.6,60.0,https://m.media-amazon.com/images/I/4176PquI9VL._AC_UL320_.jpg,https://www.amazon.com//Muskego-Chicken-Seasoning-Penzeys-Spices/dp/B06VYDPG2V/ref=sr_1_103?dchild=1&keywords=fish&qid=1629801544&sr=8-103,not be a best
114,B091JXDGRT,"TonGass (3-Pack Coconut Reptile Hideout - Coconut Shell Hideout with One Entrance and Smooth Surface Texture - Perfect for Spiders, Lizards, and Fish - Made from 100% Natural Coconut",10.99,no rating,no review,https://m.media-amazon.com/images/I/81Lw0G-2+-L._AC_UL320_.jpg,https://www.amazon.com//gp/slredirect/picassoRedirect.html/ref=pa_sp_btf_aps_sr_pg2_1?ie=UTF8&adId=A001729732H3LDVDVWMWO&url=%2FTonGass-Natural-Coconut-Reptile-Hideout%2Fdp%2FB091JXDGRT%2Fref%3Dsr_1_104_sspa%3Fdchild%3D1%26keywords%3Dfish%26qid%3D1629801544%26sr%3D8-104-spons%26psc%3D1&qualifier=1629801544&id=664274613182315&widgetName=sp_btf,not be a best
115,B094DSCL6Z,YakGear Fish Stik - Lime Green,32.99,4.8,7.0,https://m.media-amazon.com/images/I/31u38NjH+wS._AC_UL320_.jpg,https://www.amazon.com//gp/slredirect/picassoRedirect.html/ref=pa_sp_btf_aps_sr_pg2_1?ie=UTF8&adId=A08498153OADQJZIOYUCY&url=%2FYakGear-Fish-Stik-Lime-Green%2Fdp%2FB094DSCL6Z%2Fref%3Dsr_1_105_sspa%3Fdchild%3D1%26keywords%3Dfish%26qid%3D1629801544%26sr%3D8-105-spons%26psc%3D1&qualifier=1629801544&id=664274613182315&widgetName=sp_btf,not be a best
116,B07TG85FSJ,The Big One Cake Topper Bobber Gone Fishing Theme Little Fisherman Baby First Birthday Reel Fun Ideas O fish ally One Photo Props Decorations,10.99,4.7,487.0,https://m.media-amazon.com/images/I/61hyDCqsz6L._AC_UL320_.jpg,https://www.amazon.com//gp/slredirect/picassoRedirect.html/ref=pa_sp_atf_next_aps_sr_pg3_1?ie=UTF8&adId=A03972781W5WO2FQ5QM5C&url=%2FYaaaaasss-Fishing-Fisherman-Birthday-Decorations%2Fdp%2FB07TG85FSJ%2Fref%3Dsr_1_97_sspa%3Fdchild%3D1%26keywords%3Dfish%26qid%3D1629801559%26sr%3D8-97-spons%26psc%3D1&qualifier=1629801559&id=7723194947368617&widgetName=sp_atf_next,not be a best
117,B00IFPGW7M,Olsen's Stockfish Bits (2 Packs),33.9,4.6,8.0,https://m.media-amazon.com/images/I/51fNRG2R9hL._AC_UL320_.jpg,https://www.amazon.com//gp/slredirect/picassoRedirect.html/ref=pa_sp_atf_next_aps_sr_pg3_1?ie=UTF8&adId=A07321871W2ZFAQG5MDUO&url=%2FOlsens-Stockfish-Bits-2-Packs%2Fdp%2FB00IFPGW7M%2Fref%3Dsr_1_98_sspa%3Fdchild%3D1%26keywords%3Dfish%26qid%3D1629801559%26sr%3D8-98-spons%26psc%3D1&qualifier=1629801559&id=7723194947368617&widgetName=sp_atf_next,not be a best
118,B0881DG1M7,"O Fish Ally One Party Decorations for 1st Birthday - The Big ONE Fish Birthday Banner For Photo Booth Props, Best Ofishally One Birthday Party Supplies For Kids (Ofishally One Birthday Banner)",12.51,4.7,158.0,https://m.media-amazon.com/images/I/71W2uuPQ8JL._AC_UL320_.jpg,https://www.amazon.com//gp/slredirect/picassoRedirect.html/ref=pa_sp_atf_next_aps_sr_pg3_1?ie=UTF8&adId=A07623302ZM4FB1J0I0OK&url=%2FFish-Ally-Party-Decorations-Birthday%2Fdp%2FB0881DG1M7%2Fref%3Dsr_1_99_sspa%3Fdchild%3D1%26keywords%3Dfish%26qid%3D1629801559%26sr%3D8-99-spons%26psc%3D1&qualifier=1629801559&id=7723194947368617&widgetName=sp_atf_next,not be a best
119,B09815BPWK,Little Fisherman Cupcake Toppers 19 pcs - The Big One Theme Mini Fish Pole Decoration Party Supplies - Little Fisherman Theme Birthday Cupcake topper,9.99,no rating,no review,https://m.media-amazon.com/images/I/61KJEfEUGmS._AC_UL320_.jpg,https://www.amazon.com//gp/slredirect/picassoRedirect.html/ref=pa_sp_atf_next_aps_sr_pg3_1?ie=UTF8&adId=A09477473LME867LBA5U5&url=%2FLittle-Fisherman-Cupcake-Toppers-pcs%2Fdp%2FB09815BPWK%2Fref%3Dsr_1_100_sspa%3Fdchild%3D1%26keywords%3Dfish%26qid%3D1629801559%26sr%3D8-100-spons%26psc%3D1&qualifier=1629801559&id=7723194947368617&widgetName=sp_atf_next,not be a best
120,B07NQTHV7D,"Wild Caught Rockfish Jerky - Fiery Cajun - Neptune 2.2oz | Organic, Gluten-Free & Paleo | 25g Protein & 560mg Omega 3s | Sustainably Sourced from Small US Fisheries",out of stock,4.1,170.0,https://m.media-amazon.com/images/I/81gf3xqlmYL._AC_UL320_.jpg,https://www.amazon.com//Wild-Caught-White-Fish-Jerky/dp/B07NQTHV7D/ref=sr_1_101?dchild=1&keywords=fish&qid=1629801559&sr=8-101,not be a best
121,B06VYDPG2V,Ruth Ann's Muskego Ave Chicken/Fish Seasoning By Penzeys Spices 4.4 oz 3/4 cup bag,out of stock,4.6,60.0,https://m.media-amazon.com/images/I/4176PquI9VL._AC_UL320_.jpg,https://www.amazon.com//Muskego-Chicken-Seasoning-Penzeys-Spices/dp/B06VYDPG2V/ref=sr_1_102?dchild=1&keywords=fish&qid=1629801559&sr=8-102,not be a best
122,B00JSWNXAK,Andy Seasonings Orange Pouch with Red,9.19,4.8,181.0,https://m.media-amazon.com/images/I/61Swj5g7wkL._AC_UL320_.jpg,https://www.amazon.com//Andys-Fish-Breading-Ounces-Pack/dp/B00JSWNXAK/ref=sr_1_103?dchild=1&keywords=fish&qid=1629801559&sr=8-103,not be a best
123,B07HQWF1VW,CARIBBEAN TRADITIONS FISH SEASONING 5.29 OZ 2PK,11.86,4.7,69.0,https://m.media-amazon.com/images/I/51kFTXFYj4L._AC_UL320_.jpg,https://www.amazon.com//CARIBBEAN-TRADITIONS-FISH-SEASONING-5-29/dp/B07HQWF1VW/ref=sr_1_104?dchild=1&keywords=fish&qid=1629801559&sr=8-104,not be a best
124,B01498CF0G,Solid Tuna in Virgin Olive Oil - Canned Tuna Fish in Cold Pressed Tunisian Olive Oil from El Manar - 10-Pack of 160g Cans,out of stock,4.7,206.0,https://m.media-amazon.com/images/I/81j2Sc8mDgL._AC_UL320_.jpg,https://www.amazon.com//Solid-Tuna-Virgin-Olive-Oil/dp/B01498CF0G/ref=sr_1_105?dchild=1&keywords=fish&qid=1629801559&sr=8-105,not be a best
125,B07RWHCPGM,"Chicken of the Sea Chunk Light Premium Tuna in Water, 7-Ounce Easy Open Cans (Pack of 12)",29.49,4.6,77.0,https://m.media-amazon.com/images/I/417h16PUtCL._AC_UL320_.jpg,https://www.amazon.com//Chicken-Sea-Chunk-Premium-7-Ounce/dp/B07RWHCPGM/ref=sr_1_106?dchild=1&keywords=fish&qid=1629801559&sr=8-106,not be a best
126,B08CJB7CD6,"Zona Ocean Spanish White Bonito Tuna in Organic Extra Virgin Olive Oil, 7 oz (Pack of 2)",out of stock,5.0,3.0,https://m.media-amazon.com/images/I/41u7m6VqYUL._AC_UL320_.jpg,https://www.amazon.com//Ocean-Spanish-Bonito-Organic-Virgin/dp/B08CJB7CD6/ref=sr_1_107?dchild=1&keywords=fish&qid=1629801559&sr=8-107,not be a best
127,B000HDL16C,"Season Mackerel in Water | Skinless & Boneless Fillets, Keto, Paleo, Kosher, Omega-3 Fatty Acids, Sugar Free, No Salt Added | Certified Wild Caught & Sustainable Fresh Fish | 4.375 oz (Pack of 12)",36.93,4.5,229.0,https://m.media-amazon.com/images/I/71LDtVixc9L._AC_UL320_.jpg,https://www.amazon.com//Season-Skinless-Mackerels-4-375-Ounce-packaging/dp/B000HDL16C/ref=sr_1_108?dchild=1&keywords=fish&qid=1629801559&sr=8-108,not be a best
128,B00T2ZL0YO,"Bumble Bee Solid White Albacore-7 oz, 8 ct",30.99,4.5,373.0,https://m.media-amazon.com/images/I/91fCsJQ-GrL._AC_UL320_.jpg,https://www.amazon.com//Bumble-Bee-Solid-White-Albacore-7/dp/B00T2ZL0YO/ref=sr_1_109?dchild=1&keywords=fish&qid=1629801559&sr=8-109,not be a best
129,B084B7BH8Z,"StarKist Tuna Creations Lemon Pepper, 2.6 oz Pouch (Pack of 10) (Packaging May Vary)",out of stock,4.6,17041.0,https://m.media-amazon.com/images/I/81Ak7iJzWPL._AC_UL320_.jpg,https://www.amazon.com//StarKist-Tuna-Creations-Lemon-Pepper/dp/B084B7BH8Z/ref=sr_1_110?dchild=1&keywords=fish&qid=1629801559&sr=8-110,Best Seller
130,B008X8M3V0,Shorelunch SL-11 Fish Breading 9oz Beer Batter,7.11,4.5,70.0,https://m.media-amazon.com/images/I/81kxh7SrU3S._AC_UL320_.jpg,https://www.amazon.com//Shorelunch-SL-11-Fish-Breading-Batter/dp/B008X8M3V0/ref=sr_1_111?dchild=1&keywords=fish&qid=1629801559&sr=8-111,not be a best
131,B00B392SEI,"House Autry Mills Original Crunchy Fish Fry Breeder, 12 Ounce",out of stock,4.6,37.0,https://m.media-amazon.com/images/I/91287QVAmqL._AC_UL320_.jpg,https://www.amazon.com//House-Autry-Mills-Original-Crunchy/dp/B00B392SEI/ref=sr_1_112?dchild=1&keywords=fish&qid=1629801559&sr=8-112,not be a best
132,B00OTAV4Y8,Yamaki Salt Additive-free Fresh Building Eatable Small Fish Dried Sardine 40g Ship From Japan,0.98,4.3,201.0,https://m.media-amazon.com/images/I/918S53q0lHL._AC_UL320_.jpg,https://www.amazon.com//Yamaki-Additive-free-Building-Eatable-Sardine/dp/B00OTAV4Y8/ref=sr_1_113?dchild=1&keywords=fish&qid=1629801559&sr=8-113,not be a best
133,B00LJXWKX2,Golden Dipt Mix Fry Fish Cajun Style,out of stock,4.5,46.0,https://m.media-amazon.com/images/I/51I3fsZe1+L._AC_UL320_.jpg,https://www.amazon.com//Golden-Dipt-Fish-Cajun-Style/dp/B00LJXWKX2/ref=sr_1_114?dchild=1&keywords=fish&qid=1629801559&sr=8-114,not be a best
134,B01MST2SUH,ZATARAINS BREADING FISH FRY SEASND 10OZ,out of stock,4.2,28.0,https://m.media-amazon.com/images/I/71sh2uexgBL._AC_UL320_.jpg,https://www.amazon.com//ZATARAINS-BREADING-FISH-SEASND-10OZ/dp/B01MST2SUH/ref=sr_1_115?dchild=1&keywords=fish&qid=1629801559&sr=8-115,not be a best
135,B07D6DKG5H,Rufus Teague - Fish Rub - Premium BBQ Rub - 6.8oz Bottles - 2 Pack,out of stock,4.8,23.0,https://m.media-amazon.com/images/I/613WoTWkY5S._AC_UL320_.jpg,https://www.amazon.com//Rufus-Teague-FISH-RUB-Gluten-Free/dp/B07D6DKG5H/ref=sr_1_116?dchild=1&keywords=fish&qid=1629801559&sr=8-116,not be a best
136,B00HXSFJ62,"Louisiana Cajun Fish Fry Seasoning Mix, 10 Ounce - 12 per case.",out of stock,4.8,11.0,https://m.media-amazon.com/images/I/71x8W7rtDOS._AC_UL320_.jpg,https://www.amazon.com//Louisiana-Cajun-Fish-Seasoning-Ounce/dp/B00HXSFJ62/ref=sr_1_117?dchild=1&keywords=fish&qid=1629801559&sr=8-117,not be a best
137,B079G2PVP4,"Safe Catch Canned Ahi Wild Yellowfin Tuna Fish Steak, Lowest Mercury, Every Can is Mercury Tested, Gluten-Free, Paleo, Keto, Whole 30 Approved, High-Protein Food, 5oz Cans - Pack of 6",out of stock,4.5,345.0,https://m.media-amazon.com/images/I/61iW3cDMVqS._AC_UL320_.jpg,https://www.amazon.com//Safe-Catch-Wild-Yellowfin-Tuna/dp/B079G2PVP4/ref=sr_1_118?dchild=1&keywords=fish&qid=1629801559&sr=8-118,not be a best
138,B00MU44T60,"Louisiana Fish Fry Trio One Pack Each of Cajun,seasoned Beer Batter, and Seafood Breading",10.94,4.4,53.0,https://m.media-amazon.com/images/I/910s2p-CKhL._AC_UL320_.jpg,https://www.amazon.com//Louisiana-Fish-Fry-seasoned-Breading/dp/B00MU44T60/ref=sr_1_119?dchild=1&keywords=fish&qid=1629801559&sr=8-119,not be a best
