num,product_id,name,price,rating,review,img_src,url,rank
209,B07ZMK2SM7,Everglades Seasoning Pre-Seasoned Breader Bread Crumb Mix 5 lbs,out of stock,4.7,58.0,https://m.media-amazon.com/images/I/610JXFycGTL._AC_UL320_.jpg,https://www.amazon.com//Everglades-Seasoning-Pre-Seasoned-Breader-Bread/dp/B07ZMK2SM7/ref=sr_1_181?dchild=1&keywords=fish&qid=1629801573&sr=8-181,not be a best
210,B07FCFFSG1,Pack of 6 Taro extra fish snack original flavored by beautiful fantastic 7.5 g.x6,out of stock,4.3,19.0,https://m.media-amazon.com/images/I/81kTuEF7SZL._AC_UL320_.jpg,https://www.amazon.com//Taro-original-flavored-beautiful-fantastic/dp/B07FCFFSG1/ref=sr_1_182?dchild=1&keywords=fish&qid=1629801573&sr=8-182,not be a best
211,B01KOPMAIA,Blue Harbor Fish Co. Wild Albacore Tuna in Water No Salt Added - 3 oz Pouch (Pack of 12),out of stock,4.5,193.0,https://m.media-amazon.com/images/I/81Sn8DU5zmL._AC_UL320_.jpg,https://www.amazon.com//Blue-Harbor-Albacore-Water-Added/dp/B01KOPMAIA/ref=sr_1_183?dchild=1&keywords=fish&qid=1629801573&sr=8-183,not be a best
212,B074HW6FY7,"California Rancher - Monterey Seafood Seasoning, Gluten-free Seafood Boil Seasoning, Premium Fish Fry Seasoning for Fresh Fish and Seafood, 6oz",out of stock,4.6,45.0,https://m.media-amazon.com/images/I/81BDEQzHd6L._AC_UL320_.jpg,https://www.amazon.com//CALIFORNIA-RANCHER-Monterey-Seafood-Seasoning/dp/B074HW6FY7/ref=sr_1_184?dchild=1&keywords=fish&qid=1629801573&sr=8-184,not be a best
213,B07G14SYB4,"Dried Anchovy Headless Deep-frying as Snack or add flavor to soups, side dish Product of Thailand (100)",out of stock,3.9,125.0,https://m.media-amazon.com/images/I/81TW9zIAlmS._AC_UL320_.jpg,https://www.amazon.com//Anchovy-Headless-Healthy-Nutritions-Thailand/dp/B07G14SYB4/ref=sr_1_185?dchild=1&keywords=fish&qid=1629801573&sr=8-185,not be a best
214,B09BBMG7QM,"Louisiana Fish Fry, Gumbo w/Rice Mix, 8 oz box (Pack of 12)",out of stock,4.6,162.0,https://m.media-amazon.com/images/I/71j1AQ3kjlS._AC_UL320_.jpg,https://www.amazon.com//Louisiana-Fish-Fry-Gumbo-Rice/dp/B09BBMG7QM/ref=sr_1_186?dchild=1&keywords=fish&qid=1629801573&sr=8-186,not be a best
215,B008I56D14,Trader Joe's Farm Raised Smoked Trout Skinless in Canola Oil,out of stock,4.1,19.0,https://m.media-amazon.com/images/I/81CDRPfsNkL._AC_UL320_.jpg,https://www.amazon.com//Trader-Joes-Raised-Smoked-Skinless/dp/B008I56D14/ref=sr_1_187?dchild=1&keywords=fish&qid=1629801573&sr=8-187,not be a best
216,B0849PL2CN,Angelo Parodi Mackerel Fillets in Pure Olive Oil | 2 Pack | Imported From Italy | Wild Caught | Hand Selected | Gourmet All Natural | Premium Fish in 4.40 oz Can (125 Gram),out of stock,4.6,37.0,https://m.media-amazon.com/images/I/81Alq-MItdL._AC_UL320_.jpg,https://www.amazon.com//Angelo-Parodi-Mackerel-Fillets-Selected/dp/B0849PL2CN/ref=sr_1_188?dchild=1&keywords=fish&qid=1629801573&sr=8-188,not be a best
217,B019JNHJVQ,StarKist Wild Alaskan Pink Salmon - Reduced Sodium - 14.75 oz Can (Pack of 12),out of stock,4.6,1277.0,https://m.media-amazon.com/images/I/91kjF9nISLL._AC_UL320_.jpg,https://www.amazon.com//StarKist-Alaskan-Salmon-Reduced-Sodium/dp/B019JNHJVQ/ref=sr_1_189?dchild=1&keywords=fish&qid=1629801573&sr=8-189,not be a best
218,B005KK961O,"Slap Ya Mama Seasoning Fish Fry Cajun, 12 oz",9.99,4.7,173.0,https://m.media-amazon.com/images/I/8176+RL6hXL._AC_UL320_.jpg,https://www.amazon.com//Slap-Mama-Seasoning-Fish-Cajun/dp/B005KK961O/ref=sr_1_190?dchild=1&keywords=fish&qid=1629801573&sr=8-190,not be a best
219,B095YPL96M,"Urashima Nori Furikake Rice Seasoning Kozakana (Small Fishes) 28g, Made in Japan with Domestic Ingredients, Healthy & Preservatives-Free",out of stock,no rating,no review,https://m.media-amazon.com/images/I/81o8WnvyXmS._AC_UL320_.jpg,https://www.amazon.com//Urashima-Furikake-Seasoning-Ingredients-Preservatives-Free/dp/B095YPL96M/ref=sr_1_191?dchild=1&keywords=fish&qid=1629801573&sr=8-191,not be a best
220,B00S80O8MK,"Ortega Seasoning Mix, Fish Taco Seasoning, 1 Ounce (Pack of 12)",out of stock,4.6,2154.0,https://m.media-amazon.com/images/I/A1VMesf2YiL._AC_UL320_.jpg,https://www.amazon.com//Ortega-Seasoning-Fish-Taco-Ounce/dp/B00S80O8MK/ref=sr_1_192?dchild=1&keywords=fish&qid=1629801573&sr=8-192,not be a best
221,B0922T7GL8,"Louisiana Fish Fry Beer Batter, 8.5 Ounce (Three Pack)",out of stock,4.6,102.0,https://m.media-amazon.com/images/I/91jvi6ACGML._AC_UL320_.jpg,https://www.amazon.com//Louisiana-Fish-Fry-Batter-Ounce/dp/B0922T7GL8/ref=sr_1_193?dchild=1&keywords=fish&qid=1629801573&sr=8-193,not be a best
222,B07FK3JP8V,Kirkland Signature Superior Quality Solid White Albacore Tuna Cans - 8 Pack (7 oz.),32.95,4.6,147.0,https://m.media-amazon.com/images/I/516SY21K34L._AC_UL320_.jpg,https://www.amazon.com//Kirkland-Signature-Superior-Quality-Albacore/dp/B07FK3JP8V/ref=sr_1_194?dchild=1&keywords=fish&qid=1629801573&sr=8-194,not be a best
223,B00JAHSQ8M,"Phillips Blackening Seasoning used in Phillips Seafood Restaurants on Blackened Chicken, Fish & Seafood",11.96,4.6,652.0,https://m.media-amazon.com/images/I/41KhmbTfJKL._AC_UL320_.jpg,https://www.amazon.com//Phillips-Authentic-Blackening-Seasoning-Oz/dp/B00JAHSQ8M/ref=sr_1_195?dchild=1&keywords=fish&qid=1629801573&sr=8-195,not be a best
224,B002TXF5PQ,"Sylvia's Fish Fry Mix, 10-Ounce Packages (Pack of 9)",27.94,4.5,81.0,https://m.media-amazon.com/images/I/91oH88T9p3L._AC_UL320_.jpg,https://www.amazon.com//Sylvias-Fish-10-Ounce-Packages-Pack/dp/B002TXF5PQ/ref=sr_1_196?dchild=1&keywords=fish&qid=1629801573&sr=8-196,not be a best
225,B077H6MG6Z,"Safe Catch Elite Lowest Mercury Wild-Caught Tuna Pouch Chili Lime Seasoned Fish, Gluten-Free, Paleo, Non-GMO, High Protein Food, 2.6oz Packets, Pack of 12",out of stock,4.5,117.0,https://m.media-amazon.com/images/I/61gAfUt8F4S._AC_UL320_.jpg,https://www.amazon.com//Safe-Catch-Seasoned-Elite-Wild/dp/B077H6MG6Z/ref=sr_1_197?dchild=1&keywords=fish&qid=1629801573&sr=8-197,not be a best
226,B07G4K4S79,"Freshé Gourmet Canned Tuna Variety Pack (4 Pack) Healthy High-Protein Snack & Ready-to-Eat Meal – All-Natural, Non-GMO, Wild-Caught Tuna – Mediterranean Diet Friendly",17.99,4.3,448.0,https://m.media-amazon.com/images/I/91r+E0ZyYiL._AC_UL320_.jpg,https://www.amazon.com//Fresh%C3%A9-Ensalada-Sicilian-Sustainably-Ingredients/dp/B07G4K4S79/ref=sr_1_198?dchild=1&keywords=fish&qid=1629801573&sr=8-198,not be a best
227,B01ALKIMG2,"Chicken of the Sea, Chunk Light Tuna in Water, 5 oz. Can (Pack of 10)",out of stock,4.7,544.0,https://m.media-amazon.com/images/I/81afXc6S97L._AC_UL320_.jpg,https://www.amazon.com//Chicken-Sea-Chunk-Light-Tuna/dp/B01ALKIMG2/ref=sr_1_199?dchild=1&keywords=fish&qid=1629801573&sr=8-199,not be a best
228,B0881G8KH1,"Ofishally One Party Decorations for 1st Birthday - The Big ONE Fish Birthday Banner For Photo Booth Props, Best Ofishally One Birthday Party Supplies For Kids (The Big ONE Birthday Banner)",12.51,4.7,158.0,https://m.media-amazon.com/images/I/71uhmZ1jtAL._AC_UL320_.jpg,https://www.amazon.com//gp/slredirect/picassoRedirect.html/ref=pa_sp_btf_aps_sr_pg4_1?ie=UTF8&adId=A07621741MQSB0QKLFIFG&url=%2FOfishally-One-Party-Decorations-Birthday%2Fdp%2FB0881G8KH1%2Fref%3Dsr_1_200_sspa%3Fdchild%3D1%26keywords%3Dfish%26qid%3D1629801573%26sr%3D8-200-spons%26psc%3D1&qualifier=1629801573&id=6561674526708779&widgetName=sp_btf,not be a best
229,B08ZYZHY3C,"Assorted Cowboy & Animals Wine Bottle Toppers - Armadillo, Bull, Dog, Deer, Horse, Fish, Cowboy (Bull)",9.99,no rating,no review,https://m.media-amazon.com/images/I/51J4ugWUdJL._AC_UL320_.jpg,https://www.amazon.com//gp/slredirect/picassoRedirect.html/ref=pa_sp_btf_aps_sr_pg4_1?ie=UTF8&adId=A06618972IQL39DHFP1MW&url=%2FAssorted-Cowboy-Animals-Bottle-Toppers%2Fdp%2FB08ZYZHY3C%2Fref%3Dsr_1_201_sspa%3Fdchild%3D1%26keywords%3Dfish%26qid%3D1629801573%26sr%3D8-201-spons%26psc%3D1%26smid%3DA3MWKKOMH9JCOC&qualifier=1629801573&id=6561674526708779&widgetName=sp_btf,not be a best
230,B092MYW2SC,Alpha Paw Electronic Bouncy Realistic Fish Pet Toy for Cats and Dogs,14.99,3.0,2.0,https://m.media-amazon.com/images/I/41TuYRDsICS._AC_UL320_.jpg,https://www.amazon.com//gp/slredirect/picassoRedirect.html/ref=pa_sp_atf_next_aps_sr_pg5_1?ie=UTF8&adId=A046847415KMUAJWN2JI7&url=%2FAlpha-Paw-Electronic-Bouncy-Realistic%2Fdp%2FB092MYW2SC%2Fref%3Dsr_1_193_sspa%3Fdchild%3D1%26keywords%3Dfish%26qid%3D1629801587%26sr%3D8-193-spons%26psc%3D1&qualifier=1629801587&id=1188254596769269&widgetName=sp_atf_next,not be a best
231,B096ZKF3PV,The Big One Cake Topper Fish Colorful Glitter O fish ally Theme Little Fisherman Baby Shower Boys Girls Happy Birthday Party Decorations,7.99,no rating,no review,https://m.media-amazon.com/images/I/71rSyIQIO7S._AC_UL320_.jpg,https://www.amazon.com//gp/slredirect/picassoRedirect.html/ref=pa_sp_atf_next_aps_sr_pg5_1?ie=UTF8&adId=A01458123HRPIIMPZL1WR&url=%2FColorful-Glitter-Fisherman-Birthday-Decorations%2Fdp%2FB096ZKF3PV%2Fref%3Dsr_1_194_sspa%3Fdchild%3D1%26keywords%3Dfish%26qid%3D1629801587%26sr%3D8-194-spons%26psc%3D1&qualifier=1629801587&id=1188254596769269&widgetName=sp_atf_next,not be a best
232,B095LJZG3J,Yonfro Men's Swim Trunks Fashion Quick Dry Summer Surf Board Beach Shorts Elastic Waist with Pockets Bathing Suits,21.99,4.0,16.0,https://m.media-amazon.com/images/I/71B-i00K05S._MCnd_AC_UL320_.jpg,https://www.amazon.com//gp/slredirect/picassoRedirect.html/ref=pa_sp_atf_next_aps_sr_pg5_1?ie=UTF8&adId=A0340441JGC94QIQWNJG&url=%2FYonfro-Elastic-Pockets-Bathing-XX-Large%2Fdp%2FB095LJZG3J%2Fref%3Dsr_1_195_sspa%3Fdchild%3D1%26keywords%3Dfish%26qid%3D1629801587%26sr%3D8-195-spons%26psc%3D1%26smid%3DA3AD0XHF9Y0XTS&qualifier=1629801587&id=1188254596769269&widgetName=sp_atf_next,not be a best
233,B08V5G3NJK,"PINGJIA LYJE01, 2.18/2.55/2.95inch Dual-Color T-Tail Soft Lure Bait, 14 Pack/12Pack/10Pack, Fishing Lures",7.98,4.0,8.0,https://m.media-amazon.com/images/I/81kimH-BsDL._AC_UL320_.jpg,https://www.amazon.com//gp/slredirect/picassoRedirect.html/ref=pa_sp_atf_next_aps_sr_pg5_1?ie=UTF8&adId=A01026583KHP9GYIH2MLN&url=%2FPINGJIA-LYJE02-2-55inch-Environmentally-Friendly%2Fdp%2FB08V5G3NJK%2Fref%3Dsr_1_196_sspa%3Fdchild%3D1%26keywords%3Dfish%26qid%3D1629801587%26sr%3D8-196-spons%26psc%3D1&qualifier=1629801587&id=1188254596769269&widgetName=sp_atf_next,not be a best
234,B08LZ2P749,Swedish Fish 12 oz Red Bag,out of stock,5.0,5.0,https://m.media-amazon.com/images/I/81M0iNeBk9S._AC_UL320_.jpg,https://www.amazon.com//Swedish-Fish-12-Red-Bag/dp/B08LZ2P749/ref=sr_1_197?dchild=1&keywords=fish&qid=1629801587&sr=8-197,not be a best
235,B08NW59HD1,"Sophie’s Kitchen Plant-Based Toona (Tuna), 6 Pack of 6 Ounce Cans - Vegan Fish Alternative and Meat Substitute Packed with Protein (Sea Salt Flavor)",out of stock,3.7,65.0,https://m.media-amazon.com/images/I/51UCWgzHx9L._AC_UL320_.jpg,https://www.amazon.com//Sophies-Kitchen-Plant-Based-Toona-Ounce/dp/B08NW59HD1/ref=sr_1_198?dchild=1&keywords=fish&qid=1629801587&sr=8-198,not be a best
236,B07GZC8YVF,"Sea Best Seared & Sliced Ahi Tuna, 4 Ounce (Pack of 20)",out of stock,3.8,22.0,https://m.media-amazon.com/images/I/81OVpjx5JWL._AC_UL320_.jpg,https://www.amazon.com//Sea-Best-Seared-Sliced-Ounce/dp/B07GZC8YVF/ref=sr_1_199?dchild=1&keywords=fish&qid=1629801587&sr=8-199,not be a best
237,B000B6FLB6,"McCormick Golden Dipt Fish 'n Chips Seafood Batter Mix, 10 oz (Pack of 8)",40.75,4.6,83.0,https://m.media-amazon.com/images/I/91K4RyfRS-L._AC_UL320_.jpg,https://www.amazon.com//McCormick-Golden-Chips-Seafood-Batter/dp/B000B6FLB6/ref=sr_1_200?dchild=1&keywords=fish&qid=1629801587&sr=8-200,not be a best
238,B073W9F6T7,"Andy's Breading Fish Red, 10 oz",out of stock,4.7,80.0,https://m.media-amazon.com/images/I/61QmL-f5DcL._AC_UL320_.jpg,https://www.amazon.com//Andys-Breading-Fish-Red-10/dp/B073W9F6T7/ref=sr_1_201?dchild=1&keywords=fish&qid=1629801587&sr=8-201,not be a best
239,B095P4MHWY,"Premium Sturgeon Caviar – Fish Roe With Pure Sea Salt - Premium Quality, Traditional Style, imported, Smooth Flavor & Mouthfeel, Fresh & Tasty - 7.8 oz (220g) Glass Tin (Pack of 1)",out of stock,no rating,no review,https://m.media-amazon.com/images/I/71oia4rqJGS._AC_UL320_.jpg,https://www.amazon.com//Premium-Sturgeon-Caviar-Traditional-Mouthfeel/dp/B095P4MHWY/ref=sr_1_202?dchild=1&keywords=fish&qid=1629801587&sr=8-202,not be a best
240,B00CHTPFR0,Louisiana Fish Fry Cajun Etouffee Base 2.65oz (Pack of 12),out of stock,4.8,178.0,https://m.media-amazon.com/images/I/61fD6sfEzYL._AC_UL320_.jpg,https://www.amazon.com//Louisiana-Fish-Fry-Etouffee-2-65oz/dp/B00CHTPFR0/ref=sr_1_203?dchild=1&keywords=fish&qid=1629801587&sr=8-203,not be a best
241,B095J577NF,AACHI Fish Fry Masala 200 GMS -TWIN PACK - PACK OF 2 ( 200 GMS X 2 ),out of stock,4.0,1.0,https://m.media-amazon.com/images/I/51nvIz1wDyS._AC_UL320_.jpg,https://www.amazon.com//AACHI-Fish-Masala-TWIN-PACK/dp/B095J577NF/ref=sr_1_204?dchild=1&keywords=fish&qid=1629801587&sr=8-204,not be a best
242,B08Z1V8BHS,"VAVEL Canned Fish Variety 4 pack x 170g (5.99 oz): Herring in Tomato Sauce, Smoked Sprats in Oil ""Winter"", Makrel Fillets in Oil, Makrel Fillets in Tomato Sauce. Product of Poland.",out of stock,4.0,1.0,https://m.media-amazon.com/images/I/71Qu7Ndc0fL._AC_UL320_.jpg,https://www.amazon.com//VAVEL-Canned-Fish-Variety-pack/dp/B08Z1V8BHS/ref=sr_1_205?dchild=1&keywords=fish&qid=1629801587&sr=8-205,not be a best
243,B00U8Q0GC8,Thai Taro Fish Snack Hot Chili Flavour 7.5g (Pack of 12),out of stock,3.1,2.0,https://m.media-amazon.com/images/I/614kklVFjNL._AC_UL320_.jpg,https://www.amazon.com//Thai-Taro-Snack-Chili-Flavour/dp/B00U8Q0GC8/ref=sr_1_206?dchild=1&keywords=fish&qid=1629801587&sr=8-206,not be a best
244,B009VNZEEE,"Smoked Sockeye Salmon, 16 Oz. Filet, Wooden Legacy Box",out of stock,4.3,58.0,https://m.media-amazon.com/images/I/81gPw7hKzwL._AC_UL320_.jpg,https://www.amazon.com//Smoked-Sockeye-Salmon-Wooden-Legacy/dp/B009VNZEEE/ref=sr_1_207?dchild=1&keywords=fish&qid=1629801587&sr=8-207,not be a best
245,B07P6C76QM,"TARO Fish Snack, Seafood Snack Spicy Flavoured, Party Size 78g X 2 Packs",out of stock,4.0,10.0,https://m.media-amazon.com/images/I/71NBrVHqUOL._AC_UL320_.jpg,https://www.amazon.com//Snack-Seafood-Spicy-Flavoured-Party/dp/B07P6C76QM/ref=sr_1_208?dchild=1&keywords=fish&qid=1629801587&sr=8-208,not be a best
246,B0035L4U84,TONY CHACHERES MIX FISH FRY SEASONED 10OZ,6.82,4.5,181.0,https://m.media-amazon.com/images/I/61d8l+vaZyL._AC_UL320_.jpg,https://www.amazon.com//TONY-CHACHERES-FISH-SEASONED-10OZ/dp/B0035L4U84/ref=sr_1_209?dchild=1&keywords=fish&qid=1629801587&sr=8-209,not be a best
247,B01NCXN0MV,"Genova Premium Yellowfin Tuna in Olive Oil, Wild Caught, Solid Light, 5 oz. Can (Pack of 8)",out of stock,4.7,3955.0,https://m.media-amazon.com/images/I/71oH090-npL._AC_UL320_.jpg,https://www.amazon.com//Genova-Yellowfin-Tuna-Olive-ounce/dp/B01NCXN0MV/ref=sr_1_210?dchild=1&keywords=fish&qid=1629801587&sr=8-210,not be a best
248,B00PMHKJ3Y,Spade L Ranch Fish & Seafood Seasoning 6 Oz.,9.96,4.9,80.0,https://m.media-amazon.com/images/I/417ZlcQBQQL._AC_UL320_.jpg,https://www.amazon.com//Spade-Ranch-Fish-Seafood-Seasoning/dp/B00PMHKJ3Y/ref=sr_1_211?dchild=1&keywords=fish&qid=1629801587&sr=8-211,not be a best
249,B07QD8K6HH,Vifon Instant Fish Porridge Bag - Chao Ca (50 Count),out of stock,5.0,8.0,https://m.media-amazon.com/images/I/81BwlX2+aZL._AC_UL320_.jpg,https://www.amazon.com//Vifon-Instant-Fish-Porridge-Bag/dp/B07QD8K6HH/ref=sr_1_212?dchild=1&keywords=fish&qid=1629801587&sr=8-212,not be a best
250,B016MZARLS,"Szeged Seasoning/Rub 5 Oz Bundle of 4 Flavors: Chicken, Fish, Steak and Rib",out of stock,4.9,54.0,https://m.media-amazon.com/images/I/81tnrErcS3L._AC_UL320_.jpg,https://www.amazon.com//Szeged-Seasoning-Rub-Bundle-Flavors/dp/B016MZARLS/ref=sr_1_213?dchild=1&keywords=fish&qid=1629801587&sr=8-213,not be a best
251,B00K06AGU8,"Pepperidge Farm Goldfish Cheddar Crackers, 4 oz. Carton",41.2,4.4,58.0,https://m.media-amazon.com/images/I/81tk64IeANL._AC_UL320_.jpg,https://www.amazon.com//Pepperidge-Farm-Goldfish-Crackers-12-count/dp/B00K06AGU8/ref=sr_1_214?dchild=1&keywords=fish&qid=1629801587&sr=8-214,not be a best
252,B01BSQ46M2,Nissui Saba Ajitsuke (Mackerel in Soy Sauce Paste) 6.70oz x 24 pieces,62.95,4.7,8.0,https://m.media-amazon.com/images/I/4182-blOJmL._AC_UL320_.jpg,https://www.amazon.com//Nissui-Ajitsuke-Mackerel-6-70oz-pieces/dp/B01BSQ46M2/ref=sr_1_215?dchild=1&keywords=fish&qid=1629801587&sr=8-215,not be a best
253,B00AK2G9ZI,Louisiana Mix Fish Fry Ssnd Fmly Pk,out of stock,5.0,5.0,https://m.media-amazon.com/images/I/51MvrOIlX6L._AC_UL320_.jpg,https://www.amazon.com//Louisiana-Fish-Fry-Ssnd-Fmly/dp/B00AK2G9ZI/ref=sr_1_216?dchild=1&keywords=fish&qid=1629801587&sr=8-216,not be a best
254,B07DK25V9L,"Zatarain's Crispy Southern Style Fish Fri, 5 lbs",out of stock,4.7,77.0,https://m.media-amazon.com/images/I/71zFCZSBaGL._AC_UL320_.jpg,https://www.amazon.com//Zatarains-Crispy-Southern-Style-Pound/dp/B07DK25V9L/ref=sr_1_217?dchild=1&keywords=fish&qid=1629801587&sr=8-217,not be a best
255,B083JLLGVT,Wild Officer Smoked Cod Liver 120g Pack of 3,14.75,4.4,36.0,https://m.media-amazon.com/images/I/81Eoj2KDWzL._AC_UL320_.jpg,https://www.amazon.com//Wild-Officer-Smoked-Liver-120g/dp/B083JLLGVT/ref=sr_1_218?dchild=1&keywords=fish&qid=1629801587&sr=8-218,not be a best
256,B07FSCKXD1,"Famade foods oven-dried Catfish (Clarias gariepinus)- perfect with ogbono, egusi, pounded yam, amala, gari, pies, tacos, jollof rice, soups and stews",out of stock,3.6,43.0,https://m.media-amazon.com/images/I/61V+YiZpHML._AC_UL320_.jpg,https://www.amazon.com//Famade-oven-dried-Catfish-Clarias-gariepinus/dp/B07FSCKXD1/ref=sr_1_219?dchild=1&keywords=fish&qid=1629801587&sr=8-219,not be a best
257,B0011CZ6W8,"Manischewitz, Gefilte Fish Jelled, 24 oz",out of stock,4.2,124.0,https://m.media-amazon.com/images/I/81Bm9zp3EuL._AC_UL320_.jpg,https://www.amazon.com//Manischewitz-Jellied-Gefilte-Fish-24/dp/B0011CZ6W8/ref=sr_1_220?dchild=1&keywords=fish&qid=1629801587&sr=8-220,not be a best
258,B0978RWPP4,"Funny Grandma Fruits and Vegetable Cleaning Brush, Funny Cleaning Brush,Clean Potatoes Corn Beets Carrots Scallop Hard Shells Fish Mussels Veggie Carrots Roots Gift for Grandma, Mother, Mom, Women",8.9,no rating,no review,https://m.media-amazon.com/images/I/51gG3caf9lS._AC_UL320_.jpg,https://www.amazon.com//gp/slredirect/picassoRedirect.html/ref=pa_sp_mtf_aps_sr_pg5_1?ie=UTF8&adId=A00710492OFJSSV0FFPJU&url=%2FGrandma-Vegetable-Cleaning-Potatoes-Carrots%2Fdp%2FB0978RWPP4%2Fref%3Dsr_1_221_sspa%3Fdchild%3D1%26keywords%3Dfish%26qid%3D1629801587%26sr%3D8-221-spons%26psc%3D1&qualifier=1629801587&id=1188254596769269&widgetName=sp_mtf,not be a best
259,B073SCSZFJ,YakGear Fish Stik - Folding Fish Ruler,32.99,4.7,580.0,https://m.media-amazon.com/images/I/711mYkA4yIL._AC_UL320_.jpg,https://www.amazon.com//gp/slredirect/picassoRedirect.html/ref=pa_sp_mtf_aps_sr_pg5_1?ie=UTF8&adId=A09762121XEQC40NQ1G3N&url=%2FYakGear-Fish-Stik-Sunset-Orange%2Fdp%2FB073SCSZFJ%2Fref%3Dsr_1_222_sspa%3Fdchild%3D1%26keywords%3Dfish%26qid%3D1629801587%26sr%3D8-222-spons%26psc%3D1&qualifier=1629801587&id=1188254596769269&widgetName=sp_mtf,not be a best
260,B097MVSX2H,Fish Pole Cake Topper Fish Colorful Glitter O fish ally Theme Little Fisherman Baby Shower Boys Girls Happy Birthday Party Decorations,8.99,no rating,no review,https://m.media-amazon.com/images/I/61BpPeS+IhS._AC_UL320_.jpg,https://www.amazon.com//gp/slredirect/picassoRedirect.html/ref=pa_sp_mtf_aps_sr_pg5_1?ie=UTF8&adId=A04945833MPZ65PREOVIA&url=%2FColorful-Glitter-Fisherman-Birthday-Decorations%2Fdp%2FB097MVSX2H%2Fref%3Dsr_1_223_sspa%3Fdchild%3D1%26keywords%3Dfish%26qid%3D1629801587%26sr%3D8-223-spons%26psc%3D1&qualifier=1629801587&id=1188254596769269&widgetName=sp_mtf,not be a best
261,B07ZG7V31G,Smoked Sturgeon in Oil by EcoFood (Pack of 3) 8.5 oz | 240 g,out of stock,4.2,6.0,https://m.media-amazon.com/images/I/61w7HpN-fpL._AC_UL320_.jpg,https://www.amazon.com//Smoked-Sturgeon-Oil-EcoFood-Pack/dp/B07ZG7V31G/ref=sr_1_224?dchild=1&keywords=fish&qid=1629801587&sr=8-224,not be a best
262,B08ZV55WJ3,"Seafood Seasoning (2 Cups) Herbs & Spices Blend for Fish, Shrimp, Clams, Crab, Gumbo, & More",out of stock,no rating,no review,https://m.media-amazon.com/images/I/81p1OWrKjrL._AC_UL320_.jpg,https://www.amazon.com//Seafood-Seasoning-Herbs-Spices-Shrimp/dp/B08ZV55WJ3/ref=sr_1_225?dchild=1&keywords=fish&qid=1629801587&sr=8-225,not be a best
263,B08SSVPB6H,"Mrs. Adler's Old Jerusalem Gefilte Fish 24oz (2 Pack), All Natural, Kosher for Passover",out of stock,4.0,19.0,https://m.media-amazon.com/images/I/81h0MK5uWtL._AC_UL320_.jpg,https://www.amazon.com//Mrs-Adlers-Jerusalem-Gefilte-Passover/dp/B08SSVPB6H/ref=sr_1_226?dchild=1&keywords=fish&qid=1629801587&sr=8-226,not be a best
264,B08PGBYQFW,"BAR HARBOR Wild Petite Sardines Extra Virgin Olive Oil, 4.2 OZ",out of stock,4.4,19.0,https://m.media-amazon.com/images/I/91BcFPkcPGS._AC_UL320_.jpg,https://www.amazon.com//HARBOR-Petite-Sardines-Extra-Virgin/dp/B08PGBYQFW/ref=sr_1_227?dchild=1&keywords=fish&qid=1629801587&sr=8-227,not be a best
265,B001SB85G6,"Zatarain's Seasoned Fish Fri Seafood Breading Mix, 12 oz",out of stock,4.0,4.0,https://m.media-amazon.com/images/I/51pTxSY+faL._AC_UL320_.jpg,https://www.amazon.com//Zatarains-Coating-Fish-Seasoned-12-ounces/dp/B001SB85G6/ref=sr_1_228?dchild=1&keywords=fish&qid=1629801587&sr=8-228,not be a best
266,B00KH5YD8I,"Manischewitz Whitefish and Pike in Jelled Broth, Gefilte Fish, 24-ounce (Pack of 2)",out of stock,3.2,23.0,https://m.media-amazon.com/images/I/81EuyQ8a8fL._AC_UL320_.jpg,https://www.amazon.com//Manischewitz-Whitefish-Jelled-Gefilte-24-ounce/dp/B00KH5YD8I/ref=sr_1_229?dchild=1&keywords=fish&qid=1629801587&sr=8-229,not be a best
267,B01FGAKJHW,"Safe Catch Canned Wild Albacore Tuna Fish No Salt Added, Every Fish Mercury Tested, Gluten-Free, Paleo and Keto, High Protein, 5oz Cans, Pack of 6",out of stock,4.7,973.0,https://m.media-amazon.com/images/I/61i0qnzYFKL._AC_UL320_.jpg,https://www.amazon.com//Safe-Catch-Albacore-Added-Mercury/dp/B01FGAKJHW/ref=sr_1_230?dchild=1&keywords=fish&qid=1629801587&sr=8-230,not be a best
268,B08B9VMTMS,"Kentucky Kernel Fish Fry, 9 Ounce",out of stock,4.3,31.0,https://m.media-amazon.com/images/I/81CRUDF8VGL._AC_UL320_.jpg,https://www.amazon.com//Kentucky-Kernel-Fish-Fry-Ounce/dp/B08B9VMTMS/ref=sr_1_231?dchild=1&keywords=fish&qid=1629801587&sr=8-231,not be a best
269,B094PFPNGM,"Bang Bang Kitchen Seafood Seasoning | Cajun Fish Spice, Crab Boil & Dry Rub for Grilling & BBQ | Non-GMO Vegan Preservative Free & Gluten Free Salmon Shrimp & Crawfish | 1 4.5oz Bottle Made in USA",out of stock,4.4,21.0,https://m.media-amazon.com/images/I/81w+WVVsrvS._AC_UL320_.jpg,https://www.amazon.com//Kitchen-Seasoning-Grilling-Preservative-Crawfish/dp/B094PFPNGM/ref=sr_1_232?dchild=1&keywords=fish&qid=1629801587&sr=8-232,not be a best
270,B0078DR8LG,"Yehuda Gefilte Fish, 24 oz",out of stock,4.3,40.0,https://m.media-amazon.com/images/I/91EhH4Z1HiL._AC_UL320_.jpg,https://www.amazon.com//Yehuda-Matzo-Fish-Gelfilte-Orginal/dp/B0078DR8LG/ref=sr_1_233?dchild=1&keywords=fish&qid=1629801587&sr=8-233,not be a best
271,B00MX8EEZO,Louisiana Seasoned Beer Batter Mix 8.5 oz - 2 Pack,12.25,4.5,118.0,https://m.media-amazon.com/images/I/8170T2in6yL._AC_UL320_.jpg,https://www.amazon.com//Louisiana-Seasoned-Beer-Batter-Mix/dp/B00MX8EEZO/ref=sr_1_234?dchild=1&keywords=fish&qid=1629801587&sr=8-234,not be a best
272,B001IZ60S2,"Matiz Sardines in Olive Oil, 4.2 Ounce Can (Pack of 5) Spanish Gourmet Wild Caught Natural Fish for Tapas, Snacks, or Meals, Protein Rich, Sealed Freshness",13.49,4.6,776.0,https://m.media-amazon.com/images/I/81DWjMtmW2S._AC_UL320_.jpg,https://www.amazon.com//Matiz-Espa%C3%B1a-Sardines-Olive-4-2-Ounce/dp/B001IZ60S2/ref=sr_1_235?dchild=1&keywords=fish&qid=1629801587&sr=8-235,not be a best
273,B07RXRBBTS,"Chicken of the Sea Tuna Chunk Light in Water, Premium Tuna In Water, 7-OZ Cans (Pack of 24)",44.96,4.2,13.0,https://m.media-amazon.com/images/I/417h16PUtCL._AC_UL320_.jpg,https://www.amazon.com//Chicken-Sea-Chunk-Light-Premium/dp/B07RXRBBTS/ref=sr_1_236?dchild=1&keywords=fish&qid=1629801587&sr=8-236,not be a best
274,B095TZZR2V,"Nuri Mackerel Fillets Spiced in Olive Oil | 4 Pack | Product of Portugal | Premium Wild Caught, Hand Selected and Packaged | 100% Natural | Gourmet fish in 4.4 oz can (125 Gram)",out of stock,5.0,3.0,https://m.media-amazon.com/images/I/81mDsWGEoWS._AC_UL320_.jpg,https://www.amazon.com//Nuri-Mackerel-Portugal-Selected-Packaged/dp/B095TZZR2V/ref=sr_1_237?dchild=1&keywords=fish&qid=1629801587&sr=8-237,not be a best
275,B07NBVSPV5,"Rio Mare: Set of 12 Cans of Tuna Fish in Olive Oil, Yellowfin Tuna Quality Pack of 12, 80g (2.82oz) Each 960g (33.86oz) Total [ Italian Import ] (24 Pack)",out of stock,5.0,4.0,https://m.media-amazon.com/images/I/81dOg8gV-IL._AC_UL320_.jpg,https://www.amazon.com//Rio-Mare-Yellowfin-Quality-33-86oz/dp/B07NBVSPV5/ref=sr_1_238?dchild=1&keywords=fish&qid=1629801587&sr=8-238,not be a best
276,B00ESPU7XI,"Leftys Spices Fish N Chicken Mix for Oven, Pan or Deep Fry 16oz Bag (Pack of 3) Chose Flavor Below (Original)",out of stock,4.8,178.0,https://m.media-amazon.com/images/I/51dNKBQKUxL._AC_UL320_.jpg,https://www.amazon.com//Leftys-Spices-Chicken-Flavor-Original/dp/B00ESPU7XI/ref=sr_1_239?dchild=1&keywords=fish&qid=1629801587&sr=8-239,not be a best
277,B001EO61A4,"More Than Gourmet Fumet De Poisson Gold Fish Fumet, Stock, 1.5-Ounce Packages (Pack of 6)",out of stock,4.3,20.0,https://m.media-amazon.com/images/I/61gXmkperAL._AC_UL320_.jpg,https://www.amazon.com//Gourmet-Fumet-Poisson-1-5-Ounce-Packages/dp/B001EO61A4/ref=sr_1_240?dchild=1&keywords=fish&qid=1629801587&sr=8-240,not be a best
