num,name,price,type,star,sold,send_from,img_src,url,product_id
44,[HotHit]ปลาหวาน ปลาแห้ง ทูหอมเค็ม แพ๊คราคาประหยัด เรทราคาส่ง ถูกสุดๆส่วนลด 1%สินค้าฟรี,65.0,ร้านแนะนำ,4.795,4600.0,จังหวัดสงขลา,https://cf.shopee.co.th/file/b6afe43437fca5710dc2f0ce165b6637_tn,https://shopee.co.th/-HotHit-ปลาหวาน-ปลาแห้ง-ทูหอมเค็ม-แพ๊คราคาประหยัด-เรทราคาส่ง-ถูกสุดๆ-i.31668920.7816820546?position=48,7816820546
45,ปลาช่อนทะเลแห้ง(ใหญ่) ขนาดบรรจุ 500 กรัมไม่เค็มมาก สะอาดอร่อยซื้อ 2 ชิ้น ลด ฿5,119.0,ร้านแนะนำ,4.8735,1900.0,จังหวัดชลบุรี,https://cf.shopee.co.th/file/98064fe20e91bef2a8fb190434dabad0_tn,https://shopee.co.th/ปลาช่อนทะเลแห้ง(ใหญ่)-ขนาดบรรจุ-500-กรัมไม่เค็มมาก-สะอาดอร่อย-i.212289331.5220604092?position=49,5220604092
46,ปลาช่อนแม่ลาแดดเดียว แท้ๆจากสิงห์บุรี ขนาด1กิโลกรัม,300.0,general,4.8714,2600.0,จังหวัดสิงห์บุรี,https://cf.shopee.co.th/file/7dd250a90fd92ef9a24a28bd87ecbb65_tn,https://shopee.co.th/ปลาช่อนแม่ลาแดดเดียว-แท้ๆจากสิงห์บุรี-ขนาด1กิโลกรัม-i.55134411.7304055102?position=50,7304055102
47,"ซุปเปอร์ซีเชฟ ปลาแมคเคอเรล,ปลาซาร์ดีน 155กรัม แพค10กระป๋อง",158.0,general,4.9583,66.0,จังหวัดสระบุรี,https://cf.shopee.co.th/file/fa5eb7ad7603e424c1db275be2265dee_tn,https://shopee.co.th/ซุปเปอร์ซีเชฟ-ปลาแมคเคอเรล-ปลาซาร์ดีน-155กรัม-แพค10กระป๋อง-i.81231763.9830703865?position=51,9830703865
48,ปลาริวกิวหวาน แท้100% น้ำหนัก500กรัม,230.0,ร้านแนะนำ,4.8565,424.0,จังหวัดประจวบคีรีขันธ์,https://cf.shopee.co.th/file/aa5fe2b4e3d504ed5a4ceca438d3f6b8_tn,https://shopee.co.th/ปลาริวกิวหวาน-แท้100-น้ำหนัก500กรัม-i.116318746.1827319291?position=52,1827319291
49,เต้าหู้ปลาเจ 500 กรัม (อร่อยมาก!) KT อาหารเจ อาหารมังสวิรัติ,149.0,general,4.8428,1600.0,จังหวัดนนทบุรี,https://cf.shopee.co.th/file/a12af75e2daf1dc62e4cb3514468c2cb_tn,https://shopee.co.th/เต้าหู้ปลาเจ-500-กรัม-(อร่อยมาก!)-KT-อาหารเจ-อาหารมังสวิรัติ-i.66730156.1289120357?position=53,1289120357
50,🔥❌ส่งด่วนภายในวันเดียว❌🔥 ทอดมันปลา 1000 กรัม,70.0,ร้านแนะนำ,4.8491,222.0,จังหวัดกรุงเทพมหานคร,https://cf.shopee.co.th/file/6785f063e8a4db3fe6dd3d7697dc0bb9_tn,https://shopee.co.th/🔥❌ส่งด่วนภายในวันเดียว❌🔥-ทอดมันปลา-1000-กรัม-i.38444368.3675751624?position=54,3675751624
51,ตาข่ายดักปลา ตาข่ายดักกุ้ง มุ้งดักปลา 4ช่อง 6ช่อง 8ช่อง 10ช่อง มุ้งดักกุ้ง ที่ดักกุ้ง ที่ดักปลา ลอบดักปลา ที่ดักปลา คอนโดตากปลา อาหารปลาช้อปเพิ่มคุ้มกว่า,18.0,general,4.5749,4900.0,จังหวัดสมุทรปราการ,https://cf.shopee.co.th/file/90982a58de1b7d329c6ee1e25aa9ff2a_tn,https://shopee.co.th/ตาข่ายดักปลา-ตาข่ายดักกุ้ง-มุ้งดักปลา-4ช่อง-6ช่อง-8ช่อง-10ช่อง-มุ้งดักกุ้ง-ที่ดักกุ้ง-ที่ดักปลา-ลอบดักปลา-ที่ดักปลา-คอนโดตากปลา-อาหารปลา-i.265118558.8943117773?ads_keyword=%E0%B8%AD%E0%B8%A7%E0%B8%99%E0%B8%A5%E0%B8%B2%E0%B8%81%E0%B8%9B%E0%B8%A5%E0%B8%B2&adsid=8678828&campaignid=4888228&position=55,8943117773
52,ที่ตากปลา ที่ตากอาหาร คอนโดตากปลา 4 ชั้น มุ้งตากอาหาร พร้อมซิปปิดกันแมลง มี4 ขนาด พร้อมซิปปิดกันแมลง รีตะขอ 1 ชิ้นซื้อ 8 ชิ้น ลด ฿1,44.0,general,4.8009,3700.0,จังหวัดกรุงเทพมหานคร,https://cf.shopee.co.th/file/4014d7e3944bfb0d6e9807d94416b3d5_tn,https://shopee.co.th/ที่ตากปลา-ที่ตากอาหาร-คอนโดตากปลา-4-ชั้น-มุ้งตากอาหาร-พร้อมซิปปิดกันแมลง-มี4-ขนาด-พร้อมซิปปิดกันแมลง-รีตะขอ-1-ชิ้น-i.432349113.6088804214?ads_keyword=%E0%B8%97%E0%B8%B5%E0%B9%88%E0%B8%95%E0%B8%B2%E0%B8%81%E0%B8%9B%E0%B8%A5%E0%B8%B2&adsid=9101467&campaignid=5166648&position=56,6088804214
53,หอยแอปเปิ้ล กินเศษอาหารกินขี้ปลาใต้ตู้ปลา แถมน่ารักตู้สะอาดใสแจ๋ว,35.0,general,5.0,10.0,จังหวัดนครปฐม,https://cf.shopee.co.th/file/d33574089eebfd8110c037aae44dc963_tn,https://shopee.co.th/หอยแอปเปิ้ล-กินเศษอาหารกินขี้ปลาใต้ตู้ปลา-แถมน่ารักตู้สะอาดใสแจ๋ว-i.137296632.13512841781?ads_keyword=%E0%B8%97%E0%B8%B3%E0%B8%84%E0%B8%A7%E0%B8%B2%E0%B8%A1%E0%B8%AA%E0%B8%B0%E0%B8%AD%E0%B8%B2%E0%B8%94%E0%B8%95%E0%B8%B9%E0%B9%89%E0%B8%9B%E0%B8%A5%E0%B8%B2&adsid=14905803&campaignid=8619489&position=57,13512841781
54,ปลาเยอรมันเรืองแสงมีหลายสี ตกแต่งตู้ปลาสวยงาม สีธรรมชาติ,60.0,general,5.0,6.0,จังหวัดนครปฐม,https://cf.shopee.co.th/file/9303804afb217a50acee7d4fdc014679_tn,https://shopee.co.th/ปลาเยอรมันเรืองแสงมีหลายสี-ตกแต่งตู้ปลาสวยงาม-สีธรรมชาติ-i.137296632.12012840821?ads_keyword=%E0%B8%9B%E0%B8%A5%E0%B8%B2%E0%B9%80%E0%B8%A3%E0%B8%B7%E0%B8%AD%E0%B8%87%E0%B9%81%E0%B8%AA%E0%B8%87&adsid=14905991&campaignid=8619623&position=58,12012840821
55,คอนโดตากปลา ที่ตากอาหาร4ชั้น มุ้งตากอาหาร คอนโดตากอาหาร ตาข่ายตากอาหาร มุ้งตากอาหาร พร้อมซิปปิดกันแมลง ฟรีตะขอ1ชิ้นซื้อ 5 ชิ้น ลด ฿1,44.0,general,4.9286,516.0,จังหวัดกรุงเทพมหานคร,https://cf.shopee.co.th/file/494bd5724e256fa11fef7833efa26d51_tn,https://shopee.co.th/คอนโดตากปลา-ที่ตากอาหาร4ชั้น-มุ้งตากอาหาร-คอนโดตากอาหาร-ตาข่ายตากอาหาร-มุ้งตากอาหาร-พร้อมซิปปิดกันแมลง-ฟรีตะขอ1ชิ้น-i.322645814.9254639759?ads_keyword=%E0%B8%84%E0%B8%AD%E0%B8%99%E0%B9%82%E0%B8%94%E0%B8%95%E0%B8%B2%E0%B8%81%E0%B8%9B%E0%B8%A5%E0%B8%B2&adsid=9298964&campaignid=5291873&position=59,9254639759
