num,name,price,type,star,sold,send_from,img_src,url,product_id
85,ปลาซาบะนอร์เวย์ธรรมชาติ แช่แข็ง Norwegian Mackerel by Alaska King,50.0,general,4.9836,1600.0,จังหวัดสมุทรสาคร,https://cf.shopee.co.th/file/197854bf28ef65f9aaef2a19c4f16409_tn,https://shopee.co.th//ปลาซาบะนอร์เวย์ธรรมชาติ-แช่แข็ง-Norwegian-Mackerel-by-Alaska-King-i.372422428.5376285309?position=99,5376285309
86,ปลาหวาน ปลาทูหวานโรยงา ถูกมาก อร่อย ทานง่าย ของใหม่ ปลาหวานงา,69.0,ร้านแนะนำ,4.7551,1600.0,จังหวัดประจวบคีรีขันธ์,https://cf.shopee.co.th/file/1d5409d18f13442d124d65724f23b641_tn,https://shopee.co.th//ปลาหวาน-ปลาทูหวานโรยงา-ถูกมาก-อร่อย-ทานง่าย-ของใหม่-ปลาหวานงา-i.91639966.3354948002?position=100,3354948002
87,ปลากะป๋อง สามแม่ครัว ปลาชาร์ดีนในซอสมะเขือเทศ ขนาด155กรัม 1แพ็ค10ป๋อง,190.0,ร้านแนะนำ,4.6667,12.0,จังหวัดเลย,https://cf.shopee.co.th/file/c75acf010046166e0e6706e7c8a176f5_tn,https://shopee.co.th//ปลากะป๋อง-สามแม่ครัว-ปลาชาร์ดีนในซอสมะเขือเทศ-ขนาด155กรัม-1แพ็ค10ป๋อง-i.10970044.6880228697?position=101,6880228697
88,🔻ปลากรอบสมุนไพร/ปลากรอบสามรส ถูกสุดๆ ขนาด500กรัม/250กรัม/150กรัม📌ของทานเล่นๆกินกับส้มตำยิ่งแซ่บ🔻พร้อมส่ง,45.0,general,4.7237,767.0,จังหวัดพระนครศรีอยุธยา,https://cf.shopee.co.th/file/9be0f5c026f8c663f6b22f64143165fc_tn,https://shopee.co.th//🔻ปลากรอบสมุนไพร-ปลากรอบสามรส-ถูกสุดๆ-ขนาด500กรัม-250กรัม-150กรัม📌ของทานเล่นๆกินกับส้มตำยิ่งแซ่บ🔻พร้อมส่ง-i.156331573.4260178377?position=102,4260178377
89,ปลาดุกแดดเดียว7-10 ตัวขนส่งแบบเย็น⚠️อ่านก่อนสั่ง COVID ช่วงนี้ขนส่งงดรับพื้นที่ห่างไกล,95.0,general,4.7989,1400.0,จังหวัดสมุทรปราการ,https://cf.shopee.co.th/file/8752be7f7f072c9d008da4746ec21397_tn,https://shopee.co.th//ปลาดุกแดดเดียว7-10-ตัวขนส่งแบบเย็น⚠️อ่านก่อนสั่ง-COVID-ช่วงนี้ขนส่งงดรับพื้นที่ห่างไกล-i.82098483.2386785831?position=103,2386785831
90,🐬อร่อยมาก กรอบๆใหม่ๆ🐬ปลาข้าวสารตัวเล็กพรีเมี่ยม100%🎀 พร้อมทาน พร้อมส่ง,141.0,ร้านแนะนำ,4.8972,3400.0,จังหวัดชลบุรี,https://cf.shopee.co.th/file/0589022d50539c09ff46b45d5358cee2_tn,https://shopee.co.th//🐬อร่อยมาก-กรอบๆใหม่ๆ🐬ปลาข้าวสารตัวเล็กพรีเมี่ยม100-🎀-พร้อมทาน-พร้อมส่ง-i.57104437.1643233420?position=104,1643233420
91,โรซ่า ปลากระป๋อง ปลาแมคเคอเรลในซอสมะเขือเทศ ขนาด 155 กรัม แพ็ค 5 กระป๋อง,95.0,shopee mall,4.9697,148.0,จังหวัดสมุทรปราการ,https://cf.shopee.co.th/file/044c9b5e2372b5292c47ea4f8b22ab1a_tn,https://shopee.co.th//โรซ่า-ปลากระป๋อง-ปลาแมคเคอเรลในซอสมะเขือเทศ-ขนาด-155-กรัม-แพ็ค-5-กระป๋อง-i.68742851.7370868890?position=105,7370868890
92,ปลาช่อนแดดเดียว หั่นชิ้น พร้อมนำไปทอด 500 กรัม,135.0,general,4.8522,2100.0,จังหวัดสมุทรปราการ,https://cf.shopee.co.th/file/6e36122c156a924f8b88e7a60a3cf80a_tn,https://shopee.co.th//ปลาช่อนแดดเดียว-หั่นชิ้น-พร้อมนำไปทอด-500-กรัม-i.221514806.4737849525?position=106,4737849525
93,sale sale sale!!!ปลาอินทรีย์เค็มเจ๊จุรี(ชิ้นนี้ไม่มีดราม่านะค่ะ)รบกวนสั่ง 2 ชิ้นขึ้นไปนะค่ะ,22.0,ร้านแนะนำ,4.8333,679.0,จังหวัดสุราษฎร์ธานี,https://cf.shopee.co.th/file/0729a4cfcf1cc0830a5812e56bbf5247_tn,https://shopee.co.th//sale-sale-sale!!!ปลาอินทรีย์เค็มเจ๊จุรี(ชิ้นนี้ไม่มีดราม่านะค่ะ)รบกวนสั่ง-2-ชิ้นขึ้นไปนะค่ะ-i.46449532.5155633529?position=107,5155633529
94,ปลาเนื้ออ่อนย่างรมควัน ย่างใหม่ ซีลให้ทุกออเดอร์,140.0,general,4.7179,387.0,จังหวัดลำปาง,https://cf.shopee.co.th/file/169a76d96d4164e70804fa100de8f32c_tn,https://shopee.co.th//ปลาเนื้ออ่อนย่างรมควัน-ย่างใหม่-ซีลให้ทุกออเดอร์-i.33626260.4421969453?position=108,4421969453
95,ปลาหวาน ปลาทูแดงหวาน🐟🐟 แพ็ค 500 กรัม เกรด A,50.0,general,4.7893,4500.0,จังหวัดชลบุรี,https://cf.shopee.co.th/file/9c49c8050502e9c13a5419ad7edb8271_tn,https://shopee.co.th//ปลาหวาน-ปลาทูแดงหวาน🐟🐟-แพ็ค-500-กรัม-เกรด-A-i.23183981.474777640?position=109,474777640
96,ปลาริวกิวหวานกลม เนื้อใสปิ๊ง ของใหม่ สดใหม่ทุกวัน,95.0,ร้านแนะนำ,4.7833,827.0,จังหวัดประจวบคีรีขันธ์,https://cf.shopee.co.th/file/df0321c83f5a8891a77ace83f8f5795d_tn,https://shopee.co.th//ปลาริวกิวหวานกลม-เนื้อใสปิ๊ง-ของใหม่-สดใหม่ทุกวัน-i.91639966.7548413151?position=110,7548413151
97,ปลาดุกแดดเดียว ปลอดสารเคมี แพคละ3ตัว,50.0,general,4.4211,296.0,จังหวัดกรุงเทพมหานคร,https://cf.shopee.co.th/file/20981649eee78a4cff49115addd5c488_tn,https://shopee.co.th//ปลาดุกแดดเดียว-ปลอดสารเคมี-แพคละ3ตัว-i.116610938.3711137995?position=111,3711137995
98,เซตคู่ชวนแซ่บ : ลูกชิ้นบุ๊กโกะ ลูกชิ้นปลามันดูน้ำแตก + น้ำแตกซีฟู้ดส์,218.0,ร้านแนะนำ,4.9286,269.0,จังหวัดกรุงเทพมหานคร,https://cf.shopee.co.th/file/d470c52ae9faa2169576cad586e6b11d_tn,https://shopee.co.th//เซตคู่ชวนแซ่บ-ลูกชิ้นบุ๊กโกะ-ลูกชิ้นปลามันดูน้ำแตก-น้ำแตกซีฟู้ดส์-i.326151615.9070505164?position=112,9070505164
99,ปลาช่อนแดดเดียวตัวเล็ก ไร้ก้างคละไซส์  150บาท/ขนาด 5-10ตัว/ 500 กรัม สด ใหม่ สะอาด,180.0,ร้านแนะนำ,4.7904,914.0,จังหวัดสุโขทัย,https://cf.shopee.co.th/file/4b524965358c5a9263ebab7106453f3c_tn,https://shopee.co.th//ปลาช่อนแดดเดียวตัวเล็ก-ไร้ก้างคละไซส์-150บาท-ขนาด-5-10ตัว-500-กรัม-สด-ใหม่-สะอาด-i.61797571.3301708468?position=113,3301708468
100,ปลาหวาน ปลาทูงา 🐟🐟 แพ็ค 500 กรัม,55.0,general,4.7503,7500.0,จังหวัดชลบุรี,https://cf.shopee.co.th/file/d3a0d1f2a7c9653ead08b7462a4542fa_tn,https://shopee.co.th//ปลาหวาน-ปลาทูงา-🐟🐟-แพ็ค-500-กรัม-i.23183981.474838928?position=114,474838928
101,ปลาช่อน🐟ปลาจิ๊กโก๋🐟ปลาหัวขาดSizeกลาง(บาง)​ขนาด300กรัม-500กรัม,95.0,ร้านแนะนำ,4.8777,539.0,จังหวัดสมุทรปราการ,https://cf.shopee.co.th/file/8d41707b26e55ab668b1f006a6bbbe2f_tn,https://shopee.co.th//ปลาช่อน🐟ปลาจิ๊กโก๋🐟ปลาหัวขาดSizeกลาง(บาง)​ขนาด300กรัม-500กรัม-i.220988426.7252379778?ads_keyword=wkdaelpmissisiht&adsid=3142164&campaignid=1828220&position=115,7252379778
102,ปลาอินทรีเค็มแพ็คซีลสุญญากาศ 6 ชิ้น สูตรเค็มน้อย (400-450 กรัม) จากชาวประมงโดยตรง,219.0,ร้านแนะนำ,4.8814,2200.0,จังหวัดสงขลา,https://cf.shopee.co.th/file/be0f10ecd981491fe0808a4ef72a5bb3_tn,https://shopee.co.th//ปลาอินทรีเค็มแพ็คซีลสุญญากาศ-6-ชิ้น-สูตรเค็มน้อย-(400-450-กรัม)-จากชาวประมงโดยตรง-i.2704484.4836889129?ads_keyword=%E0%B8%9B%E0%B8%A5%E0%B8%B2%E0%B9%80%E0%B8%84%E0%B9%87%E0%B8%A1&adsid=2629276&campaignid=1565047&position=116,4836889129
103,ปลาอินทรีย์เค็มหอม แบบเป็นตัว ตัวละ 1500 กรัม - 500กรัม กิโลกรัม ละ 400 บาท จากเรือของเราเอง,360.0,ร้านแนะนำ,4.8862,600.0,จังหวัดตราด,https://cf.shopee.co.th/file/1ecc25ca7157f5e831fba8f62b791d7f_tn,https://shopee.co.th//ปลาอินทรีย์เค็มหอม-แบบเป็นตัว-ตัวละ-1500-กรัม-500กรัม-กิโลกรัม-ละ-400-บาท-จากเรือของเราเอง-i.109694863.6624622714?ads_keyword=wkdaelpmissisiht&adsid=3489549&campaignid=770690&position=117,6624622714
104,ราคาส่ง !! แก้ไขปัญหาการประมงสุทธิประมงกรงปลาสุทธิกุ้ง ลอกดักกุ้ง 4 หลุม 6 หลุม 8 หลุม ตุ้มดักกุ้ง กุ้ง ตกปลา,35.0,general,4.5,103.0,จังหวัดปทุมธานี,https://cf.shopee.co.th/file/2a1ee96f5d3c7775da5bfcb6c5990e06_tn,https://shopee.co.th//ราคาส่ง-!!-แก้ไขปัญหาการประมงสุทธิประมงกรงปลาสุทธิกุ้ง-ลอกดักกุ้ง-4-หลุม-6-หลุม-8-หลุม-ตุ้มดักกุ้ง-กุ้ง-ตกปลา-i.195237879.4997194093?ads_keyword=wkdaelpmissisiht&adsid=12488877&campaignid=7168831&position=118,4997194093
105,คอนโดตากปลาS/M/L/XL ที่ตากอาหาร3ชั้น ที่ตากอาหารคอนโด 4 ชั้น มุ้งตากอาหาร  มี4 ขนาด พร้อมซิปปิดกันแมลง-753,53.0,general,4.7724,1800.0,จังหวัดกรุงเทพมหานคร,https://cf.shopee.co.th/file/6e6ad7a0e164f5a37258bc7b5d781de1_tn,https://shopee.co.th//คอนโดตากปลาS-M-L-XL-ที่ตากอาหาร3ชั้น-ที่ตากอาหารคอนโด-4-ชั้น-มุ้งตากอาหาร-มี4-ขนาด-พร้อมซิปปิดกันแมลง-753-i.393008842.4880815524?ads_keyword=%E0%B8%84%E0%B8%AD%E0%B8%99%E0%B9%82%E0%B8%94%E0%B8%95%E0%B8%B2%E0%B8%81%E0%B8%9B%E0%B8%A5%E0%B8%B2%E0%B8%A1%E0%B8%B8%E0%B9%89%E0%B8%87%E0%B8%95%E0%B8%B2%E0%B8%81%E0%B8%AD%E0%B8%B2%E0%B8%AB%E0%B8%B2%E0%B8%A3&adsid=7472757&campaignid=4125727&position=119,4880815524
106,มุ้งดักปลา แบบผูกก้น ตาข่ายดักปลา ดักจับกุ้งปลา  ที่ดักปลา ตาข่ายดักกุ้ง กระชังปลา 6 หลุม และ 8 หลุม,39.0,ร้านแนะนำ,4.7181,91300.0,จังหวัดกรุงเทพมหานคร,https://cf.shopee.co.th/file/5b391103f6c526cc3d8cba1474dc09e1_tn,https://shopee.co.th//มุ้งดักปลา-แบบผูกก้น-ตาข่ายดักปลา-ดักจับกุ้งปลา-ที่ดักปลา-ตาข่ายดักกุ้ง-กระชังปลา-6-หลุม-และ-8-หลุม-i.244198924.6029688808?ads_keyword=%E0%B8%9B%E0%B8%A5%E0%B8%B2&adsid=1577612&campaignid=1020427&position=120,6029688808
107,"มุ้งดักปลา ที่ดักกุ้งฝอย ตาข่ายดักปลา อุปกรณ์ตกปลา ที่ดักปลา มองดักปลา กระชังปลา 4,6,8,12,16 ช่อง",19.0,ร้านแนะนำ,4.6111,675.0,จังหวัดกรุงเทพมหานคร,https://cf.shopee.co.th/file/b12e5973b8fe45967668b39469156f11_tn,https://shopee.co.th//มุ้งดักปลา-ที่ดักกุ้งฝอย-ตาข่ายดักปลา-อุปกรณ์ตกปลา-ที่ดักปลา-มองดักปลา-กระชังปลา-4-6-8-12-16-ช่อง-i.40522279.4389372710?ads_keyword=%E0%B8%95%E0%B8%81%E0%B8%9B%E0%B8%A5%E0%B8%B2&adsid=9574261&campaignid=5461999&position=121,4389372710
108,ปลาดุกแดดเดียว 1 กิโลกรัม,160.0,general,0.0,4.0,จังหวัดสมุทรสาคร,https://cf.shopee.co.th/file/4cb815afacd7beb1e622ca42cd5c2491_tn,https://shopee.co.th//ปลาดุกแดดเดียว-1-กิโลกรัม-i.479649911.10016379990?ads_keyword=%E0%B8%9B%E0%B8%A5%E0%B8%B2%E0%B8%94%E0%B8%B8%E0%B8%81&adsid=10810954&campaignid=6206480&position=122,10016379990
109,มุ้งคอนโดตากอาหาร คอนโดตากปลา มุ้งตากอาหาร ที่ตากอาหาร 3 ชั้น พร้อมซิปปิดกันแมลง Food Dehydrator Rack,85.0,ร้านแนะนำ,4.849,23200.0,จังหวัดสมุทรปราการ,https://cf.shopee.co.th/file/868193bccf29763e3ff9bbeabda1aa77_tn,https://shopee.co.th//มุ้งคอนโดตากอาหาร-คอนโดตากปลา-มุ้งตากอาหาร-ที่ตากอาหาร-3-ชั้น-พร้อมซิปปิดกันแมลง-Food-Dehydrator-Rack-i.153692679.2314623145?ads_keyword=%E0%B8%84%E0%B8%AD%E0%B8%99%E0%B9%82%E0%B8%94%E0%B8%95%E0%B8%B2%E0%B8%81%E0%B8%9B%E0%B8%A5%E0%B8%B2&adsid=524484&campaignid=493881&position=123,2314623145
110,[พร้อมส่ง] ปลาช่อนแดดเดียวแล่ก้าง หั่นเสร็จ เค็มน้อย [ทอดฟรี] แพ็คละ 450-500กรัม,200.0,general,4.8868,186.0,จังหวัดสิงห์บุรี,https://cf.shopee.co.th/file/bd61a34d3d8cfb7694a5b289dde3c5a1_tn,https://shopee.co.th//-พร้อมส่ง-ปลาช่อนแดดเดียวแล่ก้าง-หั่นเสร็จ-เค็มน้อย-ทอดฟรี-แพ็คละ-450-500กรัม-i.63399684.3729567102?ads_keyword=wkdaelpmissisiht&adsid=2250500&campaignid=1365625&position=124,3729567102
111,ปลาช่อนชิ้นแดดเดียว  500 กรัมส่งขนส่ง⚠️⚠️อ่านก่อนสั่ง COVID ช่วงนี้ขนส่งงดเข้าพื้นที่ กทม,130.0,general,4.812,2100.0,จังหวัดสมุทรปราการ,https://cf.shopee.co.th/file/bc8250ec8aaa1238beada1d98a746900_tn,https://shopee.co.th//ปลาช่อนชิ้นแดดเดียว-500-กรัมส่งขนส่ง⚠️⚠️อ่านก่อนสั่ง-COVID-ช่วงนี้ขนส่งงดเข้าพื้นที่-กทม-i.82098483.4010239976?position=125,4010239976
112,ปั้นสิบ ไส้ปลาเข้มข้นครบรส เจ้าดังสงขลากว่า20ปีปั้นขลิบ500กรัม #สูตรข้มข้นครบรส #ทำเช้าส่งบ่าย,75.0,general,4.8333,6700.0,จังหวัดสงขลา,https://cf.shopee.co.th/file/5a842a8db6b33433141feaf93e3bef48_tn,https://shopee.co.th//ปั้นสิบ-ไส้ปลาเข้มข้นครบรส-เจ้าดังสงขลากว่า20ปีปั้นขลิบ500กรัม-สูตรข้มข้นครบรส-ทำเช้าส่งบ่าย-i.22449094.804883091?position=126,804883091
113,ปลาหวาน ปลาหวานตัว เกรด A เนื้อปลา90% ผลิตจากเนื้อปลาไล้กอแท้ ปลาทะเลสด สะอาด 3 รส อร่อย 5 ดาว  คุณภาพส่งออก,35.0,general,4.8127,1100.0,จังหวัดราชบุรี,https://cf.shopee.co.th/file/664e206f39320d222d4e34817eed74c9_tn,https://shopee.co.th//ปลาหวาน-ปลาหวานตัว-เกรด-A-เนื้อปลา90-ผลิตจากเนื้อปลาไล้กอแท้-ปลาทะเลสด-สะอาด-3-รส-อร่อย-5-ดาว-คุณภาพส่งออก-i.315869881.6290660375?position=127,6290660375
114,(ขายดี) ปลาหลด ปลาหลดตากแห้ง 1 แพค 100 กรัม ปลาธรรมชาติ ปลาน้ำจืด ปลาตากแห้ง ตากแห้งมากไร้กลิ่นเหม็น สด สะอาด,100.0,general,4.7632,188.0,จังหวัดนนทบุรี,https://cf.shopee.co.th/file/9608ae6f15b89b87bd73445d0176db06_tn,https://shopee.co.th//(ขายดี)-ปลาหลด-ปลาหลดตากแห้ง-1-แพค-100-กรัม-ปลาธรรมชาติ-ปลาน้ำจืด-ปลาตากแห้ง-ตากแห้งมากไร้กลิ่นเหม็น-สด-สะอาด-i.232622828.4870285826?position=128,4870285826
115,🔥ส่งไว🔥ปลาอินทรีย์​เค็ม🐟เกรดAAAคัดพิเศษ​390กรัม​ 100บาท,95.0,general,4.8602,1000.0,จังหวัดสงขลา,https://cf.shopee.co.th/file/90a6116ea6d80ec0cad7d9769b76822f_tn,https://shopee.co.th//🔥ส่งไว🔥ปลาอินทรีย์​เค็ม🐟เกรดAAAคัดพิเศษ​390กรัม​-100บาท-i.53961650.6610757923?position=129,6610757923
116,โค้ด 7JX2GJRH ปั้นสิบไส้ปลา อร่อยที่สุดในโลก,53.0,ร้านแนะนำ,4.9051,6800.0,จังหวัดนครปฐม,no image,https://shopee.co.th//โค้ด-7JX2GJRH-ปั้นสิบไส้ปลา-อร่อยที่สุดในโลก-i.17245852.6416138457?position=130,6416138457
117,ปลาหวานขนาดมินิ พอดีทาน ราคาประหยัด สำหรับ1มื้อ,15.0,ร้านแนะนำ,4.7744,1100.0,จังหวัดสงขลา,no image,https://shopee.co.th//ปลาหวานขนาดมินิ-พอดีทาน-ราคาประหยัด-สำหรับ1มื้อ-i.31668920.8011044395?position=131,8011044395
118,ปลาอินทรีย์กรอบทรงเครื่อง ⭐️300กรัม ⭐️500กรัม,49.0,ร้านแนะนำ,4.9179,799.0,จังหวัดนนทบุรี,no image,https://shopee.co.th//ปลาอินทรีย์กรอบทรงเครื่อง-⭐️300กรัม-⭐️500กรัม-i.225710242.5020933604?position=132,5020933604
119,ปลาอินทรีย์เค็ม เต็มตัว (ไม่มียา)สินค้ามีรับประกัน สอบถามเพิ่มเติมก่อนสั่งได้นะค่ะ,353.0,ร้านแนะนำ,4.9578,811.0,จังหวัดสุราษฎร์ธานี,no image,https://shopee.co.th//ปลาอินทรีย์เค็ม-เต็มตัว-(ไม่มียา)สินค้ามีรับประกัน-สอบถามเพิ่มเติมก่อนสั่งได้นะค่ะ-i.46449532.2095970794?position=133,2095970794
120,🐟 ปลาจิ้งจั้ง 500 กรัม 🐟 ปลาล้วนสามรส / สมุนไพร จากทะเลใต้ ปลาฉิ้งฉ้าง ปลากรอบ ปลากรอบสามรส (แพคถุงซิลอย่างดี),95.0,general,4.8062,11000.0,จังหวัดสงขลา,no image,https://shopee.co.th//🐟-ปลาจิ้งจั้ง-500-กรัม-🐟-ปลาล้วนสามรส-สมุนไพร-จากทะเลใต้-ปลาฉิ้งฉ้าง-ปลากรอบ-ปลากรอบสามรส-(แพคถุงซิลอย่างดี)-i.41145410.733108730?position=134,733108730
121,ปลาฉิ้งฉ้างน้ำหนัก 0.5 kg. ปลาจากทะเลอันดามันภูเก็ต,59.0,general,4.854,630.0,จังหวัดภูเก็ต,no image,https://shopee.co.th//ปลาฉิ้งฉ้างน้ำหนัก-0.5-kg.-ปลาจากทะเลอันดามันภูเก็ต-i.34258594.5051479650?position=140,5051479650
122,Mama Cooking - เข่งติ่มซำ 5 6.5 8 นิ้ว เข่งปลาทู เข่งนึ่งปลา เข่งไม้ไผ่ ผลิตจากไม้ไผ่ธรรมชาติ พร้อม ถ้วยรองนึ่งสแตนเลส,23.0,ร้านแนะนำ,4.8357,1100.0,จังหวัดกรุงเทพมหานคร,no image,https://shopee.co.th//Mama-Cooking-เข่งติ่มซำ-5-6.5-8-นิ้ว-เข่งปลาทู-เข่งนึ่งปลา-เข่งไม้ไผ่-ผลิตจากไม้ไผ่ธรรมชาติ-พร้อม-ถ้วยรองนึ่งสแตนเลส-i.257268565.4556061034?position=141,4556061034
123,ปลาร้าปลากระดี่รสเด็ดสามารถนำไปใส่แกงหรือกินกับข้าวเหนียวร้อนๆๆได้,65.0,general,4.9141,617.0,จังหวัดชัยภูมิ,no image,https://shopee.co.th//ปลาร้าปลากระดี่รสเด็ดสามารถนำไปใส่แกงหรือกินกับข้าวเหนียวร้อนๆๆได้-i.222997860.4323118863?position=142,4323118863
124,ปลาวง ปลาแห้ง ปลาน้ำจืด 13 วง 100 บาท,100.0,general,4.8947,472.0,จังหวัดพระนครศรีอยุธยา,no image,https://shopee.co.th//ปลาวง-ปลาแห้ง-ปลาน้ำจืด-13-วง-100-บาท-i.83039835.5056885058?position=143,5056885058
125,ปลาไส้ตันแห้ง ตัวขาว สะอาด ไม่เค็ม ทอดกรอบอร่อยสุดๆ,120.0,ร้านแนะนำ,4.8623,532.0,จังหวัดประจวบคีรีขันธ์,no image,https://shopee.co.th//ปลาไส้ตันแห้ง-ตัวขาว-สะอาด-ไม่เค็ม-ทอดกรอบอร่อยสุดๆ-i.91639966.6918033394?position=144,6918033394
