product_id,brand,description
1,BetterFungi,no description
2,365 by WFM,"
Brought to you by Whole Foods Market.  The packaging for this product has a fresh new look. During this transition, you may get the original packaging or the new packaging in your order, but the product and quality is staying exactly the same. Enjoy!


Our Organic Cream of Mushroom Condensed Soup is the secret weapon you need for a flavorful meal or side dish in merely minutes. Made with organic mushrooms, cream and a wonderful blend of spices, keep this one in sight, you never know when you'll need it!


60 calories per serving.


Low Fat, no sugar added.


Certified Organic, Vegetarian.

"
3,ONETANG ,"
Shiitake slices rehydrates quickly, have a great flavor and are just chewy enough.


Mushroom slices are fragrant and rich, the meat is thick and thin, the species is authentic and the source is selected. Conform to the laws of nature and pick them in time, 100% New crop.


No Fumigation Sulfur, No Artificial Additive, strict control of the water standards, moisture content less Than 13%.


Shiitake slices are of excellent quality and color and are sliced in varying sizes.


BRC, ISO22000, HACCP certificated factory.

"
4,SunStyle Home,"
 Make sure this fits
by entering your model number.


Unique design: Made of 100% Microfiber,soft and Lightweight,King size quilt set is embroidered with delicate and elegant patterns, making the bedspread a work of art to decorate the bed. Our bedspread want to help you find inner peace for everyday living, not only in gentle appearance, but also in soft touch.Two patterns for you to choose,exquisite design to bring you pleasure.


Decor Your Bedroom And Good Gift:Add elegance to your bedroom with a solid coverlet quilt coming in an array of colors. Perfect for families with pets or children. Enjoy in the bedroom, guest room, kids room, RV, vacation home. Great gift idea for men and women, boys and girls, kids and teens of all ages! Give the gift of comfort for Birthdays - Bridal & Baby Shower - Mother's - Father's Day and Christmas.


Comfortable&Soft&Durable: Made of 100% microfiber cover and filling, which good comfort and durability.Our Quilt Set can be used all year round to ensure your experience.The cozy to keep you comfortable all night long.Can be used all the season.


Easy care & Cleaning: Machine washable in cold water and tumble dry on low.Dries quick on tumble dry low.Not easy to fade,durable.In the night, you can sleep sweetly, in the morning, you can be refreshed.


100% Satisfaction Service:We try our best to serve our customers, and If you are not satisfied with your purchase at any point and for any reason, you can return it with no questions asked.

"
